Tweets,Attributes
My deepest condolences are with the victims and families of those killed and injured in the senseless tragedy last night in Las Vegas.,1
I join my community in mourning the victims of the tragedy in Las Vegas. My deepest condolences to their families.  https://t.co/DMSVu6TXhA,1
"Heartbroken over the tragedy in Las Vegas. I’m thinking about the victims and their loved ones, and about how we can make this stop.",3
"Absolutely heartbreaking news coming out of Las Vegas overnight. Praying for the victims, their families, and first responders.",1
Praying for every victim affected by this horrific tragedy in Las Vegas and their loved ones.,1
"Heartbroken by the horrific shooting in Las Vegas. Our prayers are with the victims, their loved ones, and the entire community.",1
Joined CNN @NewDay to discuss the tragedy in Las Vegas &amp; new developments in Russia investigation. Watch here:  https://t.co/YsMHjKHtz2,0
"My heart breaks with sorrow for Las Vegas, but my stomach churns with anger. I am furious.",2
My heart breaks for Las Vegas - prayers to families and loved ones. The nation's conscience must be galvanized.,1
My statement on the tragic events in Las Vegas:  https://t.co/50RaBFTzp5,0
"Praying for the victims, their families, and all those who responded to this horrific shooting in Las Vegas.",1
"Waking up to the horrifying news out of Vegas — I’m praying for the victims, their families and the brave first responders.",1
"Awful, awful scene in Las Vegas. My heart goes out to the victims and their families",1
"Steve Berger, father of 3 &amp; Shorewood resident, was among those killed in Las Vegas. A friend recalls Steve’s life:  https://t.co/EmaSjhS6IT",1
I'm sickened by the mass shooting in Las Vegas.  https://t.co/nTTslSPvfb,1
Our hearts break for the victims in Las Vegas &amp; their families. Follow @LVMPD for updates &amp; info on locating loved ones.,1
God bless the victims of the terrible and senseless shooting in Las Vegas.,1
What happened in Las Vegas is a tragedy. But it's one we continue to repeat. We need commonsense legislation to save innocent people.  https://t.co/cS6s1eoJI0,3
"It’s too late for the victims in Las Vegas, but it's not too late to prevent more innocent Americans from becoming victims of gun violence.",3
This morning all of our hearts are with Las Vegas and the families of those involved. Thank you to first responders and law enforcement.,1
"As we unite to grieve for the lives lost in Las Vegas, let us also unite to stop the terrible toll of gun violence in our country.",3
"My heart goes out to victims of this horrific attack, to their loved ones, &amp; to all of those affected. Stay strong, Las Vegas.",1
Honored to welcome @NancyPelosi to the Las Vegas Community Healing Garden to remember the victims of the #1October shooting. We will always be #VegasStrong.  https://t.co/FOiut8H4Tf,2
A new #LasVegas has risen after the 10/1 shooting. Watch my speech memorializing the victims &amp; heroes  https://t.co/z1RQbYubTR #VegasStrong,1
MOMENTARILY: I’ll be speaking on the Senate floor to memorialize the victims of the Las Vegas shooting &amp; honor the many heroes #VegasStrong.,1
TODAY AT 2:30 pm PT: I'll be delivering a speech honoring victims &amp; heroes of the Las Vegas shooting. Read more:  https://t.co/1BbJ34pW6N,1
Joined @SenCortezMasto in asking @SocialSecurity how it will assist the victims &amp; families of the Las Vegas attack:  https://t.co/ptxlBeDspR,1
Thankful the Senate adopted a resolution I intro'd w/@SenCortezMasto memorializing the Las Vegas shooting victims  https://t.co/NvVuL7rhuA,1
Moments ago I intro'd a resolution w/@SenCortezMasto memorializing the victims of the Las Vegas shooting. Read more:  https://t.co/ilSkZtM4Il,1
I spoke on the House Floor to honor the victims of #1October &amp; thank all the heroes in our community who stepped up to help. #VegasStrong  https://t.co/AB2KAzU5up,1
Celebrating the strength of our community &amp; honoring #1October victims at 1st AME Church w/ Pastor Williamson &amp; @BwayInTheHood. #VegasStrong  https://t.co/Fp6IN6iESS,1
Joined Bishop Leon Smith &amp; congregation at Pentecostal Temple Church for a powerful service memorializing victims of #1October. #VegasStrong  https://t.co/h352URjbGE,1
"Beautiful @unlvfootball pregame ceremony honoring victims, 1st responders, law enforcement &amp; medical personnel. #UNLV #1October #VegasStrong  https://t.co/PV34Ban8Ns",1
.@CityOfLasVegas faith &amp; unity event where 58 white doves were released to honor Sunday's victims. #VegasStrong  https://t.co/K0mU2Ao69F,1
"No law would have stopped Las Vegas shooter, Feinstein says  https://t.co/VWF99BvH3m via @politico",3
500 Americans were shot &amp; 58 killed in Las Vegas. Trump's response to NYC was to blame Democrats &amp; specifically Senator Schumer hours later.  https://t.co/hXGdCjWFv2,3
Bump stocks are still readily available and on the market after Vegas shooting. This is outrageous and should NOT be the case!,3
"Honored to meet with survivors from #1October. As members of Congress, we have a solemn responsibility to protect our citizens and ensure another mass shooting never happens again. #VegasStrong  https://t.co/RtbIHWzK9d",3
My 2nd newsletter on exploitation of tragedy for political gain. We must come together #VegasStrong.  https://t.co/lCzS282ddi  https://t.co/PsGGCi408N,2
Thank you to these @Everytown Vegas shooting survivors for sharing your stories. Together we'll fight to end #gunviolence &amp; enact #gunsafety  https://t.co/8rSIYzXRtW,3
"1 month ago today, a senseless shooting forever altered the lives of countless families in Las Vegas &amp; across the country. #October1 #VegasStrong  https://t.co/s6GYWPSMDp",1
Bump stock manufacturer Slide Fire has resumed taking orders for bump stocks.  It's been one month since the Las Vegas shooting.,3
"As we continue to grieve together, we also continue to show the world that we're #VegasStrong. (2/2)  https://t.co/IRvc4zfNpq",2
"One month after the #LasVegasShooting our hearts still hurt for the victims and their families, as well as the wounded. (1/2)",1
Almost a month since the Las Vegas shooting &amp; Congress has done nothing. Rs are trying to pass the buck. My speech on the House Floor:  https://t.co/V4chBCUvcr,3
"Just one month after the mass shooting in Las Vegas, our hearts are heavy again following the shooting in Sutherland Springs.",0
,
"My Keeping Americans Safe Act would ban large capacity magazines used for mass killing in Vegas, Texas &amp; more  https://t.co/gBB3DBrJYB",3
36 days of thoughts and prayers from Congress since the #LasVegasShooting obviously hasn't worked. We need gun reform NOW.,3
"Like Orlando &amp; Las Vegas, we mourn those we lost too soon &amp; pledge support to the injured. But we cannot accept these crimes as normal.",1
"What an incredible tribute to #1October victims, their families, &amp; the spirit of our resilient &amp; caring community, @NellisAFB. #VegasStrong  https://t.co/duYcsa3lgn",1
I applaud the IRS' approval of 501 (C) (3) status for the Las Vegas Victims Fund.  https://t.co/qfxHOHkD32,3
40 moments of silence since 2012 -- including two for Las Vegas -- and zero commonsense gun bills signed into law. It’s time to stand up for families of gun violence victims and #HonorWithAction,3
Tell Republicans to help us prevent predatory lenders from attacking families in Las Vegas and across the country.  https://t.co/lp357auVix,3
Illinois native Heather Gooze is a Las Vegas shooting survivor. Listen to her describe the heartbreaking story of what she saw that night. You won't be able to forget it.  Retweet if you think Congress must ban bump stocks once and for all.  https://t.co/achrjmxvcT,3