,url,text,sentiment,publish_date,title,themes,media_id,media_url
15,http://www.csmonitor.com/The-Culture/Articles-on-Christian-Science/2013/1101/Facing-the-anniversary-of-a-tragedy,want bridge divides reach everyone selection viewed stories week monitor website every saturday hear special editorial projects new product information upcoming events occasional select stories monitor empower uplift every weekday update major political events candidates parties twice week twice week stay informed latest scientific discoveries breakthroughs every tuesday weekly digest monitor views insightful commentary major events every thursday latest book reviews author interviews reading trends every friday weekly update music movies cultural trends education solutions every thursday five recent christian science articles spiritual perspective every monday christian science perspective superstorm sandy remembered effort love-affirming instead loss-affirming november 1 2013 week marks first anniversary superstorm sandy – largest atlantic storm record one affected residents seven countries across 24 us states live hundreds miles sandy path storm hit close home different way sinking tall ship hms bounty loss captain female crew member 20s worked deckhand similar vessel bounty captain one co-workers several months many sailing community around world rejoiced safe heroic rescue majority bounty crew also overwhelming surge sadness loss life loss beloved vessel recently watched date approach calendar wondered spiritual thinkers best support anniversaries one – devastating storm passing loved one mass shooting specific terror attack resurfaces minds hearts certainly natural desire honor memory loved ones might also worthwhile ask whether spirit commemoration loss-affirming love-affirming student christian science regularly turn bible instruction support life christ jesus provides powerful examples love-affirming action face loss jesus examples walking waves stilling storm give us permission get top waves sadness silence stormy blasts regret compassionate presence funeral see luke chap 7 halted procession grief reversed evidence death sorrow life rejoicing passing friend lazarus master christian moved beyond response one point weeping groaning see john 11:33 35 command stone rolled away tomb lazarus could loosed burial shroud primary work science health key scriptures discoverer christian science mary baker eddy writes jesus said john viii 51 man keep saying shall never see death. statement confined spiritual life includes phenomena existence jesus demonstrated healing dying raising dead pp 429-430 jesus must fathomless sense presence power continuity divine love order triumph repeatedly destruction death including healing record stands us follow today year ago week best tried prayerful supportive everyone feeling effects superstorm sandy weeping groaning mode struggled grief loss surrounding bounty captain cried wednesday night testimony meeting local christian science church toward end service however received clear healing message thought god miners. get monitor stories care delivered inbox precise reference another situation prayed two years earlier 33 chilean miners trapped mine surface seemed like strange juxtaposition – reminder joyous successful return miners safety versus recent loss life ship bounty recognized message powerful assurance god love scene despite outward appearances day reminded bounty reaffirm god miners comforts companions captain crew family within tall ship community may take ongoing practice consistently affirm love god midst trials wake memories thankfully christ jesus charts course fixes thought omnipotence omnipresence divine love way learn know rejoice apostle paul assurance corinthians death swallowed victory corinthians 15:54 already subscriber login monitor journalism changes lives open too-small box people think live believe news expand sense identity possibility beyond narrow conventional expectations work possible without support already subscriber login link copied dear reader year ago happened upon statement monitor harvard business review – charming heading things interest many things end meaningful writes social scientist joseph grenny come conference workshops articles online videos began chore ended insight work kenya example heavily influenced christian science monitor article forced read 10 years earlier sometimes call things boring simply lie outside box currently in. come punchline joke monitor would probably seen global fair insightful perhaps bit earnest bran muffin journalism know change lives going argue change lives precisely force open too-small box human beings think live monitor peculiar little publication hard world figure run church church members converting people known fair even world becomes polarized time since newspaper founding 1908 mission beyond circulation want bridge divides kicking door thought everywhere saying bigger capable realize prove it. looking bran muffin journalism subscribe monitor 15 get monitor weekly magazine monitor daily email unlimited access csmonitor.com subscribe insightful journalism less noise insight follow us,"{'neg': 0.112, 'neu': 0.673, 'pos': 0.215, 'compound': 0.9976}",2013-11-01 07:52:47,Facing the anniversary of a tragedy,,3,http://csmonitor.com
16,http://feeds.foxnews.com/~r/foxnews/national/~3/KG7IemQ_sgU/,"material may published broadcast rewritten redistributed ©2021 fox news network llc rights reserved quotes displayed real-time delayed least 15 minutes market data provided factset powered implemented factset digital solutions legal statement mutual fund etf data provided refinitiv lipper richmond va. – state supreme court reversed jury wrongful death verdict state stemming killings 32 students faculty virginia tech 2007 decision issued thursday justices say state duty warn students potential acts lone student-gunman initially shot two dormitory killing 30 people killed jurors montgomery county ruled march 2012 state negligent deaths two students killed tech blacksburg campus deadliest mass shooting modern u.s. history jurors awarded families students 4 million judge reduced award state cap 100,000 family get stories need-to-know powerful name news delivered first thing every morning inbox subscribed 've successfully subscribed newsletter material may published broadcast rewritten redistributed ©2021 fox news network llc rights reserved quotes displayed real-time delayed least 15 minutes market data provided factset powered implemented factset digital solutions legal statement mutual fund etf data provided refinitiv lipper","{'neg': 0.146, 'neu': 0.735, 'pos': 0.119, 'compound': -0.8519}",2013-10-31 14:07:49,State justices reverse wrongful death verdict against state stemming from Va. Tech massacre,,1092,http://www.foxnews.com/
17,http://dailycaller.com/2013/11/15/wayne-lapierre-obamas-obsession-with-our-gun-rights/,"wayne lapierre nra barack obama candidate promised americans 2008 take guns away president united states 2013 embraced universal firearm confiscation australia england—schemes saw destruction hundreds thousands registered legal firearms outlawed taken threat force licensed gun owners governments obama revealed gun control endgame sept. 22 2013 political speech solemn memorial 12 washington navy yard victims murdered deranged killer sept. 16 2013 obama coldly used madness delusional lone mass-murderer claim rampage ought lead sort transformation … ought obsess us. breath obama defined personal obsession notion transformation ordinary american gun owners happened countries experienced similar tragedies united kingdom australia … mobilized changed. washington post praised obama demand transformation australia-style gun roundup destruction commonsense. u.s. media either ignored glossed obama embrace aussie model gun bans australian broadcasting corporation abc sept. 23 2013 led coverage u.s. president barack obama says time america follow example countries like australia comes gun control. sept. 23 2013 headline obama hails australian gun laws sky news led coverage president barack obama used australia positive example country tightened gun laws mass shooting. virtually u.s. media outlet honest enough describe actually happened formerly free english speaking cousins direct result mass murders committed lone criminally insane killers reaction murder 16 people hungerford 1987 insane killer registered semi-automatic rifles great britain banned confiscated licensed owners following 1996 massacre school children dunblane scotland registered handguns declared contraband taken destroyed owners .22-cal handguns allowed keep government approved facilities outlawed collected destroyed—because actions two criminal lunatics heels dunblane killings 1996 insane murderer australia obtained one semi-automatic rifles killing owner wife slaughtered 34 people port arthur tasmania result semi-automatic rifles including .22s semi-automatic shotguns pump shotguns banned licensed owners required turn destruction government england called buyback. reality buybacks theft—made possible using pre-existing government lists licensed owners registered guns explains obama obsessive call universal background checks —a scheme easily morphed gun-owner registration president notion crafting u.s. version australian/british tyranny come vacuum preceded spate articles designed introduce public concept key propaganda push jan. 16 2013 new york times op-ed former aussie prime minister john howard titled went guns obama too. howard touted politics forcibly disarming licensed law-abiding australians city dwellers supported plan strong resistance rural australia many farmers resented told surrender weapons used safely lives penalizing decent law-abiding citizens criminal behavior others seemed unfair many … felt bewildered betrayed new laws understood misgivings yet felt alternative. howard boasted almost 700,000 guns bought back destroyed—the equivalent 40 million guns united states. emphasis added understand australia perhaps urbanized nation world coastal non-gun-owning city dwellers dwarf rural populations long firearm tradition today urbanites places like sydney reaping real consequences john howard multiple buybacks. criminal violence illegal firearms urban centers soaring try headlines one month u.s. washington navy yard murders ballina shire advocate aug. 21 2013 new plan unveiled tackle out-of-control gun violence. news limited network aug. 2 2013 australia staring barrel gun crisis gun battle going australia bike gang members drug dealers gun regular basis sending fear community authorities seem fighting losing battle keep firearms hands. mass murders howard summed optic freedom saying hate guns wrote new york times op-ed fundamental problem ready availability high-powered weapons enabled people convert murderous impulses mass killing. people ordinary citizens confiscatory bans hysterical response insanity one person one crazy person port arthur one crazy person hungerford one crazy person dunblane one crazy person aurora colo. one crazy person sandy hook conn. one crazy person washington navy yard killers one thing common totally recognizably deranged nobody reacted insanity nobody interceded case navy yard killer—a contract worker—police warned navy violent schizophrenic hearing voices tormented extremely low frequency electromagnetic waves. record firearm abuse yet held secret security clearance carried valid navy id allowed free access military installations said meet press equally important navy yard killings lax base security amounts gun-free zone stand need look letting men women know firearms trained best protect survive. yet obama gun-ban cabal demand millions sane ordinary peaceable americans—you me—pay price lone sociopaths loss rights usa today reported obama plans bring australia/uk transformation obsession bear 2014 congressional elections say bring americans—by millions upon millions—will fight defend freedom. join nra – click","{'neg': 0.296, 'neu': 0.609, 'pos': 0.095, 'compound': -0.9995}",2013-11-15 10:59:55,Wayne LaPierre: Obama’s obsession with our gun rights,,18775,http://dailycaller.com
18,http://dailycaller.com/2013/10/24/bloomberg-uses-photos-of-mass-murderers-to-attack-cuccinelli-video/,virginia gubernatorial race gotten nasty new york mayor michael bloomberg gone far use photos mass murderers attack republican candidate ken cuccinelli bloomberg big proponent gun control laws running ads cuccinelli ahead nov. 5 election independence usa pac new ad 1.2 million buy airing television northern virginia criticizes cuccinelli views gun control showing photos dangerously mentally ill criminals country gruesome shootings recent history among make appearance ad virginia tech massacre shooter seung-hui cho sandy hook elementary school shooter adam lanza aurora movie theater shooter james holmes even though region still recovering mass shooting washington navy yard last month ad includes photo security camera shooter aaron alexis holding remington 870 shotgun rampage gun show loophole ad begins means anyone buy gun without background check dangerously mentally ill criminals endangering families. ad continues ken cuccinelli opposed closing gun show loophole comprehensive background checks gun shows criminals dangerously mentally ill siding nra undermining law enforcement. bloomberg misleading tying cuccinelli so-called gun show loophole mass murders gun rights activists often point proposed legislation would stopped shootings none murderers impeded background checks virginia tech shooter cho passed fbi nics background check navy yard shooting alexis passed fbi nics background check additional virginia background check system newtown lanza killed mom passed background checks steal guns use rampage aurora theater shooting holmes passed fbi nics background check system bloomberg said pac designed support candidates referenda local state federal races across country getting involved virginia governor race less two weeks go democrat terry mcauliffe solid lead polls watch follow alex twitter,"{'neg': 0.27, 'neu': 0.702, 'pos': 0.028, 'compound': -0.9972}",2013-10-24 11:36:26,Bloomberg uses photos of mass murderers to attack Cuccinelli [VIDEO],,18775,http://dailycaller.com
19,http://www.msnbc.com/msnbc/half-the-country-want-stricter-gun-laws,featured shows msnbc tv shows follow msnbc brands shows americans remain divided gun-control laws almost one year shooter killed 26 people sandy hook elementary school almost half—49 —of country believes legislation strict according new gallup poll released friday thirty-seven percent think laws kept 13 want less strict laws public support stricter gun laws 58 days shooting newtown conn. opposition banning handgun ownership remains 74 record-high last year one four americans believe law limit possession authorized personnel according poll majority democrats—77 —are favor tightening gun laws 23 republicans voted similarly additionally 37 democrats 16 republicans support ban possession handguns favorability stricter gun laws fell record lows—44 43 —between 2009 2011 gallup released poll day destruction began sandy hook elementary school building newtown residents voted favor earlier month accept 50 million grant demolish structure 20 students six educators killed dec. 14 students currently attend classes nearby chalk hill middle school monroe razing expected end ahead shooting one-year anniversary new building could open december 2016 related sandy hook elementary school demolition begins fatal rampages shooting attempts gunmen around country–in colorado connecticut virginia dc recently nevada–set national call stricter gun policies debate faded headlines senate april failed pass bipartisan background checks bill president last month said fears mass killings new normal confronting yet another mass shooting president obama said following last month rampage washington navy yard today happened military installation nation capital targeted military civilian personnel. 2021 nbc universal,"{'neg': 0.152, 'neu': 0.785, 'pos': 0.063, 'compound': -0.9786}",2013-10-25 09:24:57,Americans split on stricter gun laws,,359084,http://www.msnbc.com/#superglue
20,http://www.msnbc.com/msnbc/moving-forward-guns-without-congress,"featured shows msnbc tv shows follow msnbc brands shows weeks since navy yard shooting 17th mass shooting 2013 us favor common-sense reforms told repeatedly losing fight inaction congress deemed death knell gun reform gun lobby media true congress refuses move guns tried april vote u.s. senate came short – despite pleas newtown aurora families well moms like know children safer guns responsibly regulated people say lost gun reform seem think path changing laws culture federal legislation make mistake continue work hard get congress pass background check legislation congress gets act together get new congress continuing fight elsewhere taken struggle reform american businesses – winning mothers drunk driving began 1980 drinking driving generally accepted regular occurrence slowly tragic accidents much heartbreak madd helped change way americans thought alcohol driving due newfound stigma legal liability americans created concept designated drivers bartenders started calling cabs customers police set drunk driving checkpoints happy hour traffic state legislatures started passing laws made driving influence criminal act type cultural shift must happen guns little stigma attached customers bringing gun grocery store liability gun owners negligently shoot someone else whose gun used cause harm thanks hard work gun lobby gun manufacturers held liable products result manufacturers financial incentive make product improvements would prevent injuries save lives moms demand action gun sense america working hard affect shift members across country educating moms lax gun laws policies contribute much senseless death america continue work one law time one business time culture shifts back toward responsibility safety slowly making progress september starbucks formerly known friend gun enthusiasts reversed policy allowing guns inside stores previously store refused take stand banning guns result gun advocates armed everything glocks semi-automatic rifles regularly met local starbucks blatant displays intimidation bullying intended normalize open carry approach backfired months pressure moms demand action – including skip starbucks saturdays – starbucks ceo howard schultz announced guns longer welcome chain 12,000 coffee shops schultz told gun groups longer welcome stores earned back business moms across country took important stand business leader starbucks set example businesses across country shown ok stand acknowledge study study shown – safer guns present starbucks win behind us 're moving another national brand staples individual staples stores elected keep guns company yet policy ban guns stores nationwide given recent accidental shooting north carolina staples think time company step say firearms belong stores moms intensifying efforts hold company accountable right thing weeks months ahead put safety communities customers first giving politicians washington– waiting around either going keep fighting reform putting money principles supporting businesses act interest customer safety one thing listening naysayers given stakes high – damage great – sit back hope things change shannon watts founder moms demand action gun sense america 2021 nbc universal","{'neg': 0.203, 'neu': 0.64, 'pos': 0.156, 'compound': -0.9628}",2013-10-26 10:34:50,"Moving forward on guns, without Congress",,359084,http://www.msnbc.com/#superglue
21,http://www.nytimes.com/2013/11/01/us/virginia-tech-held-not-negligent-in-07-killings.html?partner=rss&emc=rss,"advertisement supported ravi somaiya virginia tech warnings students mass shooting began 2007 negligent state supreme court ruled thursday thwarting wrongful-death lawsuit brought behalf two students killed families students julia pryde erin peterson refused state settlement 2008 sought damages 10 million asserting university delayed campuswide alert might saved lives gunman seung-hui cho shot two students shortly 7 a.m. april 16 2007 campus authorities delayed alert order notify students families investigate court ruling thursday said alert went two hours later minutes mr. cho continued rampage killed 32 students faculty members killing lower court ruled last year delay negligent awarded families 4 million later reduced 100,000 supreme court disagreed based limited information school said said known reasonably foreseeable students norris hall would fall victim criminal harm. ruling much surprise said robert t. hall lawyer families duty protect duty keep safe duty ensure safety warn gunman loose university said pleased supreme court recognized corrected errors lower court resulted faulty jury verdict. advertisement","{'neg': 0.26, 'neu': 0.544, 'pos': 0.197, 'compound': -0.8934}",2013-11-01 01:16:12,Virginia Tech Held Not Negligent in ’07 Killings,,1,http://nytimes.com
22,http://www.salon.com/2013/11/05/study_white_racism_linked_with_opposition_to_gun_control_partner/,piece originally appeared pacific standard digest news yet another high-profile gun crime conversation inevitably comes back question stricter gun-control laws difficult pass country variety explanations course including political clout national rifle association also deeper psychological reasons many americans would rather endure mass shooting mass shooting rather agree restrictions gun ownership one appears ingrained racism implication newly published study finds link gun ownership opposition gun control symbolic racism —racist attitudes overt nevertheless color one view world research team led kerry brien monash university australia reports high score common measure racial resentment increases odds person gun house b opposed gun control holds true even explanatory variables including political party affiliation taken account statistics firearm-related suicides homicides u.s. might reasonably expected convince u.s. citizens action reducing gun ownership use would beneficial health researchers write online journal plos one yet u.s. whites oppose strong gun reform racial groups despite much greater likelihood whites kill guns suicide killed someone else. conclude paradoxical attitudes among american whites—who oppose measures would reduce risk violent death—can explained part anti-black prejudice. brien colleagues analyzed data several waves american national election studies large-scale surveys take place federal election years sample voters skewed slightly conservative half 52 percent sample gun home 66 percent opposed bans handguns home 52 percent reported support permits carry concealed handgun. providing detailed demographic information participants answered four questions taken symbolic racism scale specifically expressed level agreement disagreement one-to-five scale statements really matter people trying hard enough blacks would try harder could well whites. brien colleagues took range variables could influence attitudes toward guns equation including age income education level political ideology party identification whether person lived south measured whether implicitly racist attitudes predicted greater support guns gun rights indeed one point increase symbolic racism 50 percent greater odds gun home write 28 percent increase odds supporting permits carry concealed handguns. contrast correlation attitudes toward guns one question measured overt racism whether felt word violent described blacks researchers note fewer 10 percent participants strongly endorsed notion suspect significant number recoiled blatantly prejudiced tone answered negatively order avoid appearing racist. brien colleagues caution view racism underpins gun-related attitudes plausible supported evidence study shows correlation causation conceivable simply owning firearm may lead whites develop negative attitudes towards blacks write conceivable likely either way researchers note results indicate symbolic racism associated gun-related attitudes behaviors u.s. whites. unpleasant fact somehow addressed stringent gun control becomes reality copyright 2021 salon.com llc reproduction material salon pages without written permission strictly prohibited salon ® registered u.s. patent trademark office trademark salon.com llc associated press articles copyright 2016 associated press rights reserved material may published broadcast rewritten redistributed,"{'neg': 0.231, 'neu': 0.681, 'pos': 0.088, 'compound': -0.9977}",2013-11-05 09:44:18,Study: White racism linked with opposition to gun control,,1757,http://www.salon.com/
