,url,text,sentiment,publish_date,title,themes,media_id,media_url
23,http://www.theverge.com/2013/10/23/4947304/trauma-counseling-psychological-first-aid-new-study,"use cookies tracking technologies improve browsing experience site show personalized content targeted ads analyze site traffic understand audiences come learn opt-out read cookie policy please also read privacy notice terms use became effective december 20 2019 choosing accept consent use cookies tracking technologies filed go-to method trauma relief nobody knows psychological first aid actually works last month floodwaters dark silt mud devastated 1,500-square-mile area surrounding denver nine people lost lives survivors lost homes others could return damage since catastrophic days janine d'anniballe tried help many unlike responders delivering blankets food instead d'anniballe offering psychological first aid pfa developed several years ago technique primary mode immediately buffering traumatic effects surviving disaster designed stabilize victims often feel numb overwhelmed angry may eventually spiral depression hopelessness pfa widely used agencies like red cross world health organization last year alone example red cross used pfa sandy hook massacre hurricane sandy boston bombings psychologist training d'anniballe past six weeks meeting survivors vacant malls gutted neighborhoods usually five ten-minute encounters takes matter-of-fact approach topics like sleep quality diet deal insurance companies federal emergency management agency fema survivors emotional start impromptu counseling session non-sexy intervention non-sexy intervention sitting person distress validating overwhelming d'anniballe says 'm illusion person wo feel overwhelmed horrible many many times moment felt bit relief approach seems intuitively right restoring person sense self-efficacy also normalizing grief stress seems like obvious way calm trauma survivor enhance resiliency maybe even ward post-traumatic stress depression pouring time resources efforts might fruitless quandary though pfa widely adopted one empirical data validate whether helps harms survivors study sponsored national institute mental health nimh hopes start solving mystery critical even interventions best intentions may make difference worse yet may aggravate symptoms trauma meaning without research responders around world pouring time resources efforts might fruitless years ago dr. michael mccart clinician national crime victims research treatment center regularly treated traumatized sexual physical assault though 80 percent disaster trauma survivors wo experience long-term psychological problems number plummets crime victims one-third develop chronic disorders amongst rape sexual assault victims reach 40 percent way prevent symptoms developing first place reflecting painful journeys patients mccart kept returning single question could help wonder might way prevent symptoms developing first place says pfa emphasis resiliency coping self-efficacy seemed like best candidate mccart medical university south carolina working nimh funding examine whether intervention actually decreases acute trauma symptoms adult crime victims three-year study concludes 2015 first ever assess pfa controlled randomized setting 150 participants study small victim work police department-based advocate traditionally helps fill paperwork goes court offers emotional support professionals trained version pfa others reasons hesitant pfa mccart study demonstrates pfa benefit high-risk population results likely generate new interest perhaps additional government funding mention lend scientific credence technique reality lot money spent training people preparing manuals discouraging practices really know right thing says farris tuma chief traumatic stress research program nimh reasons hesitant pfa scientists clinicians field disappointed promising interventions past responders relied technique called debriefing developed first responders like firefighters police officers would witness something terrible gather discuss feelings early evidence suggested men women shared intense bond felt less alone made sense apply principle groups endured disasters individuals sometimes strangers imperative trust desire relive trauma en masse indeed debriefing studied data disappointing many cases debriefing prevent reduce stress anxiety may even made symptoms worse frustration tuma says different parts mental health community started ask could may even made symptoms worse devise recipe book eight components essential pfa include calming survivors offering practical assistance providing information coping skills therapy sessions group discussions valerie cole manager disaster health mental health services red cross says clinicians responders use pfa provide immediate short-term emotional psychological relief hope might even improve odds preventing ptsd chronic conditions course conclusive data suggesting would love cole says theory science could answer question researchers stymied difficulty conducting study wake mass shooting hurricane nature events unpredictable unleash chaos even study could deployed ethical concerns recruiting participants diverting resources disaster response mccart believes project avoids complications end month advocates study deliver pfa two three interactions weeks following crime assault victims know perpetrator advocates use pfa focus safety develop strategies avoid person get protection order necessary advocates also draw pfa help victims practical considerations like housing health financial needs victims taught coping strategies encouraged maintain strong ties family friends central components pfa bottom line idea ... prevents anxiety depression next summer mccart team start analyzing data see victims given pfa show greater reductions ptsd depression general anxiety symptoms relative comparison group 'll also track measures like work performance substance use novel research pans experts say might finally offer evidence practical way steer survivors towards healthy recovery following trauma goal remained elusive years taking scientist hat quibbles problems pfa says tuma nimh bottom line idea better engaging people another way prevents anxiety depression 're trying help get data subscribe get best verge-approved tech deals week check inbox welcome email","{'neg': 0.225, 'neu': 0.618, 'pos': 0.157, 'compound': -0.9978}",2013-10-23 12:32:13,Post-Traumatic Mess? Why Crisis Counselors Still Don't Know If They're Helping Or Hurting,,27502,http://www.huffingtonpost.com/#
24,http://www.politico.com/story/2013/10/us-mass-shootings-tripled-98617.html,"attorney general eric holder says doj helped train officers respond associated press 10/21/2013 02:23 pm edt washington attorney general eric holder said monday average number mass shooting incidents tripled recent years 2000 2008 u.s. experienced average five mass shootings every year since annual average tripled holder said far 2013 least 12 said according justice department figures mass shootings 404 people shot 207 people killed 2009 2012 2000 2008 324 people shot 145 killed remarks annual conference international association chiefs police attorney general said past decade justice department helped train 50,000 front-line officers 7,000 on-scene commanders 3,000 local state federal agency heads respond active shooters disrupt planned shootings attacks fbi behavioral threat assessment center works every day local police levels law enforcement assess people may contemplating violence since 2011 center reported hundreds successful disruptions including anticipated 150 year alone holder said missing latest scoops sign politico playbook get latest news every morning inbox 2021 politico llc","{'neg': 0.142, 'neu': 0.778, 'pos': 0.08, 'compound': -0.9081}",2013-10-21 18:23:55,Holder: Mass shootings triple,,18268,https://www.politico.com/
25,http://www.breitbart.com/national-security/2013/10/23/military-training-doc-anti-christian-splc-a-trusted-source-to-define-extremism/,fox news todd starnes reported wednesday ft hood briefing reportedly soldiers told evangelical christians tea party supporters threat united states tearing nation apart. soldiers reportedly told could charged committing military crime supported donated organizations ft hood denies allegations separate source claiming present briefing asserts original account true ironically place islamic radical–maj nidal hassan–committed act terrorism murdered fourteen americans including unborn child one female victims–a presentation terrorism singled bible-believing christians supporters constitution serious threats nation islamic terrorism barely mentioned latest outrage long train disgraces days ago soldiers camp shelby mississippi instructed christian conservative american family association domestic hate group month earlier security presentation portrayed founding fathers extremists breitbart news reported christian chaplain officially censored military commanders talking importance religious faith several months lt. col. jack rich ft. campbell kentucky instructed soldiers traditional christian beliefs incompatible army values. started april breitbart news broke story top pentagon brass meeting anti-christian activist calling court-martialing observant christians share gospel jesus christ others military activist calls fundamentalist monsters enemies constitution punished sedition treason. along nation told series isolated incidents authorized military leadership military documents suggest otherwise judicial watch used foia request freedom information act obtain document defense equal opportunity management institute deomi part department defense dod 133-page training document entitled extremism pages 32-33 lesson emphasis claims provide information describes sources extremism information definitions recruitment dod personnel common themes extremist ideologies common characteristics extremist organizations dod policies command functions regarding extremist activities page cites southern poverty law center splc approved source information–and affiliate teaching tolerance splc labeled american family association domestic hate group along family research council frc religious liberty work senior fellow traditional values coalition various tea party organizations conservative border-security/immigration groups short splc labels hate groups organizations promote traditional christian view marriage social issues believe border enforcement promote constitutional limited government ironically splc group news report linked terrorism convicted domestic terrorist floyd lee corkins told fbi videotaped signed confession chose targets attempted mass-shooting frc splc hate group list including map get frc office names locations traditional groups going target murdering whoever could frc building deomi document goes several pages later say service members participate organizations raise funds encourage others support attend public rallies organized adds furthering objectives extremist organizations viewed detrimental good order discipline mission accomplishment unit therefore subject appropriate disciplinary action. tasks service members assist ing unit commanders vigilant existence activities. deomi training material fountainhead growing anti-christian discrimination wrote authorized training document result something else coming higher food chain pentagon michael berry lawyer liberty institute investigating matter tells breitbart news army responses isolated incidents raise questions answers incidents comprising disturbing trend seem one thing common use similar terminology language appears come document produced deomi may smoking gun might bunch shell casings berry tells us contacted someone works deomi gravely concerned developing situation congress empowered article section 8 constitution establishing training discipline military congress needs get bottom this–quickly ken klukowski senior legal analyst breitbart news follow twitter kenklukowski national securitydefenseextremism please let us know 're issues commenting protect big tech thank copyright 2021 breitbart,"{'neg': 0.16, 'neu': 0.688, 'pos': 0.152, 'compound': -0.9496}",2013-10-24 00:41:13,Military Training Document: Anti-Christian SPLC a Trusted Source to Define 'Extremism' - Breitbart,,19334,http://www.breitbart.com
26,http://www.slate.com/articles/life/cool_story/2013/10/two_straps_on_a_backpack_or_one_strap_what_s_cool.html,clicking agree consent slate terms service privacy policy use technologies cookies slate partners deliver relevant advertising ios app personalize content perform site analytics please see privacy policy information use data rights withdraw consent,"{'neg': 0.0, 'neu': 0.771, 'pos': 0.229, 'compound': 0.765}",2013-10-31 23:29:00,When Did Two-Strapping Get Cooler Than One-Strapping?,,19643,http://www.slate.com
27,http://www.rawstory.com/rs/2013/11/06/michael-moore-guns-dont-kill-people-americans-kill-people/,copyright 2021 raw story media inc. po box 21050 washington d.c. 20009 masthead privacy policy corrections concerns please email corrections rawstory.com manage preferences piano sign sit sidelines history join raw story investigates go ad-free support honest journalism subscribe annually 95 year 7.91/month subscribe monthly 1 trial want support 14.99 per month,"{'neg': 0.059, 'neu': 0.704, 'pos': 0.237, 'compound': 0.836}",2013-11-06 22:09:31,"Michael Moore: ‘Guns don’t kill people, Americans kill people’",motion pictures,1127,http://rawstory.com
28,http://feedproxy.google.com/~r/TheRawStory/~3/kvhjTOrl1vU/,copyright 2021 raw story media inc. po box 21050 washington d.c. 20009 masthead privacy policy corrections concerns please email corrections rawstory.com manage preferences piano sign sit sidelines history join raw story investigates go ad-free support honest journalism subscribe annually 95 year 7.91/month subscribe monthly 1 trial want support 14.99 per month,"{'neg': 0.059, 'neu': 0.704, 'pos': 0.237, 'compound': 0.836}",2013-11-01 22:11:22,Police: LAX shooting suspect carried note about ‘New World Order’ during attack,"terrorism,crime and criminals,murders and attempted murders",1127,http://rawstory.com
29,http://feedproxy.google.com/~r/TheRawStory/~3/vw2wbNgO9nI/,copyright 2021 raw story media inc. po box 21050 washington d.c. 20009 masthead privacy policy corrections concerns please email corrections rawstory.com manage preferences piano sign sit sidelines history join raw story investigates go ad-free support honest journalism subscribe annually 95 year 7.91/month subscribe monthly 1 trial want support 14.99 per month,"{'neg': 0.059, 'neu': 0.704, 'pos': 0.237, 'compound': 0.836}",2013-11-11 22:52:57,Newtown cop might be fired after being diagnosed with PTSD,"medicine and health,labor,police,murders and attempted murders",1127,http://rawstory.com
30,https://www.rollcall.com/2013/11/14/congress-unlikely-to-intervene-in-stand-down-controversy/,union representing capitol police officers rejecting internal review department response questions september navy yard shooting biased inaccurate capitol police board standing findings congress unlikely intervene point labor committee chairman james konczos claiming capitol police culture refusing get involved assisting washington d.c. community asking congress investigate highly trained team four officers responding mass shooting sept. 16 called back protect capitol house republicans charged oversight capitol police forces say reason question work review team led assistant senate sergeant-at-arms michael stenger spent weeks interviewing dozens personnel others reviewing written reports radio transmissions command center logs stenger fact review team established capitol police board senate sergeant-at-arms terrance gainer house sergeant-at-arms paul irving architect capitol stephen t. ayers capitol police chief kim dine dine request response questions raised department response house administration chairwoman candice s. miller called findings report exhaustive thorough praised professionalism containment emergency response team got traffic far radios everything clear exactly everything went michigan republican told cq roll call reason question investigation. two-page statement findings capitol police board says four-person cert unit self-deployed 11th streets southeast directed head navy yard incident command post traffic gridlock prevented getting union disputes claim saying cert officers arrived incident command post within minutes first call assistance relocated ensure first responders could reach incident awaited instructions capitol police unit recalled capitol 30 minutes reports attack facts clear cert initially directed incident command post facts clear make incident command post irving said also radio transmissions capitol police unit command post reflected would unable make due heavy traffic congestion konczos relies initial reports officers vicinity navy yard reported bbc also doubts board ability produce unbiased report since members responsible high-level security decisions day including decision put parts capitol lockdown gainer said konczos neither facts investigative experience question review union chairman respond attempts chief police briefed depth review findings. house administration committee announced plans investigate police actions konczos told cq roll call still working that. miller said keeps touch union talked particular issue said certain talk board report upcoming meeting dine keep open door line communication whether management labor said side something say certainly want hear all. rep. robert a. brady d-pa. ranking member house administration committee comment story reviewing details board report fellow house administration committee member gregg harper r-miss. found investigation thorough satisfied really valid attempt get bottom facts timeline said,"{'neg': 0.056, 'neu': 0.862, 'pos': 0.082, 'compound': 0.8658}",2013-11-14 00:00:00,Congress Unlikely to Intervene in 'Stand Down' Controversy - Roll Call,"politics and government,labor,police",19854,http://www.rollcall.com
