stories_id,publish_date,title,url,language,ap_syndicated,themes,media_id,media_name,media_url
1390882599,2019-09-12 21:43:17,Pete Buttigieg: Anyone Who Supports Trump 'Is Supporting Racism',http://feedproxy.google.com/~r/breitbart/~3/2ZJvfKmVvkI/,en,False,"politics and government,united states politics and government,elections,presidents and presidency (us),blacks,hispanic-americans,election issues,immigration and refugees,illegal aliens,discrimination",19334,Breitbart,http://www.breitbart.com
1390882664,2019-09-12 20:16:33,Democratic debate: Winnowed debate stage puts all the front-runners together for first time,http://rssfeeds.usatoday.com/~/606735628/0/usatodaycomwashington-topstories~Democratic-debate-Winnowed-debate-stage-puts-all-the-frontrunners-together-for-first-time/,en,False,politics and government,4,USA Today,http://www.usatoday.com
1390883666,2019-09-12 21:43:14,"O’Rourke's debate-stage vow: ‘Hell yes, we’re going to take your AR-15’",https://www.foxnews.com/politics/orourke-hell-yes-were-going-to-take-your-ar-15,en,False,"politics and government,finances,united states politics and government,elections,presidents and presidency (us),presidential elections (us),election issues,presidential election of 2004",1092,Fox News,http://www.foxnews.com/
1390884430,2019-09-12 21:40:05,"Beto O’Rourke Confirms Gun Confiscation Plan: ‘Hell Yes, We Are Going To Take Your AR-15’",http://feeds.inquisitr.com/~r/google/yDYq/~3/A1o3zITrRcQ/,en,False,"politics and government,law and legislation,united states politics and government,elections,gun control,firearms,murders and attempted murders,violence",26924,Inquisitr,http://www.inquisitr.com
1390888812,2019-09-12 21:54:21,The Latest: Warren says she’d leverage access to US markets,https://www.kansascity.com/news/business/national-international/article235011137.html#storylink=rss,en,False,"politics and government,finances,united states politics and government,elections,election issues,united states international relations,international relations,international trade and world market,economic conditions and trends",30,Kansas City Star,http://www.kansascity.com/
1390889324,2019-09-12 21:56:42,AP FACT CHECK: Claims from the Democratic debate,https://www.sfgate.com/news/crime/article/AP-FACT-CHECK-Claims-from-the-Democratic-debate-14436116.php,en,True,"politics and government,united states politics and government,elections,presidents and presidency (us),presidential elections (us),primaries,debating",14,SF Chronicle,http://www.sfgate.com/
1390893467,2019-09-12 21:29:55,"Beto O'Rourke on guns: 'Hell yes, we're going to take your AR-15'",https://www.dispatch.com/zz/news/20190912/beto-orourke-on-guns-hell-yes-were-going-to-take-your-ar-15?rssfeed=true,en,False,"politics and government,united states politics and government,elections,gun control,firearms",41,Columbus Dispatch,http://www.dispatch.com/
1390894076,2019-09-12 21:59:17,"Democratic debate 2019: Beto O&#8217;Rourke vows, &#8216;Hell, yes, we’re going to take your AR-15&#8217;",https://nypost.com/2019/09/12/democratic-debate-2019-beto-orourke-vows-hell-yes-were-going-to-take-your-ar-15/,en,False,"politics and government,law and legislation,united states politics and government,gun control,firearms,murders and attempted murders",7,New York Post,http://www.nypost.com/
1390895099,2019-09-12 21:19:34,Kamala Harris: Trump Didn’t Pull the Trigger in El Paso But He Has 'Been Tweeting Out the Ammunition',http://feedproxy.google.com/~r/breitbart/~3/9MF6SXkFIvQ/,en,False,"politics and government,united states politics and government,elections,presidents and presidency (us),presidential elections (us)",19334,Breitbart,http://www.breitbart.com
1390905325,2019-09-12 22:39:29.804727,"Hillary, Guns, and Planned Parenthood | The American Spectator | Politics Is Too Important To Be Taken Seriously.",https://spectator.org/64261_hillary-guns-and-planned-parenthood/,en,False,,21919,American Spectator,http://spectator.org
1390908175,2019-09-12 21:29:55,"Beto O'Rourke on guns: 'Hell yes, we're going to take your AR-15'",https://www.fayobserver.com/zz/news/20190912/beto-orourke-on-guns-hell-yes-were-going-to-take-your-ar-15?rssfeed=true,en,False,"politics and government,united states politics and government,elections,gun control,firearms",71280,fayobserver.com,http://fayobserver.com/#spider
1390908373,2019-09-12 22:32:36,"Jorge Ramos Grills Biden, Castro About Obama-Era Deportations",https://www.huffpost.com/entry/jorge-ramos-biden-castro-deportations_n_5d7af915e4b00d690595cf3c,en,False,"politics and government,united states politics and government,elections,presidents and presidency (us),blacks,election issues,immigration and refugees,illegal aliens",27502,HuffPost,http://www.huffingtonpost.com/#
1390912278,2019-09-12 22:22:19,"Beto O'Rourke: 'Hell Yes, We're Going To Take Your AR-15'",https://reason.com/2019/09/12/beto-orourke-hell-yes-were-going-to-take-your-ar-15/,en,False,"politics and government,united states politics and government,elections,gun control,firearms",72523,Reason.com,http://reason.com/
1390915559,2019-09-12 22:51:40,"Key Words: ‘Hell, yes, we’re going to take your AR-15, your AK-47,’ says Beto O’Rourke at debate",http://www.marketwatch.com/news/story.asp?guid=%7B457C5958-D5CB-11E9-8D76-5B5A03976EA7%7D&siteid=rss&rss=1,en,False,"politics and government,united states politics and government",35170,Marketwatch,https://www.marketwatch.com/
1390918541,2019-09-12 23:04:35,AP News in Brief at 11:04 p.m. EDT,https://www.kansascity.com/news/nation-world/article235000217.html#storylink=rss,en,True,"politics and government,finances,united states politics and government,elections,medicine and health,presidents and presidency (us),presidential elections (us),election issues,insurance,health insurance and managed care,health insurance,medicare",30,Kansas City Star,http://www.kansascity.com/
1390919275,2019-09-12 22:32:36,"Jorge Ramos Grills Biden, Castro About Obama-Era Deportations",https://www.huffpost.com/entry/jorge-ramos-biden-castro-deportations_n_5d7af915e4b00d690595cf3c,en,False,"politics and government,united states politics and government,elections,presidents and presidency (us),blacks,election issues,immigration and refugees,illegal aliens",96720,HuffPost Latino Voices,http://voces.huffingtonpost.com/#spider
1390930471,2019-09-12 23:21:17,Vow to ban assault weapons gives O’Rourke debate breakout,https://www.sacbee.com/news/politics-government/national-politics/article235048342.html#storylink=rss,en,False,"politics and government,united states politics and government,elections",26,Sac Bee,http://www.sacbee.com/
1390932129,2019-09-12 22:44:42,AP fact check: 2020 Democrats debate in Houston,https://www.pbs.org/newshour/politics/ap-fact-check-2020-democrats-debate-in-houston,en,True,"politics and government,united states politics and government,editorials",271188,PBS NewsHour,http://www.pbs.org/newshour/
1390932035,2019-09-12 23:21:17,Vow to ban assault weapons gives O’Rourke debate breakout,https://www.miamiherald.com/news/politics-government/national-politics/article235048342.html#storylink=rss,en,False,"politics and government,united states politics and government,elections",28,Miami Herald,http://www.miamiherald.com/
1390932344,2019-09-12 23:21:17,Vow to ban assault weapons gives O’Rourke debate breakout,https://www.kansascity.com/news/politics-government/national-politics/article235048342.html#storylink=rss,en,False,"politics and government,united states politics and government,elections",30,Kansas City Star,http://www.kansascity.com/
1390933072,2019-09-12 23:20:42,Vow to ban assault weapons gives O'Rourke debate breakout,https://www.sfgate.com/news/texas/article/Vow-to-ban-assault-weapons-gives-O-Rourke-debate-14436371.php,en,True,"politics and government,united states politics and government,elections,debating",14,SF Chronicle,http://www.sfgate.com/
1390933556,2019-09-12 22:32:25,"Survivor of El Paso shooting arrested at White House, allegedly lied about heroism",https://www.aol.com/article/news/2019/09/12/survivor-of-el-paso-shooting-arrested-at-white-house-allegedly-lied-about-heroism/23812152/,en,False,"police,murders and attempted murders,extradition",150985,AOL News,http://news.aol.com/
1390940790,2019-09-12 23:50:11,"New Zealand&#8217;s PM Ardern acts to tighten gun laws further, six months after attack",https://www.oann.com/new-zealands-pm-ardern-acts-to-tighten-gun-laws-further-six-months-after-attack/,en,False,"politics and government,law and legislation,religion and churches,armament, defense and military forces,terrorism",127733,Oan,http://oann.com/
1390942732,2019-09-12 23:42:07,Vow to Ban Assault Weapons Gives O'Rourke Debate Breakout,https://www.usnews.com/news/politics/articles/2019-09-12/vow-to-ban-assault-weapons-gives-orourke-debate-breakout,en,True,politics and government,1100,US News & World Report ,http://www.usnews.com/
1390939467,2019-09-12 23:06:52,Joe Biden Claims to Be Vice President During Tough Immigration Question,http://feedproxy.google.com/~r/breitbart/~3/jV9p3hwzCFQ/,en,False,"politics and government,united states politics and government,elections,presidents and presidency (us),presidential elections (us),election issues,immigration and refugees",19334,Breitbart,http://www.breitbart.com
1390949530,2019-09-13 00:17:03,"Front runners Biden, Warren and Sanders clash on Democratic Party's future",https://www.latimes.com/politics/story/2019-09-12/debate-mainbar,en,False,"politics and government,united states politics and government,elections",6,LA Times,http://www.latimes.com/
1390951549,2019-09-13 00:13:51,"Democratic debate highlights: Healthcare, gun control and party unity take center stage",http://feeds.reuters.com/~r/Reuters/domesticNews/~3/kQaR8Xt4fKI/democratic-debate-highlights-healthcare-gun-control-and-party-unity-take-center-stage-idUSKCN1VY05N,en,False,,4442,Reuters,http://www.reuters.com
1390951543,2019-09-13 00:13:51,"Democratic debate highlights: Healthcare, gun control and party unity take center stage",http://feeds.reuters.com/~r/Reuters/domesticNews/~3/kQaR8Xt4fKI/democratic-debate-highlights-healthcare-gun-control-and-party-unity-take-center-stage-idUSKCN1VY05N,en,False,"politics and government,finances,united states politics and government,elections,medicine and health,presidents and presidency (us),presidential elections (us),election issues,insurance,health insurance and managed care,medicare",1089,Reuters ,http://www.reuters.com/
1390951712,2019-09-13 00:18:00,7 Things We Learned From the Third Democratic Debate,http://feedproxy.google.com/~r/time/topstories/~3/sYhJVnXo1b8/,en,False,"politics and government,united states politics and government,elections,presidents and presidency (us),presidential elections (us),election issues,debating",40362,time,http://www.time.com/time/
1390951928,2019-09-13 00:18:26,Democratic debate 2019: Joe Biden stands out for all the wrong reasons,https://nypost.com/2019/09/13/democratic-debate-2019-joe-biden-stands-out-for-all-the-wrong-reasons/,en,False,,7,New York Post,http://www.nypost.com/
1390952080,2019-09-13 00:18:00,7 Things We Learned From the Third Democratic Debate,http://feedproxy.google.com/~r/time/topstories/~3/sYhJVnXo1b8/,en,False,"politics and government,united states politics and government,elections,presidents and presidency (us),presidential elections (us),election issues,debating",4419,Time,http://time.com
1390954214,2019-09-13 00:26:04,Biden parries attacks from rivals in fiery Democratic debate,https://www.dailynews.com/2019/09/12/biden-parries-attacks-from-rivals-in-fiery-democratic-debate/,en,False,"politics and government,finances,united states politics and government,elections,medicine and health,presidents and presidency (us),election issues",24901,Bleacher Report,http://bleacherreport.com
1390954903,2019-09-12 23:50:20,Biden Fights Off Rivals In Democratic 2020 Debate,https://www.ibtimes.com/biden-fights-rivals-democratic-2020-debate-2826097?utm_source=Public&utm_medium=Feed&utm_campaign=Distribution,en,False,"politics and government,united states politics and government,elections",41550,IBTimes,http://www.ibtimes.com/
1390954863,2019-09-13 00:00:23,&#8216;A really small dude&#8217;: Kamala Harris turns her fire on Trump in third Democratic debate,https://www.mercurynews.com/2019/09/12/democratic-debate-kamala-harris-trump/,en,False,"politics and government,united states politics and government,elections,presidents and presidency (us),presidential elections (us),election issues,presidential election of 2004,debating",35,San Jose Mercury News,http://www.mercurynews.com/
1390955164,2019-09-13 00:01:44," AP FACT CHECK: Dems draw link between Trump, El Paso murders ",https://www.chron.com/news/crime/article/AP-FACT-CHECK-Claims-from-the-Democratic-debate-14436116.php,en,True,"politics and government,united states politics and government,elections,presidents and presidency (us),presidential elections (us)",10,houstonchronicle,http://www.chron.com/
1390957564,2019-09-12 22:17:39,The Latest: Biden takes on fire at debate from Julián Castro,https://www.fayobserver.com/ZZ/news/20190912/latest-biden-takes-on-fire-at-debate-from-julin-castro?rssfeed=true,en,True,"politics and government,united states politics and government,elections,medicine and health,presidents and presidency (us),election issues,medicare",71280,fayobserver.com,http://fayobserver.com/#spider
1390958557,2019-09-13 00:16:00,Authorities dispute claims of El Paso victim who said he threw soda bottles at shooter,https://www.staradvertiser.com/2019/09/12/breaking-news/authorities-dispute-claims-of-el-paso-victim-who-said-he-threw-soda-bottles-at-shooter/,en,False,"police,crime and criminals,murders and attempted murders",39573,HonululuAdvertiser,http://www.staradvertiser.com/
1390959367,2019-09-13 00:00:23,&#8216;A really small dude&#8217;: Kamala Harris turns her fire on Trump in third Democratic debate,https://www.eastbaytimes.com/2019/09/12/democratic-debate-kamala-harris-trump/,en,False,"politics and government,united states politics and government,elections,presidents and presidency (us),presidential elections (us),election issues,presidential election of 2004,debating",27512,The Insider -,http://www.ibabuzz.com/insider/
1390960135,2019-09-12 22:17:39,The Latest: Biden takes on fire at debate from Julián Castro,https://www.norwichbulletin.com/ZZ/news/20190912/latest-biden-takes-on-fire-at-debate-from-julin-castro?rssfeed=true,en,True,"politics and government,united states politics and government,elections,medicine and health,presidents and presidency (us),election issues,medicare",74242,norwichbulletin.com,http://www.norwichbulletin.com/#spider
1390960849,2019-09-12 23:30:24,Democrats have spent years denying they'll take people's guns. Not anymore.,http://rss.cnn.com/~r/rss/cnn_latest/~3/cug5_2zvBpE/index.html,en,False,"politics and government,united states politics and government,elections,gun control",20088,CNN U.S. Edition,http://us.cnn.com
1390961274,2019-09-13 00:05:31,AP News in Brief at 12:04 a.m. EDT,https://www.ledger-enquirer.com/news/nation-world/article235049177.html#storylink=rss,en,True,"politics and government,united states politics and government,elections,presidents and presidency (us),labor,election issues",82483,ledger-enquirer.com,http://www.ledger-enquirer.com/#spider
1390961957,2019-09-12 23:48:37,"New Zealand's PM Ardern acts to tighten gun laws further, six months after attack",http://feeds.reuters.com/~r/Reuters/worldNews/~3/-_en0Nb2Krk/new-zealands-pm-ardern-acts-to-tighten-gun-laws-further-six-months-after-attack-idUSKCN1VY092,en,False,"politics and government,law and legislation,religion and churches,islam,terrorism",4442,Reuters,http://www.reuters.com
1390962697,2019-09-12 23:30:24,Democrats have spent years denying they'll take people's guns. Not anymore.,http://rss.cnn.com/~r/rss/cnn_latest/~3/cug5_2zvBpE/index.html,en,False,"politics and government,united states politics and government,elections,gun control",1095,CNN,http://www.cnn.com/
1390962730,2019-09-12 22:17:39,The Latest: Biden takes on fire at debate from Julián Castro,https://www.dispatch.com/ZZ/news/20190912/latest-biden-takes-on-fire-at-debate-from-julin-castro?rssfeed=true,en,True,"politics and government,united states politics and government,elections,medicine and health,presidents and presidency (us),election issues,medicare",41,Columbus Dispatch,http://www.dispatch.com/
1390962722,2019-09-12 23:02:17,Vow to ban assault weapons gives O'Rourke debate breakout,https://www.dispatch.com/ZZ/news/20190912/vow-to-ban-assault-weapons-gives-orourke-debate-breakout?rssfeed=true,en,True,"politics and government,united states politics and government",41,Columbus Dispatch,http://www.dispatch.com/
1390965458,2019-09-13 00:26:04,Biden parries attacks from rivals in fiery Democratic debate,https://www.ocregister.com/2019/09/12/biden-parries-attacks-from-rivals-in-fiery-democratic-debate/,en,False,"politics and government,finances,united states politics and government,elections,medicine and health,presidents and presidency (us),election issues",25,Orange County Register,http://www.ocregister.com/
1390968621,2019-09-12 23:29:01,Presidential candidates clash over health care in third Democratic debate,https://www.twincities.com/2019/09/12/presidential-candidates-clash-over-health-care-in-third-democratic-debate/,en,False,"politics and government,united states politics and government,elections,medicine and health,presidents and presidency (us),presidential elections (us),election issues,debating",52,St.Paul Pioneer-Press ,http://www.twincities.com/
1390969871,2019-09-12 23:26:25,Democratic debate: Fiery exchanges over costs of health care,https://www.denverpost.com/2019/09/12/democratic-debate-health-care-cost/,en,False,"politics and government,united states politics and government,elections,medicine and health,presidents and presidency (us),presidential elections (us),election issues,debating",390346,"Latest news, sports, weather from Denver and Colorado | The Denver Post",http://feeds.denverpost.com/dp-news-breaking
1390971411,2019-09-12 23:04:39,"&#8220;Hell Yes, We&#8217;re Going to Take Your AR-15&#8221;",https://www.motherjones.com/politics/2019/09/beto-orourke-assault-weapons-debate/,en,False,"politics and government,united states politics and government,armament, defense and military forces,united states armament and defense,united states international relations,international relations",1112,Mother Jones,http://www.motherjones.com/
1390971410,2019-09-12 23:51:24,Democratic Candidates Take on a Tough Opponent: Their Own Past Selves,https://www.motherjones.com/politics/2019/09/democratic-candidates-take-on-a-tough-opponent-their-own-past-selves/,en,False,"politics and government,united states politics and government,elections,presidents and presidency (us),presidential elections (us),election issues,immigration and refugees",1112,Mother Jones,http://www.motherjones.com/
1390977357,2019-09-12 20:00:00,Liberal Media's False Narrative That White Nationalism Is the New Terrorism,https://www.realclearpolitics.com/articles/2019/09/13/liberal_medias_false_narrative_that_white_nationalism_is_the_new_terrorism_141248.html,en,False,"politics and government,united states politics and government,elections,armament, defense and military forces,news and news media,terrorism,united states armament and defense",1040,RealClearPolitics,http://realclearpolitics.com/
1390986773,2019-09-13 00:30:00,"MSNBC Panel Swoons Beto ‘Found His Voice,’ Hails Plans for Forced Gun Confiscation",https://www.newsbusters.org/blogs/nb/curtis-houck/2019/09/13/msnbc-panel-swoons-over-beto-having-found-his-voice-hails-plans,en,False,"politics and government,law and legislation,united states politics and government,homosexuality,gun control,marriages",1125,NewsBusters,http://newsbusters.org
1390989836,2019-09-13 01:08:46,"Top 2020 Democrats avoid attacks, and other debate takeaways",https://www.pbs.org/newshour/politics/top-2020-democrats-avoid-attacks-and-other-debate-takeaways,en,False,"politics and government,united states politics and government,elections,presidents and presidency (us),presidential elections (us),primaries,election issues,debating",271188,PBS NewsHour,http://www.pbs.org/newshour/
1390995165,2019-09-13 01:47:40,7 takeaways from the third Democratic presidential debate,http://rss.cnn.com/~r/rss/cnn_allpolitics/~3/mULog1cI7AY/index.html,en,False,"politics and government,united states politics and government,elections,presidents and presidency (us),primaries",1095,CNN,http://www.cnn.com/
1390995947,2019-09-13 01:41:08,"Some Democrats snipe, others unite in third presidential debate",http://feeds.reuters.com/~r/Reuters/domesticNews/~3/j_jMrnGDzTo/some-democrats-snipe-others-unite-in-third-presidential-debate-idUSKCN1VY0DK,en,False,"politics and government,united states politics and government,elections,presidents and presidency (us),presidential elections (us),election issues",1089,Reuters ,http://www.reuters.com/
1390996837,2019-09-12 23:18:15,Kamala Harris calls Trump a &apos;little dude&apos; and other moments from the Democratic debate,http://rssfeeds.usatoday.com/~/606741168/0/usatodaycomwashington-topstories~Kamala-Harris-calls-Trump-a-aposlittle-dudeapos-and-other-moments-from-the-Democratic-debate/,en,False,"politics and government,finances,united states politics and government,elections,medicine and health,presidents and presidency (us),presidential elections (us),election issues,insurance,health insurance and managed care,health insurance",4,USA Today,http://www.usatoday.com
1390996835,2019-09-12 23:17:45,Democratic debate: Who were the winners and losers,http://rssfeeds.usatoday.com/~/606741682/0/usatodaycomwashington-topstories~Democratic-debate-Who-were-the-winners-and-losers/,en,False,"politics and government,united states politics and government,elections,presidents and presidency (us),presidential elections (us)",4,USA Today,http://www.usatoday.com
1391004988,2019-09-13 01:47:40,An iconic University of Tennessee rock was painted with an anti-Semitic message,http://rss.cnn.com/~r/rss/cnn_topstories/~3/mULog1cI7AY/index.html,en,False,"politics and government,united states politics and government,elections,presidents and presidency (us),primaries",20088,CNN U.S. Edition,http://us.cnn.com
1391006127,2019-09-13 01:13:20,Democratic debate candidates share stories of resilience,https://www.cbsnews.com/news/democratic-debate-candidates-share-personal-stories-about-what-made-them-resilient/,en,False,"politics and government,united states politics and government,elections,medicine and health,presidents and presidency (us),presidential elections (us),biographical information",1752,CBS News,http://www.cbsnews.com/
1391004694,2019-09-13 01:25:03,Who won the Democrats' debate? Our panelists' verdict,https://www.theguardian.com/commentisfree/2019/sep/13/who-won-the-democrats-debate-our-panelists-verdict,en,False,"politics and government,united states politics and government,immigration and refugees",623382,Guardian,http://www.theguardian.com/us
1391011855,2019-09-12 19:04:59,"News of the Day From Across the Nation, Sept. 12",https://www.sfgate.com/nation/article/News-of-the-Day-From-Across-the-Nation-Sept-12-14435874.php,en,False,"homosexuality,oil (petroleum) and gasoline",14,SF Chronicle,http://www.sfgate.com/
1391012975,2019-09-13 00:15:16,"The Democratic race gets hotter with a debate over where, exactly, the party should stand",http://rssfeeds.usatoday.com/~/606742836/0/usatodaycomwashington-topstories~The-Democratic-race-gets-hotter-with-a-debate-over-where-exactly-the-party-should-stand/,en,False,"politics and government,finances,united states politics and government,elections,medicine and health,editorials,election issues,health insurance and managed care,medicare",4,USA Today,http://www.usatoday.com
1391017451,2019-09-13 02:06:47,"My AR-15 is 'ready for you', Texas lawmaker tells Beto O'Rourke",https://www.theguardian.com/us-news/2019/sep/13/my-ar-15-is-ready-for-you-texas-lawmaker-tells-beto-orourke,en,False,"politics and government,law and legislation,united states politics and government,elections",1751,Guardian US,https://www.theguardian.com/us
1391021758,2019-09-13 02:06:47,"My AR-15 is 'ready for you', Texas lawmaker tells Beto O'Rourke",https://www.theguardian.com/us-news/2019/sep/13/my-ar-15-is-ready-for-you-texas-lawmaker-tells-beto-orourke,en,False,,623382,Guardian,http://www.theguardian.com/us
1391046878,2019-09-13 03:17:19,Second Tier in Prime Form at Democratic Debate,https://newrepublic.com/article/155052/beto-castro-democratic-debate,en,False,"politics and government,united states politics and government,elections",401,The New Replublic,http://www.tnr.com/
1391068029,2019-09-13 03:30:14,El Paso police dispute man's story of heroism during Walmart shooting ,https://www.latimes.com/world-nation/story/2019-09-12/texas-shooting-heroism-story-disputed-police,en,False,"police,crime and criminals,murders and attempted murders",6,LA Times,http://www.latimes.com/
1391076498,2019-09-13 01:13:51,"Democratic debate in Houston: From A to F,  Mastio & Lawrence grade the 2020 candidates",http://rssfeeds.usatoday.com/~/606743936/0/news-opinion~Democratic-debate-in-Houston-From-A-to-F-Mastio-amp-Lawrence-grade-the-candidates/,en,False,"politics and government,united states politics and government,elections,medicine and health,medicare",4,USA Today,http://www.usatoday.com
1391091972,2019-09-13 02:51:08,Which candidates attacked the most during the third Democratic debate?,https://www.washingtonpost.com/politics/which-candidates-attacked-the-most-during-the-third-democratic-debate/2019/09/13/43898972-8956-417f-a939-6a66462a71ee_story.html,en,False,,2,Washington Post,http://washingtonpost.com
