stories_id,publish_date,title,url,language,ap_syndicated,themes,media_id,media_name,media_url
1398802554,2019-09-21 17:01:43,Las Vegas Review-Journal wins NPA’s general excellence award,https://www.ledger-enquirer.com/news/politics-government/national-politics/article235347217.html#storylink=rss,en,False,,82483,ledger-enquirer.com,http://www.ledger-enquirer.com/#spider
1398819596,2019-09-21 15:50:04,Arson attacks at 3 churches serving Hispanics in El Paso probed by FBI,https://www.nbcnews.com/news/latino/arson-3-catholic-churches-serving-hispanics-el-paso-probed-fbi-n1057281?cid=public-rss_20190921,en,False,,34663,NBC Breaking News,http://www.breakingnews.com#spider
1398868807,2019-09-21 20:37:40,US police assess rise in threat tips after 3 mass killings,https://www.miamiherald.com/news/nation-world/article235337702.html#storylink=rss,en,False,,28,Miami Herald,http://www.miamiherald.com/
1398952933,2019-09-22 00:04:52,"Sure, black people can be racist, too",http://rss.cnn.com/~r/rss/cnn_latest/~3/uKEUiS2zMY0/index.html,en,False,,1095,CNN,http://www.cnn.com/
1398953879,2019-09-22 00:04:52,"Sure, black people can be racist, too",http://rss.cnn.com/~r/rss/cnn_latest/~3/uKEUiS2zMY0/index.html,en,False,,20088,CNN U.S. Edition,http://us.cnn.com
1399039709,2019-09-22 03:50:00,Editorial: We need the reasonable center to stand up for gun control,https://www.dispatch.com/opinion/20190922/editorial-we-need-reasonable-center-to-stand-up-for-gun-control?rssfeed=true,en,False,,41,Columbus Dispatch,http://www.dispatch.com/
1399039342,2019-09-22 04:45:00,"After shootings, threat tips roll in
",http://www.arkansasonline.com/news/2019/sep/22/after-shootings-threat-tips-roll-in-201/,en,False,,56,Arkansas Democrat-Gazette ,http://www2.arkansasonline.com/
1399267435,2019-09-22 08:11:33,Missing Camp Pendleton Marine found safe at Texas rest stop,https://www.aol.com/article/news/2019/09/22/missing-camp-pendleton-marine-found-safe-at-texas-rest-stop/23817514/,en,True,,150985,AOL News,http://news.aol.com/
1399347381,2019-09-22 10:45:30,"Obesity, Fire, Water, Claim More Lives Than Mass Shootings",http://feedproxy.google.com/~r/breitbart/~3/25UCgJOXdhs/,en,False,,19334,Breitbart,http://www.breitbart.com
1399428560,2019-09-22 17:38:23,Bernie Sanders Reveals What He Admires About Donald Trump,https://www.inquisitr.com/5650056/bernie-sanders-reveals-admires-about-donald-trump/,en,False,,26924,Inquisitr,http://www.inquisitr.com
1399496479,2019-09-22 20:24:48,In Ohio - again - Trump cites Australian investment and new jobs,http://rssfeeds.indystar.com/~/607055910/0/indystar/todaystopstories~In-Ohio-again-Trump-cites-Australian-investment-and-new-jobs/,en,False,,85390,blogs.indystar.com,http://blogs.indystar.com/#spider
1399505472,2019-09-22 11:34:29,The Green New Deal Can Help Us Fight White Supremacy,https://truthout.org/articles/the-green-new-deal-can-help-us-fight-white-supremacy/,en,False,,22332,Truthout,http://www.truth-out.org
1399767822,2019-09-23 09:01:41,"El Paso Church Arsons Prompt F.B.I. to Offer $15,000 Reward",https://www.nytimes.com/2019/09/23/us/el-paso-church-arson.html,en,False,,1,New York Times,http://nytimes.com
1399767782,2019-09-23 09:01:49,Beto O’Rourke Wants to Talk Guns With Anyone Who Will Listen,https://www.nytimes.com/2019/09/23/us/politics/beto-orourke-guns-2020.html,en,False,,1,New York Times,http://nytimes.com
1399829935,2019-09-23 02:00:42,"In 2017, Virginia was the bellwether of the blue wave: Will it happen again?",https://www.salon.com/2019/09/23/in-2017-virginia-was-the-bellwether-of-the-blue-wave-will-it-happen-again/,en,False,,1757,Salon,http://www.salon.com/
1399903048,2019-09-23 07:56:54,Florida police detective resigns after threatening mass shooting if he didn't get job he wanted,https://www.foxnews.com/us/florida-police-detective-resigns-mass-shooting-threat,en,False,,1092,Fox News,http://www.foxnews.com/
1399978729,2019-09-23 09:20:28,What the .... ?  Trump and 2020 Democrats are cursing a blue streak,https://www.latimes.com/politics/story/2019-09-23/cursing-presidential-candidates-2020,en,False,,6,LA Times,http://www.latimes.com/
1400008758,2019-09-23 05:04:28,White House infighting thwarts movement on guns,https://www.politico.com/story/2019/09/23/trump-white-house-gun-legislation-1506559,en,False,,18268,Politico,https://www.politico.com/
1400084498,2019-09-23 10:27:57,Report: Don Jr. and Ivanka Are Fighting About Gun Control,https://www.vanityfair.com/news/2019/09/don-jr-ivanka-trump-gun-control,en,False,,20982,Vanity Fair,http://www.vanityfair.com
1400194849,2019-09-23 13:30:47,Detective resigns after threatening mass shooting if he didn&#8217;t get job he wanted,https://nypost.com/2019/09/23/detective-resigns-after-threatening-mass-shooting-if-he-didnt-get-job-he-wanted/,en,False,,7,New York Post,http://www.nypost.com/
1400227052,2019-09-23 14:14:07,Editorials from around Ohio,https://www.ledger-enquirer.com/news/article235391792.html#storylink=rss,en,False,,82483,ledger-enquirer.com,http://www.ledger-enquirer.com/#spider
1400273131,2019-09-23 15:11:28,2019 Long Island Oyster Festival adds Blue Point beer to lineup,https://www.newsday.com/lifestyle/long-island-events/2019-oyster-festival-1.36742176,en,False,,13,Newsday,http://www.newsday.com/
1400279739,2019-09-23 12:29:26,"Opinion: President Trump, America is still waiting for your improvements to gun laws",http://feeds.latimes.com/~r/topoftheticket/~3/zCPfihQoeZw/trump-gun-laws-background-checks-2020-election,en,False,,6,LA Times,http://www.latimes.com/
1400316185,2019-09-23 16:13:03,Dept. of Homeland Security Names White Supremacy a Domestic Terrorist Threat,https://www.rollingstone.com/culture/culture-news/homeland-security-white-supremacy-domestic-terrorism-threat-888748/,en,False,,5521,Rolling Stone,http://www.rollingstone.com
1400378654,2019-09-23 18:05:49,"In UN Address, Trump Makes International Call: ‘End Religious Persecution’",https://www.dailysignal.com/2019/09/23/in-un-address-trump-makes-international-call-end-religious-persecution/?utm_source=rss&utm_medium=rss&utm_campaign=in-un-address-trump-makes-international-call-end-religious-persecution,en,False,,105100,Daily Signal,http://dailysignal.com/#spider
1400396218,2019-09-23 18:48:23,AG Healey visits Drury High as part of Sandy Hook Promise program to make schools safer,"http://www.berkshireeagle.com/stories/ag-healey-visits-drury-high-as-part-of-sandy-hook-promise-program-to-make-schools-safer,585554",en,False,,136431,berkshireeagle.com,http://berkshireeagle.com/
1400433177,2019-09-23 19:31:20,"New Zealand PM Ardern, Trump Discuss Gun Control in First Formal Meeting",https://www.usnews.com/news/world/articles/2019-09-23/new-zealand-pm-ardern-trump-discuss-gun-control-in-first-formal-meeting,en,False,,1100,US News & World Report ,http://www.usnews.com/
1400436192,2019-09-23 19:45:32,Trump reportedly talks NZ gun buyback with PM Ardern,https://www.mercurynews.com/2019/09/23/trump-reportedly-talks-nz-gun-buyback-with-pm-ardern/,en,False,,35,San Jose Mercury News,http://www.mercurynews.com/
1400464420,2019-09-23 21:03:26,Tech companies back independent watchdog to tackle online extremism,http://feeds.reuters.com/~r/reuters/technologyNews/~3/8_EldiRFDXo/tech-companies-back-independent-watchdog-to-tackle-online-extremism-idUSKBN1W903P,en,False,,4442,Reuters,http://www.reuters.com
1400470012,2019-09-24 01:17:44,Rethinking Counterterrorism,https://www.nytimes.com/2019/09/23/opinion/dhs-domestic-terrorism.html,en,False,,1,New York Times,http://nytimes.com
1400472989,2019-09-23 21:25:29,Tech companies back independent watchdog to tackle online extremism,https://www.oann.com/tech-companies-back-independent-watchdog-to-tackle-online-extremism/,en,False,,127733,Oan,http://oann.com/
1400575880,2019-09-24 01:19:35,Virginia Beach Police to Release Report on Mass Shooting,https://www.usnews.com/news/us/articles/2019-09-24/virginia-beach-police-to-release-report-on-mass-shooting,en,True,,1100,US News & World Report ,http://www.usnews.com/
1400578809,2019-09-24 01:25:11,Virginia Beach police to release report on mass shooting,http://www.startribune.com/virginia-beach-police-to-release-report-on-mass-shooting/561193452/,en,False,,19,Star Tribune ,http://www.startribune.com/
1400588363,2019-09-24 01:31:45,"Students seeks to end ban of blood donations by gay, bi men",https://www.sfgate.com/news/article/Students-seeks-to-end-ban-of-blood-donations-by-14462969.php,en,True,,14,SF Chronicle,http://www.sfgate.com/
1400591721,2019-09-24 01:32:45,"Students seeks to end ban of blood donations by gay, bi men",https://www.ledger-enquirer.com/news/article235413687.html#storylink=rss,en,False,,82483,ledger-enquirer.com,http://www.ledger-enquirer.com/#spider
1400592007,2019-09-24 01:32:45,"Students seeks to end ban of blood donations by gay, bi men",https://www.miamiherald.com/news/article235413687.html#storylink=rss,en,False,,28,Miami Herald,http://www.miamiherald.com/
1400738003,2019-09-24 09:01:55,The America That Isn’t Polarized,https://www.nytimes.com/2019/09/24/upshot/many-americans-not-polarized.html,en,False,,1,New York Times,http://nytimes.com
1400868853,2019-09-24 06:00:35,'Joker' is stirring controversy even before it hits theaters,https://www.newsday.com/entertainment/movies/joker-joaquin-phoenix-1.36744533,en,False,,13,Newsday,http://www.newsday.com/
1400917015,2019-09-24 09:00:02,Families of Aurora Shooting Victims Express Concerns About &#8216;Joker&#8217;,https://variety.com/2019/film/news/aurora-victims-gun-violence-joker-1203347159/,en,False,,19076,variety.com,http://www.variety.com
1400992477,2019-09-24 09:00:00,Virginia Beach mass shooting details to be made public in interim police account,https://www.washingtonpost.com/local/virginia-beach-mass-shooting-details-to-be-made-public-in-interim-police-account/2019/09/23/1aa73266-de3b-11e9-b199-f638bf2c340f_story.html,en,False,,2,Washington Post,http://washingtonpost.com
1401005227,2019-09-24 10:14:32,Aurora Shooting Victims&#8217; Families Voice Concerns About Warner Bros&#8217; Upcoming &#8216;Joker&#8217;,https://www.thewrap.com/aurora-shooting-victims-warner-bros-joker/,en,False,,18704,The Wrap,http://www.thewrap.com
1401109802,2019-09-24 06:00:19,POLITICO Playbook: How the ground is shifting on impeachment,https://www.politico.com/newsletters/playbook/2019/09/24/how-the-ground-is-shifting-on-impeachment-480234,en,False,,18268,Politico,https://www.politico.com/
1401126571,2019-09-24 10:27:24,"'Joker' Won't Play at Aurora, CO Theater, Site of 2012 Mass Shooting",https://www.tmz.com/2019/09/24/joker-movie-not-playing-aurora-colorado-theater-2012-mass-shooting-joaquin-phoenix/,en,False,,56051,TMZ,http://tmz.com/
1401140966,2019-09-24 09:45:41,Families of Aurora Shooting Victims Send Warner Bros. Concerned Letter Over &#8216;Joker&#8217; Release,https://www.indiewire.com/2019/09/aurora-shooting-victims-joker-warner-bros-letter-gun-violence-1202176133/,en,False,,26992,Indiewire,https://www.indiewire.com/
1401151204,2019-09-24 13:01:27,Fake mass shooting threats have very real consequences: John Phillips,https://www.dailynews.com/2019/09/24/fake-mass-shooting-threats-have-very-real-consequences-john-phillips/,en,False,,24901,Bleacher Report,http://bleacherreport.com
1401161325,2019-09-24 13:01:27,Fake mass shooting threats have very real consequences: John Phillips,https://www.ocregister.com/2019/09/24/fake-mass-shooting-threats-have-very-real-consequences-john-phillips/,en,False,,25,Orange County Register,http://www.ocregister.com/
1401216808,2019-09-24 14:05:46,'Joker' Movie: Families Of Aurora Shooting Victims Express Concern About Upcoming Film ,https://www.ibtimes.com/joker-movie-families-aurora-shooting-victims-express-concern-about-upcoming-film-2832389?utm_source=Public&utm_medium=Feed&utm_campaign=Distribution,en,False,,41550,IBTimes,http://www.ibtimes.com/
1401221702,2019-09-24 14:22:20,California&#8217;s pension debt cannot be ignored,https://www.dailynews.com/2019/09/24/californias-pension-debt-cannot-be-ignored/,en,False,,24901,Bleacher Report,http://bleacherreport.com
1401234732,2019-09-24 14:35:24,"Citing Concerns Over New Joker Movie, Families of Aurora Shooting Victims Asks Warner Bros. to Support ‘Gun Safety’ Efforts",http://feedproxy.google.com/~r/time/topstories/~3/UkWY941ov0I/,en,False,,4419,Time,http://time.com
1401248201,2019-09-24 14:12:08,'Joker' raises concern for U.S. movie theater massacre families,http://feeds.reuters.com/~r/reuters/companyNews/~3/FZASh2dcqEE/joker-raises-concern-for-u-s-movie-theater-massacre-families-idUSL2N26F171,en,False,,4442,Reuters,http://www.reuters.com
1401249514,2019-09-24 14:37:06,FACT CHECK: Does Beto O&#8217;Rourke Have A Criminal Record That Prevents Him From Buying Guns?,http://checkyourfact.com/2019/09/24/fact-check-beto-orourke-criminal-record-gun/,en,False,,18775,Daily Caller,http://dailycaller.com
1401253417,2019-09-24 14:53:44,Aurora shooting victims' families express 'Joker' concerns,https://www.aol.com/article/entertainment/2019/09/24/aurora-shooting-victims-families-express-joker-concerns/23819106/,en,False,,150985,AOL News,http://news.aol.com/
1401256002,2019-09-24 14:12:08,'Joker' raises concern for U.S. movie theater massacre families,http://feeds.reuters.com/~r/reuters/companyNews/~3/FZASh2dcqEE/joker-raises-concern-for-u-s-movie-theater-massacre-families-idUSL2N26F171,en,False,,1089,Reuters ,http://www.reuters.com/
1401259943,2019-09-24 15:07:46,'Joker' film has families of Aurora theater shooting victims on edge,http://feeds.latimes.com/~r/latimes/entertainment/~3/FLc0C9N1wxM/aurora-victims-joker-movie-warner-bros,en,False,,6,LA Times,http://www.latimes.com/
1401303167,2019-09-24 16:12:14,Family members of Aurora shooting victims urge ‘Joker’ studio to support gun control causes,http://feeds.foxnews.com/~r/foxnews/entertainment/~3/gz2_Kl5cb80/survivors-of-aurora-shooting-urge-joker-studio-to-support-gun-control-causes,en,False,,1092,Fox News,http://www.foxnews.com/
1401302546,2019-09-24 16:06:08,Warner Bros. Weighs in On ‘Joker’ Controversy: Film Doesn’t Endorse Violence,https://variety.com/2019/film/news/joker-gun-violence-aurora-warner-bros-1203347987/,en,False,,19076,variety.com,http://www.variety.com
1401330856,2019-09-24 16:32:21,"Joaquin Phoenix Defends Joker as Families of Shooting Victims Voice Fears Over Violent Film
",https://people.com/movies/joaquin-phoenix-defends-joker-as-families-of-shooting-victims-voice-fears-over-violent-film/,en,False,,300472,PEOPLE.com,http://www.people.com/people/
1401332165,2019-09-24 16:46:46,What to Know About the Controversy Surrounding the Movie Joker,http://feedproxy.google.com/~r/time/topstories/~3/SIZu0WBhmdQ/,en,False,,40362,time,http://www.time.com/time/
1401331378,2019-09-24 16:46:46,What to Know About the Controversy Surrounding the Movie Joker,http://feedproxy.google.com/~r/time/topstories/~3/SIZu0WBhmdQ/,en,False,,4419,Time,http://time.com
1401342038,2019-09-24 16:29:31,Warner Bros. Responds After Aurora Victims Wrote A Letter About 'Joker',https://www.bustle.com/p/warner-bros-responds-after-aurora-victims-wrote-a-letter-about-joker-18798213,en,False,,98755,Bustle,http://www.bustle.com/#spider
1401343578,2019-09-24 16:49:34,Top Ohio Democrat doesn't expect significant gun reform from GOP-controlled House,http://rssfeeds.cincinnati.com/~/607124820/0/cincinnati-home~Top-Ohio-Democrat-doesnt-expect-significant-gun-reform-from-GOPcontrolled-House/,en,False,,26590,cincinnati.com,http://cincinnati.com
1401343889,2019-09-24 16:40:36,Warner Bros. Responds to Aurora Families Over Joker Movie Fears,http://feeds.ign.com/~r/ign/all/~3/m11Sv8LsQB4/warner-bros-responds-to-aurora-familiesa-letter-over-joker-movie-fears,en,False,,67289,ign.com,http://www.ign.com/#spider
1401344516,2019-09-24 16:59:00,U.S. Military Issues Warning to Troops About Incel Violence at Joker Screenings,https://io9.gizmodo.com/u-s-military-issues-warning-to-troops-about-incel-viol-1838412331,en,False,,4469,Gizmodo,http://gizmodo.com
1401380072,2019-09-24 17:10:59,Speaker Householder leery of governor's gun-reform proposals,https://www.dispatch.com/news/20190924/speaker-householder-leery-of-governors-gun-reform-proposals?rssfeed=true,en,False,,41,Columbus Dispatch,http://www.dispatch.com/
1401387196,2019-09-24 17:19:35,UPDATE 1-'Joker' raises concern for U.S. movie theater massacre families,http://feeds.reuters.com/~r/reuters/companyNews/~3/OcasmX5yhmU/update-1-joker-raises-concern-for-u-s-movie-theater-massacre-families-idUSL2N26F1TW,en,False,,4442,Reuters,http://www.reuters.com
1401391014,2019-09-24 17:46:02,Families of Aurora shooting victims pen letter expressing concerns about 'Joker' movie,http://rssfeeds.azcentral.com/~/607126636/0/phoenix/nation~Families-of-Aurora-shooting-victims-pen-letter-expressing-concerns-about-Joker-movie/,en,False,,25128,AZCentral,http://www.azcentral.com
1401396318,2019-09-24 17:46:02,Families of Aurora shooting victims pen letter expressing concerns about 'Joker' movie,http://rssfeeds.usatoday.com/~/607126636/0/usatodaycommovies-topstories~Families-of-Aurora-shooting-victims-pen-letter-expressing-concerns-about-Joker-movie/,en,False,,4,USA Today,http://www.usatoday.com
1401406893,2019-09-24 18:12:12,Families of Aurora theater shooting victims ask Warner Bros. to support gun reform on eve of “Joker” movie release,https://www.denverpost.com/2019/09/24/joker-movie-aurora-theater-shooting/,en,False,,390346,"Latest news, sports, weather from Denver and Colorado | The Denver Post",http://feeds.denverpost.com/dp-news-breaking
1401430387,2019-09-24 17:51:45,Allyship or queerbaiting? How thirsty pop stars are courting LGBTQ audience,http://feeds.latimes.com/~r/latimes/entertainment/~3/nxsCGteNKU4/pop-stars-lgbtq-audience-taylor-swift,en,False,,6,LA Times,http://www.latimes.com/
1401447398,2019-09-24 14:46:07,Warner Bros. Won't Screen ‘Joker’ at Aurora Theater After ‘Dark Knight Rises’ Shooting,http://feedproxy.google.com/~r/breitbart/~3/GD4Esaxrrnw/,en,False,,19334,Breitbart,http://www.breitbart.com
1401452305,2019-09-24 19:27:06,The Latest: Routine Emails Preceded Virginia Beach Massacre,https://www.usnews.com/news/us/articles/2019-09-24/the-latest-routine-emails-preceded-virginia-beach-massacre,en,True,,1100,US News & World Report ,http://www.usnews.com/
1401460087,2019-09-24 20:02:39,Police still searching for motive for Virginia mass shooting,https://www.kansascity.com/news/business/national-international/article235413572.html#storylink=rss,en,False,,30,Kansas City Star,http://www.kansascity.com/
1401464778,2019-09-24 20:02:39,Police still searching for motive for Virginia mass shooting,https://www.miamiherald.com/news/business/article235413572.html#storylink=rss,en,False,,28,Miami Herald,http://www.miamiherald.com/
1401478485,2019-09-24 20:38:11,Police still searching for motive for Virginia mass shooting,https://www.ledger-enquirer.com/news/business/article235413572.html#storylink=rss,en,False,,82483,ledger-enquirer.com,http://www.ledger-enquirer.com/#spider
1401539341,2019-09-24 21:30:00,Shooting threat at ‘Joker’ movie premiere spurs warning from Army Criminal Investigation Command,https://www.stripes.com/news/us/shooting-threat-at-joker-movie-premiere-spurs-warning-from-army-criminal-investigation-command-1.600375,en,False,,21270,Stars and Stripes,http://www.stripes.com
1401580877,2019-09-24 21:08:11,LA Kings partner with Sandy Hook Promise to teach violence prevention in Los Angeles area schools,https://www.dailynews.com/2019/09/24/la-kings-partner-with-sandy-hook-promise-to-teach-violence-prevention-in-los-angeles-area-schools/,en,False,,24901,Bleacher Report,http://bleacherreport.com
1401603792,2019-09-24 14:23:00,I’ll Be Goddamned If Chili Is Ever Considered A Health Food,https://adequateman.deadspin.com/i-ll-be-goddamned-if-chili-is-ever-considered-a-health-1838396103,en,False,,22389,Deadspin,http://deadspin.com
1401667597,2019-09-25 02:33:24,US Army Base Issues Warning Over Potential Shooting Threat Related to &#8216;Joker&#8217;,https://www.thewrap.com/us-army-base-issues-warning-over-potential-shooting-threat-related-to-joker/,en,False,,18704,The Wrap,http://www.thewrap.com
1401712883,2019-09-25 03:34:48,One Colorado school shooting suspect claims he was forced to do it,http://rss.cnn.com/~r/rss/cnn_latest/~3/QFu-DGYtgMk/index.html,en,False,,20088,CNN U.S. Edition,http://us.cnn.com
1401741195,2019-09-25 03:59:22,"Eagle hacking, lunar lab, vegan Disney: News from around our 50 states",http://rssfeeds.azcentral.com/~/607140994/0/phoenix/nation~Eagle-hacking-lunar-lab-vegan-Disney-News-from-around-our-states/,en,False,,25128,AZCentral,http://www.azcentral.com
1401757570,2019-09-25 03:59:22,"Eagle hacking, lunar lab, vegan Disney: News from around our 50 states",http://rssfeeds.usatoday.com/~/607140994/0/usatoday-newstopstories~Eagle-hacking-lunar-lab-vegan-Disney-News-from-around-our-states/,en,False,,4,USA Today,http://www.usatoday.com
1401857248,2019-09-25 06:34:07,Power Up: Why Pelosi changed her mind on impeachment,https://www.washingtonpost.com/news/powerpost/paloma/powerup/2019/09/25/powerup-why-pelosi-changed-her-mind-on-impeachment/5d8a837088e0fa4b0ec24595/,en,False,,2,Washington Post,http://washingtonpost.com
1402064914,2019-09-25 10:02:00,Warner Bros. says 'Joker' movie is not 'an endorsement of real-world violence',https://www.cnbc.com/2019/09/25/warner-bros-says-joker-is-not-an-endorsement-of-real-world-violence.html,en,False,,1755,CNBC,http://www.cnbc.com/
1402082218,2019-09-25 09:29:51,Europe's Far Right Is Recruiting From the Military and Police to Get More Weapons,https://www.vice.com/en_us/article/7x5wxb/europes-far-right-is-recruiting-from-the-military-and-police-to-get-more-weapons,en,False,,300613,VICE,http://www.vice.com/en_us
1402091220,2019-09-25 05:15:18,"""Joker"" won't screen at Aurora theater where ""The Dark Knight Rises"" mass shooting occurred in 2012",https://www.salon.com/2019/09/25/joker-wont-screen-at-aurora-theater-where-the-dark-knight-rises-mass-shooting-occurred-in-2012/,en,False,,1757,Salon,http://www.salon.com/
1402130527,2019-09-25 11:36:06,"Man threatens for hours to ‘shoot all the rich kids’ at University of Texas, cops say",https://www.kansascity.com/news/nation-world/national/article235458497.html#storylink=rss,en,False,,30,Kansas City Star,http://www.kansascity.com/
1402133273,2019-09-25 11:36:06,"Man threatens for hours to ‘shoot all the rich kids’ at University of Texas, cops say",https://www.ledger-enquirer.com/news/nation-world/national/article235458497.html#storylink=rss,en,False,,82483,ledger-enquirer.com,http://www.ledger-enquirer.com/#spider
1402186252,2019-09-25 12:07:47,"Despite GOP criticism, DeWine says he won't change gun violence plan",https://www.dispatch.com/news/20190925/despite-gop-criticism-dewine-says-he-wont-change-gun-violence-plan?rssfeed=true,en,False,,41,Columbus Dispatch,http://www.dispatch.com/
1402260672,2019-09-25 14:10:42,Florida official says suspended Parkland sheriff should return to duty,https://nypost.com/2019/09/25/florida-official-says-suspended-parkland-sheriff-should-return-to-duty/,en,False,,7,New York Post,http://www.nypost.com/
1402281030,2019-09-25 13:40:49,"On 'The View,' Senate candidate Mark Kelly says Trump allegations must be investigated",http://rssfeeds.azcentral.com/~/607157958/0/phoenix/politics~On-The-View-Senate-candidate-Mark-Kelly-says-Trump-allegations-must-be-investigated/,en,False,,25128,AZCentral,http://www.azcentral.com
1402283534,2019-09-25 14:45:40,&#8216;Joker&#8217; Director Todd Phillips Rebuffs Criticism of Dark Tone: &#8216;We Didn&#8217;t Make the Movie to Push Buttons&#8217; (Exclusive),https://www.thewrap.com/joker-director-todd-phillips-rebuffs-criticism-of-dark-tone-we-didnt-make-the-movie-to-push-buttons-exclusive/,en,False,,18704,The Wrap,http://www.thewrap.com
1402291816,2019-09-25 12:45:22,Oklahoma Army base memo warns of potential theater threat,https://www.dispatch.com/ZZ/news/20190925/oklahoma-army-base-memo-warns-of-potential-theater-threat?rssfeed=true,en,True,,41,Columbus Dispatch,http://www.dispatch.com/
1402291974,2019-09-25 12:45:22,Oklahoma Army base memo warns of potential theater threat,https://www.norwichbulletin.com/ZZ/news/20190925/oklahoma-army-base-memo-warns-of-potential-theater-threat?rssfeed=true,en,True,,74242,norwichbulletin.com,http://www.norwichbulletin.com/#spider
1402307633,2019-09-25 15:29:39,"Sparks fly at assault-weapons ban hearing on Capitol Hill, ex-cop vows she would 'not comply'",https://www.foxnews.com/politics/house-dems-push-for-assault-weapons-ban,en,False,,1092,Fox News,http://www.foxnews.com/
1402313937,2019-09-25 15:20:18,"No criminal charges against LA cop who shot unarmed man, parents in Costco: Grand jury",http://rssfeeds.usatoday.com/~/607161242/0/usatodaycomnation-topstories~No-criminal-charges-against-LA-cop-who-shot-unarmed-man-parents-in-Costco-Grand-jury/,en,False,,4,USA Today,http://www.usatoday.com
1402362625,2019-09-25 12:45:22,Oklahoma Army base memo warns of potential theater threat,https://www.providencejournal.com/ZZ/news/20190925/oklahoma-army-base-memo-warns-of-potential-theater-threat?rssfeed=true,en,True,,68874,providencejournal.com,http://www.providencejournal.com/#spider
1402373100,2019-09-25 13:30:00,Department of Homeland Security Prioritizes White Supremacy as a Threat: ‘Has No Place in the United States of America’,https://www.theroot.com/department-of-homeland-security-prioritizes-white-supre-1838447921,en,False,,368082,theroot.com,http://theroot.com/
1402380143,2019-09-25 16:42:28,66 slain journalists to receive Colby College&#8217;s 2019 Lovejoy Award for courageous reporting,https://www.centralmaine.com/2019/09/25/66-slain-journalists-to-receive-colby-colleges-2019-lovejoy-award-for-courageous-reporting/,en,False,,25755,Central Maine News,https://www.centralmaine.com/
