stories_id,publish_date,title,url,language,ap_syndicated,themes,media_id,media_name,media_url
1428737017,2019-10-25 13:05:03,"Even amid impeachment probe, both sides cheer for the Nats",https://www.foxsports.com/mlb/story/even-amid-impeachment-probe-both-sides-cheer-for-the-nats-102519,en,True,,276739,Fox Sports,https://www.foxsports.com/
1428816081,2019-10-25 14:29:14,"Bump Stock Owners Forced to Destroy Devices Can't Get Compensation from Feds, Judge Says",https://www.newsweek.com/bump-stock-ban-lawsuit-dismissed-1467834?utm_source=Public&utm_medium=Feed&utm_campaign=Distribution,en,False,,56510,Newsweek,http://newsweek.com/
1428902724,2019-10-25 17:15:25,Russian Soldier Kills 8 In Mass Shooting at Siberian Military Base,http://feedproxy.google.com/~r/time/topstories/~3/Iy080eYgQNs/,en,False,,40362,time,http://www.time.com/time/
1428906654,2019-10-25 17:15:25,Russian Soldier Kills 8 In Mass Shooting at Siberian Military Base,https://time.com/5711050/russian-soldier-mass-shooting-military-base/,en,False,,4419,Time,http://time.com
1428938092,2019-10-25 18:28:12,"Even amid impeachment probe, both sides cheer for the Nats",https://www.ledger-enquirer.com/sports/article236651478.html#storylink=rss,en,False,,82483,ledger-enquirer.com,http://www.ledger-enquirer.com/#spider
1428940776,2019-10-25 18:19:45,Anti-Semitism is growing in this country. We all must confront it | Opinion,https://www.miamiherald.com/opinion/op-ed/article236662448.html#storylink=rss,en,False,,28,Miami Herald,http://www.miamiherald.com/
1428998073,2019-10-25 18:30:10,"Even amid impeachment probe, both sides cheer for the Nats",http://www.startribune.com/even-amid-impeachment-probe-both-sides-cheer-for-the-nats/563857592/,en,False,,19,Star Tribune ,http://www.startribune.com/
1429394150,2019-10-26 10:34:29,Brother of Sandy Hook victim calls out Biden for &#8216;lying&#8217; in campaign ad,https://nypost.com/2019/10/26/brother-of-sandy-hook-victim-calls-out-biden-for-lying-in-campaign-ad/,en,False,,7,New York Post,http://www.nypost.com/
1429470181,2019-10-26 12:30:22,This Is What Life Is Like For Us A Year After The Tree Of Life Synagogue Mass Shooting,https://www.huffpost.com/entry/tree-of-life-mass-shooting-anniversary_n_5db06fa6e4b0131fa998079a,en,False,,27502,HuffPost,http://www.huffingtonpost.com/#
1429482328,2019-10-26 13:18:46,Trump Still Hasn’t Addressed Pittsburgh Shooting Suspect’s Anti-Refugee Views,https://www.huffpost.com/entry/trump-hias-pittsburgh-synagogue-shooting_n_5db31218e4b0a893740418de,en,False,,27502,HuffPost,http://www.huffingtonpost.com/#
1429651755,2019-10-26 20:49:41,Opinion: Pittsburgh synagogue shooting reminder that words matter,http://rssfeeds.cincinnati.com/~/608268066/0/cincinnati-home~Opinion-Pittsburgh-synagogue-shooting-reminder-that-words-matter/,en,False,,26590,cincinnati.com,http://cincinnati.com
1429877915,2019-10-27 07:01:02,"Why do we even have a clock? Mass shooting in Greenville, Texas. Unconfirmed details are light, but possibly 2 fatalities and over a dozen injured during homecoming party [News]",https://www.fark.com/comments/10601718?utm_source=feed&utm_medium=comments&utm_campaign=fark,en,False,,19921,fark.com,http://www.fark.com
1429880830,2019-10-27 06:03:04,"A year after Pittsburgh synagogue mass shooting, gun reform legislation stalls amid impeachment inquiry",http://rss.cnn.com/~r/rss/cnn_latest/~3/QGVUJJFGeCc/index.html,en,False,,1095,CNN,http://www.cnn.com/
1429980770,2019-10-27 07:59:10,Tree of Life: How can a community heal after a mass shooting? A rabbi searches for answers,http://rssfeeds.usatoday.com/~/608279730/0/usatoday-newstopstories~Tree-of-Life-How-can-a-community-heal-after-a-mass-shooting-A-rabbi-searches-for-answers/,en,False,,4,USA Today,http://www.usatoday.com
1429982325,2019-10-27 09:39:52,"Two dead, at least 14 injured in Texas homecoming party shooting",https://www.upi.com/Top_News/US/2019/10/27/Two-dead-at-least-14-injured-in-Texas-homecoming-party-shooting/4321572183080/,en,False,,1706,UPI,http://www.upi.com/
1430001016,2019-10-27 08:08:31,Marking One Year Since Pittsburgh Synagogue Shooting,https://www.npr.org/2019/10/27/773817355/marking-one-year-since-pittsburgh-synagogue-shooting?utm_medium=RSS&utm_campaign=weekendeditionsunday,en,False,,1096,NPR,http://www.npr.org/
1430159874,2019-10-27 16:47:37,How Abu Bakr al-Baghdadi rose from a radical religious scholar to the brutal leader of the most powerful terrorist group in the world,https://www.businessinsider.com/who-is-abu-bakr-al-baghdadi-isis-leader-killed-syria-2019-10,en,False,,18710,Business Insider,http://www.businessinsider.com
1430185370,2019-10-27 17:30:18,"Two dead, 12 hurt, manhunt underway after rampage at party near Texas A&M University-Commerce",http://rssfeeds.indystar.com/~/608283660/0/indystar/todaystopstories~Two-dead-hurt-manhunt-underway-after-rampage-at-party-near-Texas-AM-UniversityCommerce/,en,False,,85390,blogs.indystar.com,http://blogs.indystar.com/#spider
1430190789,2019-10-27 17:16:11,Jewish community still healing one year after mass shooting,https://www.pbs.org/newshour/show/jewish-community-still-healing-one-year-after-mass-shooting,en,False,,271188,PBS NewsHour,http://www.pbs.org/newshour/
1430241519,2019-10-27 18:27:41,Lame Duck: Joe Biden Refuses to Rule Out Serving Only One Term if Elected in 2020,http://feedproxy.google.com/~r/breitbart/~3/DFSYntewzks/,en,False,,19334,Breitbart,http://www.breitbart.com
1430302824,2019-10-27 22:06:08,Texas authorities on manhunt after 2 shot dead at Halloween party,https://www.cbsnews.com/news/greenville-shooting-texas-police-manhunt-2-dead-in-a-m-commerce-party-shooting-2019-10-27/,en,False,,1752,CBS News,http://www.cbsnews.com/
1430360175,2019-10-28 01:02:04,Dave Chappelle says comedy 'saved my life' as he accepts the Mark Twain Prize,http://rss.cnn.com/~r/rss/cnn_topstories/~3/SiwLE2GoJU0/index.html,en,False,,1095,CNN,http://www.cnn.com/
1430359708,2019-10-28 01:02:04,Dave Chappelle says comedy 'saved my life' as he accepts the Mark Twain Prize for American Humor,http://rss.cnn.com/~r/rss/cnn_latest/~3/SiwLE2GoJU0/index.html,en,False,,20088,CNN U.S. Edition,http://us.cnn.com
1430773983,2019-10-28 11:33:33,"Pediatricians are more likely to ask families about smoke alarm safety than gun safety, study says",http://rss.cnn.com/~r/rss/cnn_latest/~3/mMUJX3k7CV8/index.html,en,False,,1095,CNN,http://www.cnn.com/
1430825853,2019-10-28 12:09:47,Gunfire Interrupts Vigil For Texas Mass Shooting Victim,https://www.huffpost.com/entry/gunfire-at-vigil-for-texas-shooting-victim_n_5db6dbe1e4b079eb95a6e994,en,False,,623375,Huffington Post - United States,http://www.huffingtonpost.com/?country=US
1430993163,2019-10-28 16:23:00,Suspect arrested in shooting at Texas homecoming party that killed 2,https://www.nbcnews.com/news/us-news/suspect-arrested-shooting-texas-homecoming-party-killed-2-n1072981?cid=public-rss_20191028,en,False,,34663,NBC Breaking News,http://www.breakingnews.com#spider
1431033460,2019-10-28 17:36:44,"Police arrest suspect in Texas shooting spree that killed 2, injured 12",https://www.foxnews.com/us/police-arrest-suspect-in-texas-shooting-spree-that-killed-2-injured-12,en,False,,1092,Fox News,http://www.foxnews.com/
1431039954,2019-10-28 17:19:35,"Police charge man in shooting at off-campus college homecoming party in Greenville, Texas",http://rss.cnn.com/~r/rss/cnn_latest/~3/6lx1Co7M1pU/index.html,en,False,,1095,CNN,http://www.cnn.com/
1431051008,2019-10-28 18:11:53,"Stolen from murdered firefighter, cops say: A pair of Nikes, an iPhone, a knife and $55",https://www.miamiherald.com/news/local/crime/article236751788.html#storylink=rss,en,False,,28,Miami Herald,http://www.miamiherald.com/
1431051746,2019-10-28 17:48:38,Arrest Made In Deadly Shooting At Texas College Homecoming Party,https://www.huffpost.com/entry/arrest-texas-homecoming-party-shooting_n_5db74ed5e4b006d4917372da,en,False,,96720,HuffPost Latino Voices,http://voces.huffingtonpost.com/#spider
1431054189,2019-10-28 17:48:38,Arrest Made In Deadly Shooting At Texas College Homecoming Party,https://www.huffpost.com/entry/arrest-texas-homecoming-party-shooting_n_5db74ed5e4b006d4917372da,en,False,,623375,Huffington Post - United States,http://www.huffingtonpost.com/?country=US
1431055639,2019-10-28 17:48:38,Arrest Made In Deadly Shooting At Texas College Homecoming Party,https://www.huffpost.com/entry/arrest-texas-homecoming-party-shooting_n_5db74ed5e4b006d4917372da,en,False,,27502,HuffPost,http://www.huffingtonpost.com/#
1431102604,2019-10-29 08:15:49,Is Trump close to a psychotic break? Harvard psychiatrist on the president’s downward spiral — and why his paranoia may persuade him to leave office,https://www.alternet.org/2019/10/is-trump-close-to-a-psychotic-break-harvard-psychiatrist-on-the-presidents-downward-spiral-and-why-his-paranoia-may-persuade-him-to-leave-office/,en,False,,56758,Alternet,https://www.alternet.org/
1431250486,2019-10-29 07:50:11,Jill Lepore’s Liberal Gospel,https://www.thenation.com/article/jill-lepore-these-truths-this-america-review/,en,False,,1115,The Nation ,http://www.thenation.com/
1431276419,2019-10-29 02:00:46,"Psychiatrist Lance Dodes on the ""panicked"" state of the ""most dangerous person on the planet""",https://www.salon.com/2019/10/29/psychiatrist-lance-dodes-on-the-panicked-state-of-the-most-dangerous-person-on-the-planet/,en,False,,1757,Salon,http://www.salon.com/
1431214713,2019-10-29 10:01:29,Pennsylvania to Extend Security Grants to Fight Hate Crimes,https://www.usnews.com/news/best-states/pennsylvania/articles/2019-10-29/pennsylvania-to-extend-security-grants-to-fight-hate-crimes,en,True,,1100,US News & World Report ,http://www.usnews.com/
1431315431,2019-10-29 11:40:57,'Lock them up' election is banana republic stuff,http://rss.cnn.com/~r/rss/cnn_latest/~3/BW6mMNTEC-Y/index.html,en,False,,1095,CNN,http://www.cnn.com/
1431347167,2019-10-29 11:59:15,"Robert De Niro Blasts 'Buffoon' Trump, Blames Fans of 'The Apprentice': 'They Created a Monster'",https://www.newsweek.com/robert-de-niro-blasts-buffoon-trump-blames-fans-apprentice-they-created-monster-1468423?utm_source=Public&utm_medium=Feed&utm_campaign=Distribution,en,False,,56510,Newsweek,http://newsweek.com/
1431400606,2019-10-29 11:59:15,"Robert De Niro Blasts 'Buffoon' Trump, Blames Fans of 'The Apprentice': 'They Created a Monster'",https://www.newsweek.com/robert-de-niro-blasts-buffoon-trump-blames-fans-apprentice-they-created-monster-1468423?utm_source=Public&utm_medium=Feed&utm_campaign=Distribution,en,False,,1098,Newsweek ,http://www.newsweek.com/
1431429294,2019-10-29 06:30:57,Where U.S. presidential candidates stand on breaking up Big Tech,http://feeds.reuters.com/~r/reuters/technologyNews/~3/ilfAZnCzxW4/where-u-s-presidential-candidates-stand-on-breaking-up-big-tech-idUSKBN1X811J,en,False,,1089,Reuters ,http://www.reuters.com/
1431436521,2019-10-29 06:30:57,Where U.S. presidential candidates stand on breaking up Big Tech,http://feeds.reuters.com/~r/reuters/technologyNews/~3/ilfAZnCzxW4/where-u-s-presidential-candidates-stand-on-breaking-up-big-tech-idUSKBN1X811J,en,False,,4442,Reuters,http://www.reuters.com
1431483203,2019-10-29 11:40:57,Opinion: 'Lock them up' election is banana republic stuff,http://rss.cnn.com/~r/rss/cnn_topstories/~3/BW6mMNTEC-Y/index.html,en,False,,20088,CNN U.S. Edition,http://us.cnn.com
1431300286,2019-10-29 11:10:00,7 haunted houses that were once worth over $1 million,http://feedproxy.google.com/~r/businessinsider/~3/0fWgRAcatH4/scary-stories-expensive-haunted-houses,en,False,,18710,Business Insider,http://www.businessinsider.com
1431645813,2019-10-29 16:22:05,Where every presidential candidate stands on breaking up Big Tech,https://nypost.com/2019/10/29/where-every-presidential-candidate-stands-on-breaking-up-big-tech/,en,False,,7,New York Post,http://www.nypost.com/
1431686318,2019-10-29 16:31:03,"El Paso Walmart offers glimpse at memorial for mass shooting victims, reopening pushed back",http://rssfeeds.azcentral.com/~/608408646/0/phoenix/nation~El-Paso-Walmart-offers-glimpse-at-memorial-for-mass-shooting-victims-reopening-pushed-back/,en,False,,25128,AZCentral,http://www.azcentral.com
1431766939,2019-10-29 18:43:04,‘The Hardest Is Over.’ Capital Gazette Shooting Survivors Share Relief After Gunman Pleads Guilty,http://feedproxy.google.com/~r/time/topstories/~3/lHbgT3v9QxU/,en,False,,40362,time,http://www.time.com/time/
1431769746,2019-10-29 19:10:41,The Latest: Pittsburgh plans appeal after gun laws tossed,http://www.startribune.com/the-latest-pittsburgh-plans-appeal-after-gun-laws-tossed/564067842/,en,False,,19,Star Tribune ,http://www.startribune.com/
1431784898,2019-10-29 14:56:58,"Bigger, better ER focus of $221 million revamp for University of Cincinnati Medical Center",http://rssfeeds.cincinnati.com/~/608398216/0/cincinnati-home~Bigger-better-ER-focus-of-million-revamp-for-University-of-Cincinnati-Medical-Center/,en,False,,26590,cincinnati.com,http://cincinnati.com
1431819925,2019-10-29 17:03:09,"El Paso Walmart offers glimpse at memorial for mass shooting victims, reopening pushed back",http://rssfeeds.jsonline.com/~/608408646/0/milwaukee/news~El-Paso-Walmart-offers-glimpse-at-memorial-for-mass-shooting-victims-reopening-pushed-back/,en,False,,36,Milwaukee Journal Sentinel ,http://www.jsonline.com/
1431843918,2019-10-29 21:26:52,"Pittsburgh Gun Control Ordinances Overturned by Judge, Ruled 'Unenforceable'",https://www.newsweek.com/pittsburgh-gun-control-ordinances-overturned-judge-ruled-unenforceable-1468578?utm_source=Public&utm_medium=Feed&utm_campaign=Distribution,en,False,,56510,Newsweek,http://newsweek.com/
1431847645,2019-10-29 17:30:15,Video: Beto O'Rourke Gives Embarrassing Answer on AR-15s After High School Student Trips Him Up,https://redstate.com//sister-toldjah/2019/10/29/video-beto-orourke-gives-embarrassing-answer-ar-15s-high-school-student-trips/,en,False,,128,RedState,http://www.redstate.com
1431848889,2019-10-29 20:48:28,Judge Strikes Down Pittsburgh Gun Laws Passed After Tree of Life Massacre,http://feedproxy.google.com/~r/time/topstories/~3/eCGgPVqxtrA/,en,False,,40362,time,http://www.time.com/time/
1431962693,2019-10-30 01:15:09,AP Interview: Mass shootings haunt federal prosecutor,http://www.startribune.com/ap-interview-mass-shootings-haunt-federal-prosecutor/564083942/,en,False,,19,Star Tribune ,http://www.startribune.com/
1431962257,2019-10-30 01:10:27,AP Interview: Mass shootings haunt federal prosecutor,https://www.sfgate.com/news/crime/article/AP-Interview-Mass-shootings-haunt-federal-14573230.php,en,True,,14,SF Chronicle,http://www.sfgate.com/
1431992401,2019-10-30 01:08:10,AP Interview: Mass Shootings Haunt Federal Prosecutor,https://www.usnews.com/news/us/articles/2019-10-30/ap-interview-mass-shootings-haunt-federal-prosecutor,en,True,,1100,US News & World Report ,http://www.usnews.com/
1432055213,2019-10-30 02:32:09,"&#8216;Tragic&#8217; Long Beach shooting leaves 3 dead, 9 injured",https://www.ocregister.com/2019/10/29/several-people-injured-in-long-beach-shooting-some-fatalities-reported/,en,False,,25,Orange County Register,http://www.ocregister.com/
1432137782,2019-10-30 05:03:42,"Here’s one critical question pediatricians should ask every parent, yet many doctors are reluctant to bring it up  ",http://www.marketwatch.com/news/story.asp?guid=%7B4A77E0B0-FA8A-11E9-84F5-073DEA4C7DB8%7D&siteid=rss&rss=1,en,False,,1150,Wall Street Journal,https://www.wsj.com/
1432156176,2019-10-30 06:17:51,Virginia state elections offer early political test ahead of 2020 U.S. race,http://feeds.reuters.com/~r/Reuters/domesticNews/~3/L0C217kS-yA/virginia-state-elections-offer-early-political-test-ahead-of-2020-u-s-race-idUSKBN1X9149,en,False,,4442,Reuters,http://www.reuters.com
1432158587,2019-10-30 05:03:42,"Here’s one critical question pediatricians should ask every parent, yet many doctors are reluctant to bring it up  ",http://www.marketwatch.com/news/story.asp?guid=%7B4A77E0B0-FA8A-11E9-84F5-073DEA4C7DB8%7D&siteid=rss&rss=1,en,False,,35170,Marketwatch,https://www.marketwatch.com/
1432172532,2019-10-30 06:17:51,Virginia State Elections Offer Early Political Test Ahead of 2020 U.S. Race,https://www.usnews.com/news/top-news/articles/2019-10-30/virginia-state-elections-offer-early-political-test-ahead-of-2020-us-race,en,False,,1100,US News & World Report ,http://www.usnews.com/
1432283092,2019-10-30 08:39:53,California: shooting in Long Beach leaves three dead and nine injured,https://www.theguardian.com/us-news/2019/oct/30/california-long-beach-shooting-dead-injured,en,False,,623382,Guardian,http://www.theguardian.com/us
1432305222,2019-10-30 09:12:14,Long Beach Shooting: Mass Shooting at California 'Halloween Party' Leaves Three People Dead and Nine Injured,https://www.newsweek.com/three-dead-nine-injured-mass-shooting-california-long-beach-1468612?utm_source=Public&utm_medium=Feed&utm_campaign=Distribution,en,False,,56510,Newsweek,http://newsweek.com/
1432334338,2019-10-30 08:00:43,Newsletter: California's dangerous winds,https://www.latimes.com/world-nation/story/2019-10-30/winds-california-extreme-red-flag-warning-newsletter,en,False,,6,LA Times,http://www.latimes.com/
1432495193,2019-10-30 13:19:03,"One critical question pediatricians should ask every parent, yet many don’t  ",http://feeds.marketwatch.com/~r/marketwatch/pf/~3/LOlCHujGx7w/story.asp,en,False,,35170,Marketwatch,https://www.marketwatch.com/
1432532760,2019-10-30 13:10:22,"Design concepts unveiled for Pulse memorial, museum",http://www.startribune.com/design-concepts-unveiled-for-pulse-memorial-museum/564108292/,en,False,,19,Star Tribune ,http://www.startribune.com/
1432557017,2019-10-30 13:19:03,"One critical question pediatricians should ask every parent, yet many don’t  ",http://feeds.marketwatch.com/~r/marketwatch/pf/~3/LOlCHujGx7w/story.asp,en,False,,1150,Wall Street Journal,https://www.wsj.com/
1432560473,2019-10-30 13:29:02,"Design Concepts Unveiled for Pulse Memorial, Museum",https://www.usnews.com/news/us/articles/2019-10-30/design-concepts-unveiled-for-pulse-memorial-museum,en,True,,1100,US News & World Report ,http://www.usnews.com/
1432582566,2019-10-30 14:24:27,"Gun-Control Group Dropping $100,000 into Virginia Elections in Last-Minute Push",https://www.newsweek.com/everytown-national-rifle-association-gun-control-virginia-1468757?utm_source=Public&utm_medium=Feed&utm_campaign=Distribution,en,False,,56510,Newsweek,http://newsweek.com/
1432615314,2019-10-30 15:01:22,The NRA Is Contributing a Record Amount to Protect Republicans in Its Home State,https://www.motherjones.com/politics/2019/10/the-nra-is-contributing-a-record-amount-to-protect-republicans-in-its-home-state/,en,False,,1112,Mother Jones,http://www.motherjones.com/
1432650163,2019-10-30 15:44:09,"Opinion: A mass shooting in Long Beach kills three, wounds nine. Few people notice",http://feeds.latimes.com/~r/topoftheticket/~3/gsRFNYa8lMQ/mass-shooting-long-beach-kills-three-wounds-nine-nra-gun-violence,en,False,,6,LA Times,http://www.latimes.com/
1432703838,2019-10-30 16:28:35,El Paso Shooting Aftermath: Walmart To Reopen With One Major Addition,https://www.ibtimes.com/el-paso-shooting-aftermath-walmart-reopen-one-major-addition-2856840?utm_source=Public&utm_medium=Feed&utm_campaign=Distribution,en,False,,41550,IBTimes,http://www.ibtimes.com/
1432737998,2019-10-30 17:09:17,Pediatricians talk less about guns after mass shootings,http://feeds.reuters.com/~r/reuters/healthNews/~3/1bFePhG4vhc/pediatricians-talk-less-about-guns-after-mass-shootings-idUSKBN1X92KD,en,False,,1089,Reuters ,http://www.reuters.com/
1432914812,2019-10-30 23:09:01,"Long Beach vigil honors the 3 killed, 9 injured in mass shooting as police continue search for gunman",https://www.ocregister.com/2019/10/30/long-beach-vigil-honors-the-3-killed-9-injured-in-mass-shooting-as-police-continue-search-for-gunman/,en,False,,25,Orange County Register,http://www.ocregister.com/
1432937748,2019-10-30 23:09:01,"Long Beach vigil honors the 3 killed, 9 injured in mass shooting as police continue search for gunman",https://www.dailynews.com/2019/10/30/long-beach-vigil-honors-the-3-killed-9-injured-in-mass-shooting-as-police-continue-search-for-gunman/,en,False,,24901,Bleacher Report,http://bleacherreport.com
1432975059,2019-10-30 23:34:36,New Zealand bans video game glorifying Christchurch mosque shooting,http://feeds.reuters.com/~r/Reuters/worldNews/~3/mV18_5vqk5E/new-zealand-bans-video-game-glorifying-christchurch-mosque-shooting-idUSKBN1XA0D5,en,False,,1089,Reuters ,http://www.reuters.com/
1449627167,2019-10-02 22:45:00,"Beto O'Rourke, Pete Buttigieg clash at Las Vegas gun safety forum for Democratic presidential contenders",https://www.dallasnews.com/news/politics/2019/10/02/beto-orourke-pete-buttigieg-clash-las-vegas-gun-safety-forum-democratic-presidential-contenders/,en,False,,12,Dallas Morning News,http://www.dallasnews.com/
1482922280,2019-10-01 00:00:00,2020 candidates convene on gun safety forum on the heels of Las Vegas shooting anniversary - ABC News,https://abcnews.go.com/Politics/2020-candidates-convene-gun-safety-forum-heels-las/story?id=65980074,en,False,,39000,ABC News,http://abcnews.go.com/
1482967370,2019-10-09 08:00:00,Background check loopholes in gun sales put Texans in danger [Editorial],https://www.houstonchronicle.com/opinion/editorials/article/Background-check-loopholes-put-Texans-in-danger-14502241.php?utm_campaign=webftp,en,False,,10,houstonchronicle,http://www.chron.com/
1483875901,2019-09-30 00:00:00,"Ohio House GOP bill would allow involuntary drug treatment, require background-check database updates",https://www.cleveland.com/open/2019/09/ohio-house-gop-bill-would-allow-involuntary-drug-treatment-require-background-check-database-updates.html,en,False,,1641,cleveland.com,http://www.cleveland.com/
1484296895,2019-10-16 19:33:07,Beto O'Rourke Suggests Police Would 'Visit' Homes To Implement Proposed Assault Weapons Ban,https://www.newsweek.com/beto-orourke-gun-buyback-assault-weapons-1465738?utm_source=MSN&utm_medium=Feed&utm_campaign=Partnerships,en,False,,2,Washington Post,http://washingtonpost.com
1484434214,2019-10-02 00:00:00,$800 million settlement announced with victims of Las Vegas massacre - ABC News,https://abcnews.go.com/US/massive-settlement-victims-las-vegas-massacre-set-announced/story?id=66022468&cid=clicksource_4380645_null_headlines_hed,en,False,,39000,ABC News,http://abcnews.go.com/
1484779084,2019-10-11 04:18:38,"Family of Parkland shooting victim objects to her image being used in ""March For Our Lives"" protest of Donald Trump Jr.",https://www.newsweek.com/family-parkland-shooting-victim-objects-her-image-being-used-march-our-lives-protests-1464541?amp=1&__twitter_impression=true,en,False,,2,Washington Post,http://washingtonpost.com
1484780308,2019-10-30 15:31:07,Elizabeth Warren: Ban 'Deadly' Firearm Suppressors,https://www.breitbart.com/politics/2019/10/30/elizabeth-warren-ban-deadly-firearm-suppressors/,en,False,,19334,Breitbart,http://www.breitbart.com
1484801098,2019-10-08 00:00:00,"Trump White House To Democrats On Impeachment: We're Not Cooperating, So Come And Get Us",https://townhall.com/tipsheet/mattvespa/2019/10/08/trump-white-house-to-democrats-on-impeachment-were-not-cooperating-so-come-and-n2554389?utm_source=thdaily&utm_medium=email&utm_campaign=nl&newsletterad=10/09/2019&bcid=c51e5dcf4efffabaa3d9b2f12be093b9&recip=19194837,en,False,,19763,townhall.com,http://townhall.com
1484864506,2019-10-08 00:00:00,"VIDEO: Beto O'Rourke Wants To Ban, Confiscate Some Guns. Texas Voters Want Details",https://www.npr.org/transcripts/767840643?storyId=767840643?storyId=767840643,en,False,,1096,NPR,http://www.npr.org/
1485053689,2019-10-16 00:00:00,Trump administration: Academy Sports liable for selling gun to Sutherland Springs shooter,https://www.dallasnews.com/news/politics/2019/10/16/trump-administration-academy-sports-liable-for-selling-gun-to-sutherland-springs-shooter/,en,False,,12,Dallas Morning News,http://www.dallasnews.com/
1485240879,2019-10-09 17:50:45,"As NRA Is Outspent in Key Battles, Gun Control Group Drops Huge Ad Buy in Virginia Ahead of General Election",https://www.newsweek.com/nra-gun-control-giffords-virginia-colorado-1464188,en,False,,2,Washington Post,http://washingtonpost.com
1485240900,2019-10-28 20:43:13,"Trump attacks Chicago, local official in speech to law enforcement org - Business Insider",https://www.businessinsider.com/trump-attacks-chicago-official-speech-law-enforcement-group-2019-10?utm_source=feedburner&utm_medium=referral,en,False,,18710,Business Insider,http://www.businessinsider.com
1485649584,2019-10-03 00:00:00,'I Was Really Offended': Beto Knocks Buttigieg For Not Supporting Mandatory Confiscation of AR-15s,https://townhall.com/tipsheet/juliorosas/2019/10/03/i-was-really-offended-beto-knocks-buttigieg-for-not-supporting-mandatory-buy-backs-of-ar15s-n2554108,en,False,,19763,townhall.com,http://townhall.com
1485898814,2019-10-15 14:19:57,"Kathy Griffin on Being in ‘Trump’ Massacre Video: ‘Oh, Fuck’",https://www.thedailybeast.com/kathy-griffin-on-being-in-trump-massacre-video-oh-fck,en,False,,1707,Daily Beast,http://www.thedailybeast.com/
1486450751,2019-10-28 14:07:00,Who is Abu Bakr al-Baghdadi: ISIS leader killed in Syria - Business Insider,https://www.businessinsider.com/who-is-abu-bakr-al-baghdadi-isis-leader-killed-syria-2019-10?utm_source=feedburner&utm_medium=referral,en,False,,18710,Business Insider,http://www.businessinsider.com
1487167964,2019-10-23 00:00:00,Cornyn rolls out gun plan focused on mental health; foes demand broader background checks and ammo limits,https://www.dallasnews.com/news/politics/2019/10/23/cornyn-rolls-out-gun-plan-focused-on-mental-health-foes-demand-background-checks-and-ammo-limits/,en,False,,12,Dallas Morning News,http://www.dallasnews.com/
