stories_id,publish_date,title,url,language,ap_syndicated,themes,media_id,media_name,media_url
1382715949,2019-09-04 05:02:24,Washington Post Editorial Board Sends Heartbreaking Message To Mitch McConnell About Gun Control,https://www.huffpost.com/entry/washington-post-editorial-board-mitch-mcconnell-message_n_5d6f7559e4b0cdfe0577f4ec,en,False,"politics and government,law and legislation",96720,HuffPost Latino Voices,http://voces.huffingtonpost.com/#spider
1382735345,2019-09-03 19:26:06,"14-year-old boy who confessed to killing 5 family members charged with murder, police say",http://rssfeeds.cincinnati.com/~/606414500/0/cincinnati-highschoolsports~yearold-boy-who-confessed-to-killing-family-members-charged-with-murder-police-say/,en,False,"crime and criminals,children and youth,murders and attempted murders,serial murders",26590,cincinnati.com,http://cincinnati.com
1382762255,2019-09-04 06:11:52,"5 things to know for September 4: Dorian, boat fire, Brexit, Walmart & guns, Yemen",http://rss.cnn.com/~r/rss/cnn_latest/~3/_mIA3KR5yaU/index.html,en,False,"hurricanes and tropical storms,hurricane katrina,floods,rescues",1095,CNN,http://www.cnn.com/
1382772812,2019-09-04 06:06:06,Texas attack draws intertwined cities even closer,http://rssfeeds.azcentral.com/~/606428708/0/phoenix/nation~Texas-attack-draws-intertwined-cities-even-closer/,en,False,quotation of the day,25128,AZCentral,http://www.azcentral.com
1382785431,2019-09-04 06:16:59,"US briefing: Bahamas storm tragedy, Brexit drama and Hong Kong",https://www.theguardian.com/us-news/2019/sep/04/us-briefing-bahamas-storm-tragedy-brexit-drama-hong-kong,en,False,"weather,hurricanes and tropical storms,floods",1751,Guardian US,https://www.theguardian.com/us
1382794805,2019-09-04 06:16:59,"US briefing: Bahamas storm tragedy, Brexit drama and Hong Kong",https://www.theguardian.com/us-news/2019/sep/04/us-briefing-bahamas-storm-tragedy-brexit-drama-hong-kong,en,False,"weather,hurricanes and tropical storms,floods",623382,Guardian,http://www.theguardian.com/us
1382832238,2019-09-04 07:38:00,"10 things you need to know today: September 4, 2019
",https://theweek.com/10things/853066/10-things-need-know-today-september-4-2019,en,False,hurricanes and tropical storms,21542,The Week,http://theweek.com
1382859061,2019-09-04 07:57:00,"The daily business briefing: September 4, 2019
",https://theweek.com/business-briefing/853174/daily-business-briefing-september-4-2019,en,False,"politics and government,law and legislation",21542,The Week,http://theweek.com
1382864059,2019-09-04 05:20:00,If we actually told the truth about guns,https://www.norwichbulletin.com/opinion/20190904/if-we-actually-told-truth-about-guns?rssfeed=true,en,False,"law and legislation,gun control",74242,norwichbulletin.com,http://www.norwichbulletin.com/#spider
1382921771,2019-09-03 18:53:45,There's no holiday break for gun violence in America,http://www.startribune.com/there-s-no-holiday-break-for-gun-violence-in-america/559296302/,en,False,"politics and government,law and legislation,united states politics and government,murders and attempted murders",19,Star Tribune ,http://www.startribune.com/
1382920397,2019-09-04 09:13:39,"Kroger Joins Walmart, Asks Customers To Stop Openly Carrying Guns In Store",https://www.forbes.com/sites/isabeltogoh/2019/09/04/kroger-joins-walmart-asks-customers-to-stop-openly-carrying-guns-in-store/,en,True,"law and legislation,gun control,firearms,retail stores and trade",1104,Forbes,http://www.forbes.com/
1382923608,2019-09-04 09:09:11,Kroger Joins Walmart in Asking Customers to Stop Openly Carrying Guns in Stores After Mass Shootings,http://feedproxy.google.com/~r/time/topstories/~3/uPqJ388MtsU/,en,False,"law and legislation,gun control,firearms,food",40362,time,http://www.time.com/time/
1382928797,2019-09-04 09:13:50,San Francisco officials brand NRA a ‘domestic terrorist organization’,https://www.foxnews.com/politics/san-francisco-board-brands-nra-a-domestic-terrorist-organization,en,False,"politics and government,law and legislation,united states politics and government,gun control,terrorism,firearms",1092,Fox News,http://www.foxnews.com/
1382932543,2019-09-04 09:11:33,‘The View’ Star Meghan McCain Trolled On Instagram After First Show Of Seson,http://feeds.inquisitr.com/~r/google/yDYq/~3/XmaEJ52kt0E/,en,False,"law and legislation,television,gun control,firearms",26924,Inquisitr,http://www.inquisitr.com
1382936978,2019-09-04 06:06:06,Texas attack draws intertwined cities even closer,http://rssfeeds.usatoday.com/~/606428708/0/usatodaycomnation-topstories~Texas-attack-draws-intertwined-cities-even-closer/,en,False,quotation of the day,4,USA Today,http://www.usatoday.com
1382945566,2019-09-04 07:04:16,Walmart introduces new gun restrictions but will they help?,https://www.google.com/url?rct=j&sa=t&url=https://www.tampabay.com/news/nation-world/2019/09/04/walmart-introduces-new-gun-restrictions-but-will-they-help/&ct=ga&cd=CAIyGjUwNWU3NGI2NWFiYWI5NjY6Y29tOmVuOlVT&usg=AFQjCNGLVNZK7EEK21e7ns9F8atG8Nf7AA,en,True,"law and legislation,gun control,firearms,sales,retail stores and trade",22,Tampa Bay Times,http://www.tampabay.com/
1382954492,2019-09-04 07:36:17,The Cybersecurity 202: Huawei accuses U.S. government of hacking it and threatening its employees,https://www.washingtonpost.com/news/powerpost/paloma/the-cybersecurity-202/2019/09/04/the-cybersecurity-202-huawei-accuses-u-s-government-of-hacking-it-and-threatening-its-employees/5d6e9f9e602ff171a5d733b6/,en,False,"computers and the internet,espionage",2,Washington Post,http://washingtonpost.com
1382954496,2019-09-04 07:31:45,The Health 202: Michigan ban highlights threat of flavored e-cigarettes to young people,https://www.washingtonpost.com/news/powerpost/paloma/the-health-202/2019/09/04/the-health-202-michigan-ban-highlights-threat-of-flavored-e-cigarettes-to-young-people/5d6ed1f688e0fa7bb93a8905/,en,False,"education and schools,medicine and health,diseases and conditions,food,smoking and tobacco",2,Washington Post,http://washingtonpost.com
1382954488,2019-09-04 07:55:59,The Finance 202: Trump's trade war is sinking his promise to revive American manufacturing,https://www.washingtonpost.com/news/powerpost/paloma/the-finance-202/2019/09/04/the-finance-202-trump-s-trade-war-is-sinking-his-promise-to-revive-american-manufacturing/5d6ed3f5602ff171a5d733cf/,en,False,,2,Washington Post,http://washingtonpost.com
1382952616,2019-09-04 08:54:56,Gov. Greg Abbott in 'tight spot' in gun debate after Texas shootings,https://www.upi.com/Top_News/US/2019/09/04/Gov-Greg-Abbott-in-tight-spot-in-gun-debate-after-Texas-shootings/5851567600995/,en,False,"education and schools,politics and government,law and legislation,firearms,murders and attempted murders",1706,UPI,http://www.upi.com/
1382956384,2019-09-04 09:35:36,Kroger joins Walmart in asking customers to 'no longer openly carry firearms' in stores,https://www.foxnews.com/us/kroger-walmart-openly-carry-firearms-storms,en,False,"law and legislation,gun control,firearms",1092,Fox News,http://www.foxnews.com/
1382961813,2019-09-04 09:49:53,Anti-Defamation League investigating anti-Semitic fliers posted in North Bay,https://www.mercurynews.com/2019/09/04/national-anti-hate-group-investigating-north-bay-anti-semitic-flyers/,en,False,education and schools,35,San Jose Mercury News,http://www.mercurynews.com/
1382965362,2019-09-04 09:49:53,Anti-Defamation League investigating anti-Semitic fliers posted in North Bay,https://www.eastbaytimes.com/2019/09/04/national-anti-hate-group-investigating-north-bay-anti-semitic-flyers/,en,False,education and schools,27512,The Insider -,http://www.ibabuzz.com/insider/
1382981518,2019-09-04 09:36:25,NRA Rips Walmart For Banning Some Ammunition Sales,https://dailycaller.com/2019/09/04/nra-rips-walmart-banning-some-ammunition-sales/,en,False,firearms,18775,Daily Caller,http://dailycaller.com
1382998536,2019-09-04 10:15:52,NRA Is Labeled A Terrorist Organization By San Francisco’s Legislative Body,http://feeds.inquisitr.com/~r/google/yDYq/~3/s-FP0VBMZIU/,en,False,crime and criminals,26924,Inquisitr,http://www.inquisitr.com
1382998689,2019-09-04 10:20:35,Donald Trump's 'Summer of Winning' video is a loser,http://rss.cnn.com/~r/rss/cnn_latest/~3/MUuc2g0AR3o/index.html,en,False,"politics and government,united states politics and government",1095,CNN,http://www.cnn.com/
1383002534,2019-09-04 10:20:35,Donald Trump's 'Summer of Winning' video is a loser,http://rss.cnn.com/~r/rss/cnn_latest/~3/MUuc2g0AR3o/index.html,en,False,"politics and government,united states politics and government",20088,CNN U.S. Edition,http://us.cnn.com
1382984534,2019-09-04 09:48:18,Will Walmart's new ammo policy reduce guns on the street?,http://feeds.cbsnews.com/~r/CBSNewsMain/~3/hCC5pnK522k/,en,False,"gun control,firearms,sales,retail stores and trade",1752,CBS News,http://www.cbsnews.com/
1382984475,2019-09-04 10:06:44,O'Rourke campaign on false claim Odessa shooter was a supporter,http://feeds.cbsnews.com/~r/CBSNewsMain/~3/W2DtSJv_uLo/,en,False,computers and the internet,1752,CBS News,http://www.cbsnews.com/
1382982996,2019-09-04 09:53:01,Gun control advocates are outraged over a Michigan high school spending $48 million on curved hallways and 'wing-walls' to prevent mass shootings,https://www.businessinsider.com/michigan-school-spends-millions-curved-hallways-stop-mass-shootings-2019-9,en,False,"education and schools,finances",18710,Business Insider,http://www.businessinsider.com
1383020568,2019-09-04 10:47:11,How Walmart became an unlikely champion of gun safety,http://rss.cnn.com/~r/rss/cnn_latest/~3/mN0iW5YQ5_E/index.html,en,False,,1095,CNN,http://www.cnn.com/
1383026352,2019-09-04 10:47:11,How Walmart became an unlikely champion of gun safety,http://rss.cnn.com/~r/rss/cnn_latest/~3/mN0iW5YQ5_E/index.html,en,False,,20088,CNN U.S. Edition,http://us.cnn.com
1383045286,2019-09-04 10:55:48,Alexandria Ocasio-Cortez Wonders 'Why on Earth' Texas Republican Would Lend Guns to Friends Who Can't Pass Background Check,https://www.newsweek.com/aoc-crenshaw-universal-background-checks-loaning-guns-1457650?utm_source=Public&utm_medium=Feed&utm_campaign=Distribution,en,False,,1098,Newsweek ,http://www.newsweek.com/
1383047321,2019-09-04 10:52:41,"WaPo calls out McConnell for lack of action on guns, lists hundreds of names of mass shooting victims",https://www.foxnews.com/media/gun-control-second-amendment-senate,en,False,,1092,Fox News,http://www.foxnews.com/
1383059200,2019-09-04 10:55:48,Alexandria Ocasio-Cortez Wonders 'Why on Earth' Texas Republican Would Lend Guns to Friends Who Can't Pass Background Check,https://www.newsweek.com/aoc-crenshaw-universal-background-checks-loaning-guns-1457650?utm_source=Public&utm_medium=Feed&utm_campaign=Distribution,en,False,,56510,Newsweek,http://newsweek.com/
1383059374,2019-09-04 11:22:02,San Francisco City Board Labels NRA ‘Domestic Terrorist Organization’,https://dailycaller.com/2019/09/04/san-francisco-board-nra-domestic-terrorist-organization/,en,False,,18775,Daily Caller,http://dailycaller.com
1383074291,2019-09-04 11:24:28,The Daily 202: Jim Mattis’s reading list offers a jarring contrast to Trump’s lack of intellectual curiosity,https://www.washingtonpost.com/news/powerpost/paloma/daily-202/2019/09/04/daily-202-jim-mattis-s-reading-list-offers-a-jarring-contrast-to-trump-s-lack-of-intellectual-curiosity/5d6f6f0088e0fa7bb93a8919/,en,False,,2,Washington Post,http://washingtonpost.com
1383087391,2019-09-04 11:12:07,Parkland father pleads with Congress to pass background check bill,http://www.msnbc.com/hallie-jackson/watch/parkland-father-pleads-with-congress-to-pass-background-check-bill-68161605662,en,False,,359084,Superglue: MSNBC,http://www.msnbc.com/#superglue
1383097083,2019-09-04 10:32:07,A lone gunman fleeing Texas police stalked and shot people over a frenzied hour. Scanner traffic reveals the chaos,http://rssfeeds.usatoday.com/~/606435112/0/usatoday-newstopstories~A-lone-gunman-fleeing-Texas-police-stalked-and-shot-people-over-a-frenzied-hour-Scanner-traffic-reveals-the-chaos/,en,False,,4,USA Today,http://www.usatoday.com
1383123012,2019-09-04 12:19:31,"The NRA called Walmart's new stance on guns 'shameful' and predicted it would cause shoppers to flee, but a new poll shows the retail giant could benefit from the changes (WMT)",https://www.businessinsider.com/walmart-gun-policy-unlikely-to-dent-sales-new-poll-2019-9,en,False,,18710,Business Insider,http://www.businessinsider.com
1383132899,2019-09-04 12:35:46,"The White House thinks The Post ignored Trump’s summertime successes. So, about that.",https://www.washingtonpost.com/politics/the-white-house-thinks-the-post-ignored-trumps-summertime-successes-so-about-that/2019/09/04/deb6df5b-ffdc-46e7-912e-2c2be506c963_story.html,en,False,,2,Washington Post,http://washingtonpost.com
1383159530,2019-09-04 12:59:07,San Francisco just passed a resolution calling the NRA a ‘domestic terrorist organization’,https://www.washingtonpost.com/politics/san-francisco-just-passed-a-resolution-calling-the-nra-a-domestic-terrorist-organization/2019/09/04/8069985a-0593-4f0c-bd05-920d7f8f3fa2_story.html,en,False,,2,Washington Post,http://washingtonpost.com
1383189248,2019-09-04 13:00:26,Isaiah Washington Worries ‘1st and 2nd Amendment Rights’ Are Being ‘Eroded’,https://eurweb.com/2019/09/04/isaiah-washington-worries-1st-and-2nd-amendment-rights-are-being-eroded/,en,False,,25336,eurweb,http://www.eurweb.com
1383197924,2019-09-04 14:04:51,San Francisco Officials Pass Resolution Declaring NRA A Domestic Terrorist Group,https://www.huffpost.com/entry/san-francisco-nra-domestic-terrorists_n_5d6fea60e4b0cdfe0579c91e,en,False,,27502,HuffPost,http://www.huffingtonpost.com/#
1383198980,2019-09-04 14:35:23,"Reps. Ocasio-Cortez, Crenshaw clash on gun control: 'This is America outside NYC'",https://www.foxnews.com/politics/reps-ocasio-cortez-and-crenshaw-gun-control,en,False,,1092,Fox News,http://www.foxnews.com/
1383211721,2019-09-04 13:41:13,Renewed pressure for Congress to act on guns after latest mass shooting,https://www.cbsnews.com/video/renewed-pressure-for-congress-to-act-on-guns-after-latest-mass-shooting/,en,False,,1752,CBS News,http://www.cbsnews.com/
1383213864,2019-09-04 14:49:06,Couple wounded in El Paso mass shooting sues Walmart,http://feeds.reuters.com/~r/Reuters/domesticNews/~3/ODFOBdj1z0I/couple-wounded-in-el-paso-mass-shooting-sues-walmart-idUSKCN1VP2NX,en,False,,1089,Reuters ,http://www.reuters.com/
1383248562,2019-09-04 14:58:26,Couple wounded in El Paso mass shooting sues Walmart,http://feeds.reuters.com/~r/Reuters/domesticNews/~3/ODFOBdj1z0I/couple-wounded-in-el-paso-mass-shooting-sues-walmart-idUSKCN1VP2NX,en,False,,4442,Reuters,http://www.reuters.com
1383260848,2019-09-04 14:16:50,Texas Governor Resists Calls for Quick Votes After Shooting,https://www.usnews.com/news/best-states/texas/articles/2019-09-04/texas-governor-resists-calls-for-quick-votes-after-shooting,en,True,,1100,US News & World Report ,http://www.usnews.com/
1383260747,2019-09-04 14:49:06,Couple Wounded in El Paso Mass Shooting Sues Walmart,https://www.usnews.com/news/us/articles/2019-09-04/couple-wounded-in-el-paso-mass-shooting-sues-walmart,en,False,,1100,US News & World Report ,http://www.usnews.com/
1383252253,2019-09-04 14:16:21,'Do Something': Washington Post Shames Mitch McConnell with Full-Page Gun Control Op-Ed,http://feedproxy.google.com/~r/breitbart/~3/3xvmbpyK0P8/,en,False,,19334,Breitbart,http://www.breitbart.com
1383173006,2019-09-04 13:34:18,Volunteers welcome students back to high school in Bozeman,https://www.ledger-enquirer.com/news/politics-government/national-politics/article234704717.html#storylink=rss,en,False,,82483,ledger-enquirer.com,http://www.ledger-enquirer.com/#spider
1383212385,2019-09-04 09:35:23,The Daily Mauling: 9.4.2019,https://www.rockchalktalk.com/2019/9/4/20849027/kansas-jayhawks-notebook-ku-volleyball-starts-season-2-0-ku-soccer-up-to-11-in-national-polls,en,False,,86839,yardbarker,http://www.yardbarker.com/#spider
1383214702,2019-09-04 11:01:19,Kroger joins with Walmart: No more &#8220;open carry&#8221; in stores,https://hotair.com/archives/karen-townsend/2019/09/04/kroger-joins-walmart-no-open-carry-stores/,en,False,,117,Hot Air  ,http://hotair.com
1383290739,2019-09-03 14:38:24,Guns of war no more?,https://www.rollcall.com/news/opinion/guns-of-war-no-more,en,False,,19854,Roll Call,http://www.rollcall.com
1383293248,2019-09-04 09:15:46,Washington Post Runs Full-Page Editorial Calling on Mitch McConnell to &#8216;Do Something&#8217; on Gun Violence,https://www.thewrap.com/washington-post-runs-full-page-editorial-calling-on-mitch-mcconnell-to-do-something-on-gun-violence/,en,False,,18704,The Wrap,http://www.thewrap.com
1383312552,2019-09-04 16:30:00,Shannon Bream reacts to Walmart gun crackdown: 'They have such a presence in the heartland',https://www.foxnews.com/media/fox-news-shannon-bream-reacts-to-walmart-gun-crackdown-they-have-such-a-presence-in-the-heartland,en,False,,1092,Fox News,http://www.foxnews.com/
1383326429,2019-09-04 16:59:53,Meghan McCain Says &#8216;There&#8217;s Going to Be a Lot of Violence&#8217; If Guns Are Taken Away,https://people.com/tv/meghan-mccain-going-to-be-violence-guns-taken/,en,False,,300472,PEOPLE.com,http://www.people.com/people/
1383354301,2019-09-04 17:37:52,"San Francisco passes resolution calling NRA ""domestic terrorist organization""",https://www.cbsnews.com/news/san-francisco-passes-resolution-calling-nra-domestic-terrorist-organization-2019-09-04/,en,False,,1752,CBS News,http://www.cbsnews.com/
1383354511,2019-09-04 07:08:56,‘Keep our name out of your mouth’: Chicago Mayor Lori Lightfoot spars with Ted Cruz over gun control,https://www.washingtonpost.com/nation/2019/09/04/lori-lightfoot-ted-cruz-gun-control-chicago-violence/,en,False,,2,Washington Post,http://washingtonpost.com
1383385209,2019-09-04 17:58:04,Couple Injured in El Paso Mass Shooting Sues Walmart,https://www.usnews.com/news/us/articles/2019-09-04/couple-injured-in-el-paso-mass-shooting-sues-walmart,en,True,,1100,US News & World Report ,http://www.usnews.com/
1383414253,2019-09-04 19:09:36,"A Loophole in the Background Check System Let the Odessa Shooter Get a Gun. Millions of Guns Change Hands That Way, Experts Say",http://feedproxy.google.com/~r/time/topstories/~3/XH9Raiemzzw/,en,False,,40362,time,http://www.time.com/time/
1383407800,2019-09-04 19:05:00,NRA rips San Francisco Board of Supervisors after being labeled a 'domestic terrorist organization',http://rss.cnn.com/~r/rss/cnn_latest/~3/1PQfXIdFWQ0/index.html,en,False,,20088,CNN U.S. Edition,http://us.cnn.com
1383407298,2019-09-04 23:01:34,That Assault Weapon Ban? It Really Did Work,https://www.nytimes.com/2019/09/04/opinion/assault-weapon-ban.html,en,False,,1,New York Times,http://nytimes.com
1383425770,2019-09-04 19:31:53,Texas Couple Injured In El Paso Shooting Sues Walmart,https://www.huffpost.com/entry/couple-injured-el-paso-shooting-sues-walmart_n_5d7045a0e4b09bbc9ef9a6d1,en,True,,623375,Huffington Post - United States,http://www.huffingtonpost.com/?country=US
1383427234,2019-09-04 19:29:46,"AOC blasts Crenshaw over tweet about ""lending"" guns to friends",https://www.cbsnews.com/news/aoc-dan-crenshaw-background-checks-guns-twitter-2019-09-04/,en,False,,1752,CBS News,http://www.cbsnews.com/
1383432977,2019-09-04 19:30:02,Couple injured in El Paso mass shooting sues Walmart,https://www.chicagotribune.com/business/sns-bc-us--mass-shooting-texas-lawsuit-20190904-story.html,en,True,,9,Chicago Tribune,http://www.chicagotribune.com/
1383440915,2019-09-04 20:21:20,“White Fragility” Has a Whiteness Problem,https://slate.com/human-interest/2019/09/white-fragility-robin-diangelo-workshop.html?via=rss,en,False,,19643,Slate.com,http://www.slate.com
1383465248,2019-09-05 00:50:49,Stop Lying About Gun Control,https://www.nytimes.com/2019/09/04/opinion/beto-orourke-gun-control.html,en,False,,1,New York Times,http://nytimes.com
1383471517,2019-09-04 01:00:00,Red Flag Laws Spur Debate Over Due Process,http://www.pewtrusts.org/en/research-and-analysis/blogs/stateline/2019/09/04/red-flag-laws-spur-debate-over-due-process,en,False,,28467,Stateline - News about state government and politics from The Pew Center on the States,http://www.pewstates.org/projects/stateline
1383478388,2019-09-04 18:15:47,Remembering the 7 lives lost in the Odessa mass shooting,https://www.pbs.org/newshour/show/remembering-the-7-lives-lost-in-the-odessa-mass-shooting,en,False,,271188,PBS NewsHour,http://www.pbs.org/newshour/
1383498412,2019-09-04 21:22:02,San Diego truck driver among those shot in Odessa,https://www.sandiegouniontribune.com/news/border-baja-california/story/2019-09-04/college-area-truck-driver-among-those-shot-in-odessa,en,False,,268225,San Diego Union Tribune,http://sandiegouniontribune.com/
1383522649,2019-09-04 22:02:53,&apos;We need change:&apos; El Paso mass shooting survivors file lawsuit against Walmart,http://rssfeeds.azcentral.com/~/606456922/0/phoenix/nation~aposWe-need-changeapos-El-Paso-mass-shooting-survivors-file-lawsuit-against-Walmart/,en,False,,25128,AZCentral,http://www.azcentral.com
1383541276,2019-09-03 14:19:08,"Khalid benefit concert raises $500,000 for El Paso shooting victims",http://rssfeeds.usatoday.com/~/606405602/0/usatodaycommusic-topstories~Khalid-benefit-concert-raises-for-El-Paso-shooting-victims/,en,False,,4,USA Today,http://www.usatoday.com
1383546443,2019-09-04 16:11:16,Dorian should shed light on climate change | Letters,http://feeds.orlandosentinel.com/~r/orlandosentinel/news/opinion/~3/084pr6YmhJM/os-op-hurricane-dorian-climate-letters-20190904-lykyavil5bfafluhrsiijddgom-story.html,en,False,,38,Orlando Sentinel,http://www.orlandosentinel.com/
1383557741,2019-09-05 00:02:47,&#8216;Daily Show&#8217; Correspondent Jaboukie Young-White Has a Great Idea to Stop Gun Violence (Video),https://www.thewrap.com/jaboukie-young-white-daily-show-stop-gun-violence/,en,False,,18704,The Wrap,http://www.thewrap.com
1383615751,2019-09-05 23:58:38,"False claims blur line between mass shootings, 2020 politics",https://www.providencejournal.com/ZZ/news/20190905/false-claims-blur-line-between-mass-shootings-2020-politics?rssfeed=true,en,True,,68874,providencejournal.com,http://www.providencejournal.com/#spider
1383625339,2019-09-04 22:02:53,&apos;We need change:&apos; El Paso mass shooting survivors file lawsuit against Walmart,http://rssfeeds.usatoday.com/~/606456922/0/usatodaycommoney-topstories~aposWe-need-changeapos-El-Paso-mass-shooting-survivors-file-lawsuit-against-Walmart/,en,False,,4,USA Today,http://www.usatoday.com
1383631451,2019-09-05 23:58:38,"False claims blur line between mass shootings, 2020 politics",https://www.dispatch.com/ZZ/news/20190905/false-claims-blur-line-between-mass-shootings-2020-politics?rssfeed=true,en,True,,41,Columbus Dispatch,http://www.dispatch.com/
1383742958,2019-09-05 04:51:13,"2 El Paso victims suing Walmart
",http://www.arkansasonline.com/news/2019/sep/05/2-el-paso-victims-suing-walmart-2019090/,en,False,,56,Arkansas Democrat-Gazette ,http://www2.arkansasonline.com/
1383789179,2019-09-05 00:34:39,"False claims blur line between mass shootings, 2020 politics",https://www.sfgate.com/news/article/False-claims-blur-line-between-mass-shootings-14415214.php,en,True,,14,SF Chronicle,http://www.sfgate.com/
1383791478,2019-09-05 06:00:00,McConnell’s August of missed opportunities gives way to a fierce fall session,https://www.washingtonpost.com/powerpost/mcconnells-august-of-missed-opportunities-gives-way-to-a-fierce-fall-session/2019/09/04/1336f16e-cf46-11e9-87fa-8501a456c003_story.html,en,False,,2,Washington Post,http://washingtonpost.com
1383802197,2019-09-05 05:54:10,10 Things to Know for Today,https://www.ledger-enquirer.com/news/nation-world/article234733617.html#storylink=rss,en,False,,82483,ledger-enquirer.com,http://www.ledger-enquirer.com/#spider
1383817000,2019-09-05 06:45:32,"Americans prefer gun control, but few prioritise it",http://theconversation.com/americans-prefer-gun-control-but-few-prioritise-it-122753,en,False,,54346,Conversation,https://theconversation.com/us
1383926588,2019-09-05 08:11:03,"After Rapping About Burying His Girlfriend, Man Gets Charged With Her Murder",https://www.ibtimes.com/after-rapping-about-burying-his-girlfriend-man-gets-charged-her-murder-2822534?utm_source=Public&utm_medium=Feed&utm_campaign=Distribution,en,False,,41550,IBTimes,http://www.ibtimes.com/
1383943857,2019-09-05 05:01:38,Trump unleashed a Twitter storm as Dorian blew past Florida,https://www.google.com/url?rct=j&sa=t&url=https://www.tampabay.com/hurricane/2019/09/05/trump-unleashed-a-twitter-storm-as-dorian-blew-past-florida/&ct=ga&cd=CAIyGjUwNWU3NGI2NWFiYWI5NjY6Y29tOmVuOlVT&usg=AFQjCNHe1ztTiaiqNakxkKg7vOsZbb1XGg,en,False,,22,Tampa Bay Times,http://www.tampabay.com/
1383984471,2019-09-05 09:30:28,Woman thanks officer after Odessa shooting,https://www.cbsnews.com/video/woman-thanks-officer-after-odessa-shooting/,en,False,,1752,CBS News,http://www.cbsnews.com/
1383989247,2019-09-05 09:48:36,NRA rips San Francisco Board of Supervisors after being labeled a ‘domestic terrorist organization,https://www.eastbaytimes.com/2019/09/05/nra-rips-san-francisco-board-of-supervisors-after-being-labeled-a-domestic-terrorist-organization/,en,False,,27512,The Insider -,http://www.ibabuzz.com/insider/
1384009339,2019-09-05 06:12:00,More Failed Virtue Signaling from The Left,https://townhall.com/columnists/johndempsey/2019/09/05/more-failed-virtue-signaling-from-the-left-n2552651,en,False,,19763,townhall.com,http://townhall.com
1384050121,2019-09-05 10:20:00,Blake Lively and Ryan Reynolds donate $2 million to help protect the rights of migrant children,https://www.aol.com/article/entertainment/2019/09/05/blake-lively-and-ryan-reynolds-donate-dollar2-million-to-help-protect-the-rights-of-migrant-children/23807411/,en,False,,150985,AOL News,http://news.aol.com/
