stories_id,publish_date,title,url,language,ap_syndicated,themes,media_id,media_name,media_url
1305892850,2019-06-08 08:44:34,Openly Gay Alt-Right Figure Milo Yiannopoulos Picked As Marshal For &#8216;Straight Pride&#8217; Parade,https://www.inquisitr.com/5473465/openly-gay-alt-right-figure-milo-yiannopoulos-picked-as-marshal-for-straight-pride-parade/,en,False,homosexuality,26924,Inquisitr,http://www.inquisitr.com
1305918085,2019-06-08 09:17:41,AP FACT CHECK: Trump and the Credit and Blame Game,https://www.usnews.com/news/politics/articles/2019-06-08/ap-fact-check-trump-and-the-credit-and-blame-game,en,True,"politics and government,law and legislation,finances,united states politics and government,editorials,hurricanes and tropical storms",1100,US News & World Report ,http://www.usnews.com/
1305983290,2019-06-08 09:17:41,AP FACT CHECK: Trump and the credit and blame game,https://www.boston.com/news/politics/2019/06/08/ap-fact-check-trump-and-the-credit-and-blame-game,en,True,"politics and government,law and legislation,finances,united states politics and government,elections,editorials,hurricanes and tropical storms",15,The Boston Globe,https://www.bostonglobe.com/
1306045073,2019-06-08 11:52:41,AP fact check: Trump and the credit and blame game,https://www.pbs.org/newshour/nation/ap-fact-check-trump-and-the-credit-and-blame-game,en,False,"politics and government,law and legislation,united states politics and government,medicine and health,editorials,hurricanes and tropical storms",271188,PBS NewsHour,http://www.pbs.org/newshour/
1306123885,2019-06-08 03:03:07,Maher: 'Liberals Should Learn More About Guns',http://feedproxy.google.com/~r/breitbart/~3/6aF0ARgUq50/,en,False,"politics and government,law and legislation,united states politics and government,elections,medicine and health,presidents and presidency (us),presidential elections (us),gun control,election issues,firearms",19334,Breitbart,http://www.breitbart.com
1306131191,2019-06-08 16:24:38,New Zealand mosque massacre suspect first to face country's anti-terrorism laws,https://www.stripes.com/news/pacific/new-zealand-mosque-massacre-suspect-first-to-face-country-s-anti-terrorism-laws-1.585234,en,False,"politics and government,law and legislation,terrorism,crime and criminals,murders and attempted murders",21270,Stars and Stripes,http://www.stripes.com
1306168162,2019-06-08 17:36:21,Alexandria Ocasio-Cortez News: Why Isn't White Supremacist Violence Treated Like Terrorism?,https://www.ibtimes.com/alexandria-ocasio-cortez-news-why-isnt-white-supremacist-violence-treated-terrorism-2799044?utm_source=Public&utm_medium=Feed&utm_campaign=Distribution,en,False,"politics and government,religion and churches,islam,terrorism,crime and criminals",41550,IBTimes,http://www.ibtimes.com/
1306210628,2019-06-04 13:51:33,Gunman Out On Parole Kills 4 In Australian City Of Darwin,https://www.huffpost.com/entry/australia-darwin-shooting_n_5cf6aa2ee4b0e8085e41d095,en,True,"crime and criminals,murders and attempted murders,attacks on police",96720,HuffPost Latino Voices,http://voces.huffingtonpost.com/#spider
1306482005,2019-06-09 07:50:15,Golden Gate Bridge fills as hundreds rally to end gun violence,https://www.mercurynews.com/2019/06/09/golden-gate-bridge-fills-as-hundreds-rally-to-end-gun-violence/,en,False,"computers and the internet,advertising and marketing",35,San Jose Mercury News,http://www.mercurynews.com/
1306487432,2019-06-09 07:00:11,NY judge is apparently OK with rape of a 14-year-old girl: Readers sound off,http://rssfeeds.azcentral.com/~/602883172/0/phoenix/nation~NY-judge-is-apparently-OK-with-rape-of-a-yearold-girl-Readers-sound-off/,en,False,"books and literature,crime and criminals,sex crimes,children and youth,sentences (criminal)",25128,AZCentral,http://www.azcentral.com
1306736719,2019-06-09 16:35:56,"Trump left his Mexico critics stunned, speechless and other commentary",https://nypost.com/2019/06/09/trump-left-his-mexico-critics-stunned-speechless-and-other-commentary/,en,False,,7,New York Post,http://www.nypost.com/
1306929258,2019-06-09 07:00:11,NY judge is apparently OK with rape of a 14-year-old girl: Readers sound off,http://rssfeeds.usatoday.com/~/602883172/0/news-opinion~NY-judge-is-apparently-OK-with-rape-of-a-yearold-girl-Readers-sound-off/,en,False,"books and literature,crime and criminals,sex crimes,children and youth,sentences (criminal)",4,USA Today,http://www.usatoday.com
1306937129,2019-06-10 00:41:42,AP FACT CHECK: No sign of Trump-Mexico deal on farm goods,https://www.boston.com/news/politics/2019/06/10/ap-fact-check-no-sign-of-trump-mexico-deal-on-farm-goods,en,True,"politics and government,united states politics and government,editorials,international relations,agriculture,farmers",15,The Boston Globe,https://www.bostonglobe.com/
1306971839,2019-06-10 01:52:43,"Black Hills yaks, serious senioritis on campus, Pony Express: News from around our 50 states",http://rssfeeds.usatoday.com/~/602906642/0/usatoday-newstopstories~Black-Hills-yaks-serious-senioritis-on-campus-Pony-Express-News-from-around-our-states/,en,False,"education and schools,finances",4,USA Today,http://www.usatoday.com
1306976254,2019-06-10 01:52:43,"Black Hills yaks, serious senioritis on campus, Pony Express: News from around our 50 states",http://rssfeeds.azcentral.com/~/602906642/0/phoenix/nation~Black-Hills-yaks-serious-senioritis-on-campus-Pony-Express-News-from-around-our-states/,en,False,"education and schools,finances",25128,AZCentral,http://www.azcentral.com
1307330772,2019-06-10 10:02:27,Supreme Court rebuffs bid to expand legal protections for gun silencers,https://www.reuters.com/article/us-usa-court-guns/supreme-court-rebuffs-bid-to-expand-legal-protections-for-gun-silencers-idUSKCN1TB1PD?feedType=RSS&feedName=topNews,en,False,"politics and government,law and legislation,gun control,firearms,murders and attempted murders",4442,Reuters,http://www.reuters.com
1307445538,2019-06-10 12:12:18,Lawmakers aim for Pulse to be designated national memorial,https://www.ledger-enquirer.com/news/politics-government/national-politics/article231389168.html#storylink=rss,en,False,homosexuality,82483,ledger-enquirer.com,http://www.ledger-enquirer.com/#spider
1307447653,2019-06-10 12:12:00,Lawmakers aim for Pulse to be designated national memorial,https://www.sfgate.com/news/crime/article/Lawmakers-aim-for-Pulse-to-be-designated-national-13965384.php,en,True,"law and legislation,religion and churches,homosexuality,crime and criminals",14,SF Chronicle,http://www.sfgate.com/
1307499605,2019-06-10 12:12:00,Lawmakers aim for Pulse to be designated national memorial,http://feeds.foxnews.com/~r/foxnews/national/~3/-IidXneHJBY/lawmakers-aim-for-pulse-to-be-designated-national-memorial,en,False,homosexuality,1092,Fox News,http://www.foxnews.com/
1307530547,2019-06-10 13:51:12,The retired Dwyane Wade is still receiving accolades. Here’s the latest one,https://www.miamiherald.com/sports/nba/miami-heat/article231381568.html#storylink=rss,en,False,"awards, decorations and honors,basketball,college athletics",28,Miami Herald,http://www.miamiherald.com/
1307594980,2019-06-10 15:33:15,Lawmakers Aim for Pulse to Be Designated National Memorial,https://www.usnews.com/news/us/articles/2019-06-10/lawmakers-aim-for-pulse-to-be-designated-national-memorial,en,True,"law and legislation,homosexuality",1100,US News & World Report ,http://www.usnews.com/
1307613705,2019-06-10 16:01:08,"Statehouse, Mass General Hospital to tackle gun violence",https://www.gazettenet.com/gun-violence-Massachusetts-general-26181136,en,False,medicine and health,26140,gazettenet.com,http://www.gazettenet.com
1307634394,2019-06-10 16:31:08,"‘A rare position’: Va. Gov. Ralph Northam could wind up with great power, months after almost resigning",https://www.washingtonpost.com/local/virginia-politics/a-rare-position-va-gov-ralph-northam-could-wind-up-with-great-power-months-after-almost-resigning/2019/06/10/c2bc49d2-8873-11e9-98c1-e945ae5db8fb_story.html,en,False,,2,Washington Post,http://washingtonpost.com
1307635557,2019-06-10 12:05:55,Supreme Court rejects challenges to gun silencer laws days after Virginia Beach massacre,https://www.salon.com/2019/06/10/supreme-court-rejects-challenges-to-gun-silencer-laws-days-after-virginia-beach-massacre/,en,False,"law and legislation,gun control,firearms,murders and attempted murders",1757,Salon,http://www.salon.com/
1307899630,2019-06-11 00:04:38,A Russian journalist was arrested on drug charges. The backlash blindsided the Kremlin ,http://rss.cnn.com/~r/rss/cnn_topstories/~3/yD2Ww3lG0ws/index.html,en,False,"politics and government,news and news media,media,speech,freedom of speech and expression,demonstrations and riots",1095,CNN,http://www.cnn.com/
1308309685,2019-06-11 07:03:45,"Florida education news: Superintendent search, school security, teacher unions and more",https://www.google.com/url?rct=j&sa=t&url=https://www.tampabay.com/blogs/gradebook/2019/06/11/florida-education-news-superintendent-search-school-security-teacher-unions-and-more/&ct=ga&cd=CAIyGjUwNWU3NGI2NWFiYWI5NjY6Y29tOmVuOlVT&usg=AFQjCNHI0JR1ShILhgL9CBU3hSe1PK0G0g,en,False,"education and schools,teachers and school employees,labor",22,Tampa Bay Times,http://www.tampabay.com/
1308396832,2019-06-11 10:38:18,"The 'Black Mirror' ""Smithereens"" Ending Is Ambiguous, But Its Message Couldn't Be Clearer",https://www.bustle.com/p/the-black-mirror-smithereens-ending-is-ambiguous-but-its-message-couldnt-be-clearer-17991741,en,False,"computers and the internet,television,reviews",98755,Bustle,http://www.bustle.com/#spider
1308412315,2019-06-11 10:38:46,The Daily 202: Here’s the soundtrack of 2020. What presidential candidates’ walk-up songs say about them.,https://www.washingtonpost.com/news/powerpost/paloma/daily-202/2019/06/11/daily-202-here-s-the-soundtrack-of-2020-what-presidential-candidates-walk-up-songs-say-about-them/5cfe8c641ad2e5122b87c57e/,en,False,,2,Washington Post,http://washingtonpost.com
1308722799,2019-06-11 17:53:02,Kids give back to 1st responders & hospital staff,http://rss.cnn.com/~r/rss/cnn_us/~3/VFglr9wVPZM/,en,False,education and schools,20088,CNN U.S. Edition,http://us.cnn.com
1308771447,2019-06-11 18:37:04,Florida Lawmakers Want To Make Pulse Nightclub A National Memorial,https://www.huffpost.com/entry/florida-lawmakers-pulse-nightclub-national-memorial_n_5d0014f7e4b0e7e7816ee1d0,en,False,"law and legislation,homosexuality,crime and criminals,murders and attempted murders",96720,HuffPost Latino Voices,http://voces.huffingtonpost.com/#spider
1308789011,2019-06-11 18:37:04,Florida Lawmakers Want To Make Pulse Nightclub A National Memorial,https://www.huffpost.com/entry/florida-lawmakers-pulse-nightclub-national-memorial_n_5d0014f7e4b0e7e7816ee1d0,en,False,"law and legislation,homosexuality,crime and criminals,murders and attempted murders",623375,Huffington Post - United States,http://www.huffingtonpost.com/?country=US
1308797149,2019-06-11 18:37:04,Florida Lawmakers Want To Make Pulse Nightclub A National Memorial,https://www.huffpost.com/entry/florida-lawmakers-pulse-nightclub-national-memorial_n_5d0014f7e4b0e7e7816ee1d0,en,False,"law and legislation,homosexuality,crime and criminals,murders and attempted murders",27502,HuffPost,http://www.huffingtonpost.com/#
1308862975,2019-06-11 21:41:14,Community to honor fallen Pulse nightclub victims three years after the Orlando shooting,http://rssfeeds.usatoday.com/~/602982372/0/usatodaycomnation-topstories~Community-to-honor-fallen-Pulse-nightclub-victims-three-years-after-the-Orlando-shooting/,en,False,"politics and government,homosexuality,crime and criminals,sex crimes",4,USA Today,http://www.usatoday.com
1308909370,2019-06-12 00:16:31,Candidate Swalwell to hold Las Vegas meeting on gun violence,https://www.sacbee.com/news/politics-government/national-politics/article231462538.html#storylink=rss,en,False,"politics and government,law and legislation,elections,gun control,firearms",26,Sac Bee,http://www.sacbee.com/
1308907661,2019-06-12 00:16:03,Candidate Swalwell to Hold Las Vegas Meeting on Gun Violence,https://www.usnews.com/news/politics/articles/2019-06-12/candidate-swalwell-to-hold-las-vegas-meeting-on-gun-violence,en,True,"politics and government,law and legislation,elections,gun control,firearms",1100,US News & World Report ,http://www.usnews.com/
1308914668,2019-06-12 00:16:03,Candidate Swalwell to hold Las Vegas meeting on gun violence,https://www.sfgate.com/news/crime/article/Candidate-Swalwell-to-hold-Las-Vegas-meeting-on-13970176.php,en,True,"politics and government,elections,gun control,firearms",14,SF Chronicle,http://www.sfgate.com/
1309013124,2019-06-12 03:03:44,"Three years after the Pulse shooting, she remembers every moment",http://rss.cnn.com/~r/rss/cnn_latest/~3/d7R116--jH4/index.html,en,False,"medicine and health,death and dying",1095,CNN,http://www.cnn.com/
1309176001,2019-06-12 05:00:00,"Memories, trauma of Pulse shooting are still fresh ... after three hard years",https://www.miamiherald.com/news/state/florida/article231435878.html#storylink=rss,en,False,murders and attempted murders,28,Miami Herald,http://www.miamiherald.com/
1309232696,2019-06-12 05:00:00,"Three years after Pulse shooting, psychological wounds still raw. &#39;This isn&#39;t something that&#39;s going ...",https://www.google.com/url?rct=j&sa=t&url=https://www.tampabay.com/florida-politics/buzz/2019/06/12/three-years-after-pulse-shooting-psychological-wounds-still-raw-this-isnt-something-thats-going-to-heal-itself/&ct=ga&cd=CAIyGjUwNWU3NGI2NWFiYWI5NjY6Y29tOmVuOlVT&usg=AFQjCNEA9UpCbNEHZU4HUpuGoWT2aXvteQ,en,False,"medicine and health,murders and attempted murders",22,Tampa Bay Times,http://www.tampabay.com/
1309342178,2019-06-12 09:52:33,"On 3rd Anniversary of Pulse Shooting, Club Owner Looks Ahead to Memorial for 49 Who Died",https://people.com/crime/3rd-anniversary-pulse-shooting-nightclub-owner-memorial/,en,False,,300472,PEOPLE.com,http://www.people.com/people/
1309358869,2019-06-12 10:10:26,Pulse Shooting Survivor Brandon Wolf Explains Why He Speaks Out For Gun Policy Reform,https://www.elitedaily.com/p/pulse-shooting-survivor-brandon-wolf-explains-why-he-speaks-out-for-gun-policy-reform-17996133,en,False,,70102,elitedaily.com,http://elitedaily.com/#spider
1309418257,2019-06-12 11:20:59,Pulse Survivor: Their Deaths Mean Nothing if We Don't Honor Them with Action | Opinion,https://www.newsweek.com/orlando-florida-anniversary-mass-shooting-action-thought-prayers-1443410?utm_source=Public&utm_medium=Feed&utm_campaign=Distribution,en,False,,1098,Newsweek ,http://www.newsweek.com/
1309422569,2019-06-12 11:20:59,Pulse Survivor: Their Deaths Mean Nothing if We Don't Honor Them with Action | Opinion,https://www.newsweek.com/orlando-florida-anniversary-mass-shooting-action-thought-prayers-1443410?utm_source=Public&utm_medium=Feed&utm_campaign=Distribution,en,False,,56510,Newsweek,http://newsweek.com/
1309543383,2019-06-12 13:18:39,"The Latest: Proclamation revised to include gays, Hispanics",https://www.sfgate.com/news/crime/article/The-Latest-Proclamation-revised-to-include-gays-13971546.php,en,True,,14,SF Chronicle,http://www.sfgate.com/
1309604384,2019-06-12 14:19:07,Pete Buttigieg Remembers Pulse Shooting: ‘It Was An Attack On All Of Us’,https://www.huffpost.com/entry/pete-buttigieg-pulse-nightclub-shooting-anniversary_n_5d01269de4b0985c4196b2d7,en,False,,27502,HuffPost,http://www.huffingtonpost.com/#
1309614791,2019-06-12 14:45:06,Man who sold ammo to Vegas shooter asks for trial by judge,http://www.startribune.com/man-who-sold-ammo-to-vegas-shooter-asks-for-trial-by-judge/511194972/,en,False,,19,Star Tribune ,http://www.startribune.com/
1309627062,2019-06-12 13:34:47,Trump’s response to the Pulse shooting in 2016 gave false hope about his LGBT agenda,https://www.washingtonpost.com/politics/2019/06/12/trumps-response-pulse-shooting-gave-false-hope-about-his-lgbt-agenda/,en,False,,2,Washington Post,http://washingtonpost.com
1309639679,2019-06-12 15:14:15,Nightclub massacre anniversary elicits somber memorials,https://www.sfgate.com/news/crime/article/Floridians-remember-3-year-anniversary-of-Pulse-13971012.php,en,True,,14,SF Chronicle,http://www.sfgate.com/
1309688991,2019-06-12 16:20:12,Man who sold ammo to Vegas shooter asks for trial by judge,https://www.sfgate.com/news/crime/article/Man-who-sold-ammo-to-Vegas-shooter-asks-for-trial-13972159.php,en,True,,14,SF Chronicle,http://www.sfgate.com/
1309690048,2019-06-12 12:51:21,"Democrats Remember Pulse Nightclub Shooting, Forget Radical Islamic Terror",http://feedproxy.google.com/~r/breitbart/~3/ZKQktRMXYaI/,en,False,,19334,Breitbart,http://www.breitbart.com
1309722133,2019-06-12 16:15:44,Somber memorials on anniversary of Florida nightclub rampage,https://www.norwichbulletin.com/ZZ/news/20190612/somber-memorials-on-anniversary-of-florida-nightclub-rampage?rssfeed=true,en,True,,74242,norwichbulletin.com,http://www.norwichbulletin.com/#spider
1309723845,2019-06-12 16:15:44,Somber memorials on anniversary of Florida nightclub rampage,https://www.providencejournal.com/ZZ/news/20190612/somber-memorials-on-anniversary-of-florida-nightclub-rampage?rssfeed=true,en,True,,68874,providencejournal.com,http://www.providencejournal.com/#spider
1309723708,2019-06-12 16:15:44,Somber memorials on anniversary of Florida nightclub rampage,https://www.dispatch.com/ZZ/news/20190612/somber-memorials-on-anniversary-of-florida-nightclub-rampage?rssfeed=true,en,True,,41,Columbus Dispatch,http://www.dispatch.com/
1309774900,2019-06-12 17:26:03,The Latest: Swalwell Supports State Gun Licensing Laws,https://www.usnews.com/news/politics/articles/2019-06-12/the-latest-swalwell-supports-state-gun-licensing-laws,en,True,,1100,US News & World Report ,http://www.usnews.com/
1309954061,2019-06-12 21:22:07,"Concerns, Controversy Surround the Planned Construction of a Memorial and Museum at Pulse Nightclub, Site of 2016 Mass Shooting",http://feedproxy.google.com/~r/time/topstories/~3/66qA1loXkvY/,en,False,,4419,Time,http://time.com
1310052150,2019-06-12 23:55:11,"New Zealand massacre suspect set to enter pleas, face new terrorism charge",https://www.oann.com/new-zealand-massacre-suspect-set-to-enter-pleas-face-new-terrorism-charge/,en,False,,127733,Oan,http://oann.com/
1310055463,2019-06-12 23:50:55,"New Zealand massacre suspect set to enter pleas, face new terrorism charge",http://feeds.reuters.com/~r/Reuters/worldNews/~3/UkOvncN4Wcs/new-zealand-massacre-suspect-set-to-enter-pleas-face-new-terrorism-charge-idUSKCN1TE0BS,en,False,,4442,Reuters,http://www.reuters.com
1310058901,2019-06-12 23:50:55,"New Zealand massacre suspect set to enter pleas, face new terrorism charge",http://feeds.reuters.com/~r/Reuters/worldNews/~3/UkOvncN4Wcs/new-zealand-massacre-suspect-set-to-enter-pleas-face-new-terrorism-charge-idUSKCN1TE0BS,en,False,,1089,Reuters ,http://www.reuters.com/
1310331157,2019-06-13 06:13:27,A beloved trans woman was brutally murdered by her boyfriend. Her story reveals a nationwide problem,http://rssfeeds.usatoday.com/~/603034404/0/usatodaycomnation-topstories~A-beloved-trans-woman-was-brutally-murdered-by-her-boyfriend-Her-story-reveals-a-nationwide-problem/,en,False,,4,USA Today,http://www.usatoday.com
1310332796,2019-06-13 06:13:27,A beloved trans woman was brutally murdered by her boyfriend. Her story reveals a nationwide problem,http://rssfeeds.azcentral.com/~/603034404/0/phoenix/nation~A-beloved-trans-woman-was-brutally-murdered-by-her-boyfriend-Her-story-reveals-a-nationwide-problem/,en,False,,25128,AZCentral,http://www.azcentral.com
1310442319,2019-06-13 08:42:44,Suspected New Zealand mosque gunman first to face country’s anti-terrorism law,https://www.washingtonpost.com/world/asia_pacific/suspected-new-zealand-mosque-gunman-first-to-face-countrys-anti-terrorism-law/2019/06/13/652aaf1c-8c3c-11e9-b6f4-033356502dce_story.html,en,False,,2,Washington Post,http://washingtonpost.com
1310536755,2019-06-13 06:13:27,A beloved trans woman was brutally murdered by her boyfriend. Her story reveals a nationwide problem,http://rssfeeds.cincinnati.com/~/603034404/0/cincinnati-home~A-beloved-trans-woman-was-brutally-murdered-by-her-boyfriend-Her-story-reveals-a-nationwide-problem/,en,False,,26590,cincinnati.com,http://cincinnati.com
1310538789,2019-06-12 19:19:16,Somber memorials mark anniversary of Florida nightclub rampage,https://www.centralmaine.com/2019/06/12/somber-memorials-mark-anniversary-of-florida-nightclub-rampage/,en,False,,25755,Central Maine News,https://www.centralmaine.com/
1310586342,2019-06-13 10:21:00,The Daily 202: ‘The FBI director is wrong’: Trump’s willingness to accept foreign help keeps him at odds with Wray,https://www.washingtonpost.com/news/powerpost/paloma/daily-202/2019/06/13/daily-202-the-fbi-director-is-wrong-trump-s-willingness-to-accept-foreign-help-keeps-him-at-odds-with-wray/5d012c87a7a0a4030c3fda7b/,en,False,,2,Washington Post,http://washingtonpost.com
1310594067,2019-06-13 11:14:54,"ATF was supposed to destroy thousands of guns. Instead, a guard stole and sold them",http://rssfeeds.azcentral.com/~/603043660/0/phoenix/nation~ATF-was-supposed-to-destroy-thousands-of-guns-Instead-a-guard-stole-and-sold-them/,en,False,,25128,AZCentral,http://www.azcentral.com
1310613227,2019-06-13 11:14:54,"ATF was supposed to destroy thousands of guns. Instead, a guard stole and sold them",http://rssfeeds.usatoday.com/~/603043660/0/usatodaycomnation-topstories~ATF-was-supposed-to-destroy-thousands-of-guns-Instead-a-guard-stole-and-sold-them/,en,False,,4,USA Today,http://www.usatoday.com
1310656680,2019-06-13 12:43:09,YouTube pastor who celebrated Pulse massacre featured in ‘Make America Straight Again’ conference,https://www.dailydot.com/irl/make-america-straight-again-conference/,en,False,,366828,Daily Dot ,http://dailydot.com/
1310889670,2019-06-13 17:11:49,"Virginia Beach tries to dispel ""rumors"" about mass shooting",http://feeds.foxnews.com/~r/foxnews/national/~3/ykxzP9XWClo/virginia-beach-tries-to-dispel-rumors-about-mass-shooting,en,False,,1092,Fox News,http://www.foxnews.com/
1310925394,2019-06-13 18:22:38,Accused Christchurch Shooter Pleads Not Guilty to All Charges in New Zealand Court,https://www.usnews.com/news/world/articles/2019-06-13/accused-christchurch-shooter-pleads-not-guilty-to-all-charges-in-new-zealand-court,en,False,,1100,US News & World Report ,http://www.usnews.com/
1310937039,2019-06-13 18:16:01,Christchurch massacre: Brenton Tarrant pleads not guilty to all charges,https://www.theguardian.com/world/2019/jun/14/christchurch-massacre-brenton-tarrant-pleads-not-guilty-to-all-charges,en,False,,1751,Guardian US,https://www.theguardian.com/us
1310939372,2019-06-13 18:16:01,Christchurch massacre: Brenton Tarrant pleads not guilty to all charges,https://www.theguardian.com/world/2019/jun/14/christchurch-massacre-brenton-tarrant-pleads-not-guilty-to-all-charges,en,False,,623382,Guardian,http://www.theguardian.com/us
1310950642,2019-06-13 18:55:11,Man accused of killing 51 in Christchurch mosque attacks pleads not guilty,http://rss.cnn.com/~r/rss/cnn_topstories/~3/kp_eCguAnkA/index.html,en,False,,20088,CNN U.S. Edition,http://us.cnn.com
1310982588,2019-06-13 20:11:35,All the times Kellyanne Conway ran afoul of a federal watchdog over the Hatch Act,http://rssfeeds.azcentral.com/~/603065336/0/phoenix/nation~All-the-times-Kellyanne-Conway-ran-afoul-of-a-federal-watchdog-over-the-Hatch-Act/,en,False,,25128,AZCentral,http://www.azcentral.com
1311003588,2019-06-13 20:55:16,Accused Christchurch gunman pleads not guilty to all charges in New Zealand court,http://feeds.reuters.com/~r/Reuters/worldNews/~3/1tmfhKDCoY8/accused-christchurch-gunman-pleads-not-guilty-to-all-charges-in-new-zealand-court-idUSKCN1TE38W,en,False,,1089,Reuters ,http://www.reuters.com/
1311011936,2019-06-13 20:55:16,Accused Christchurch gunman pleads not guilty to all charges in New Zealand court,http://feeds.reuters.com/~r/Reuters/worldNews/~3/1tmfhKDCoY8/accused-christchurch-gunman-pleads-not-guilty-to-all-charges-in-new-zealand-court-idUSKCN1TE38W,en,False,,4442,Reuters,http://www.reuters.com
1311020930,2019-06-13 21:27:34,Virginia Beach tries to dispel “rumors” about mass shooting,https://www.ledger-enquirer.com/news/nation-world/article231534673.html#storylink=rss,en,False,,82483,ledger-enquirer.com,http://www.ledger-enquirer.com/#spider
1311031531,2019-06-13 20:11:35,All the times Kellyanne Conway ran afoul of a federal watchdog over the Hatch Act,http://rssfeeds.usatoday.com/~/603065336/0/usatoday-newstopstories~All-the-times-Kellyanne-Conway-ran-afoul-of-a-federal-watchdog-over-the-Hatch-Act/,en,False,,4,USA Today,http://www.usatoday.com
1311033182,2019-06-13 21:46:30,"Christchurch mosque attack suspect pleads not guilty, trial set for next year",https://www.nbcnews.com/news/world/christchurch-mosque-attack-suspect-pleads-not-guilty-trial-set-next-n1017466?cid=public-rss_20190614,en,False,,34663,NBC Breaking News,http://www.breakingnews.com#spider
1311120461,2019-06-14 01:02:32,Obsession With 1999 Attack Could Shape Columbine's Future,https://www.usnews.com/news/us/articles/2019-06-14/obsession-with-1999-attack-could-shape-columbines-future,en,True,,1100,US News & World Report ,http://www.usnews.com/
1311127302,2019-06-14 01:03:13,Obsession with 1999 attack could shape Columbine’s future,https://www.ledger-enquirer.com/news/nation-world/article231549093.html#storylink=rss,en,False,,82483,ledger-enquirer.com,http://www.ledger-enquirer.com/#spider
1311129036,2019-06-14 01:02:32,Obsession with 1999 attack could shape Columbine's future,https://www.sfgate.com/news/education/article/Obsession-with-1999-attack-could-shape-13994362.php,en,True,,14,SF Chronicle,http://www.sfgate.com/
