stories_id,publish_date,title,url,language,ap_syndicated,themes,media_id,media_name,media_url
1319849879,,Trump cements his central role in the midterms in campaign blitz: ANALYSIS,https://abcnews.go.com/Politics/heading-final-campaign-blitz-trump-cements-central-role/story?id=58849968&cid=social_twitter_tw,en,False,,39000,ABC News,http://abcnews.go.com/
1319859832,,Trump says he wants to improve background checks but budget calls for cuts,https://abcnews.go.com/Politics/president-trump-improve-background-checks-budget-calls-cuts/story?id=53216967&cid=social_twitter_abcnp,en,False,,39000,ABC News,http://abcnews.go.com/
1319895153,,Trump tells nation grieving school shooting 'We are here for you',https://abcnews.go.com/Politics/trump-addresses-nation-wake-parkland-shooting/story?id=53111058&cid=social_twitter_abcn,en,False,,39000,ABC News,http://abcnews.go.com/
1319932893,,"Who is crazier? The gunman, or those who let him buy an AR-15 rifle?",https://www.miamiherald.com/news/local/news-columns-blogs/andres-oppenheimer/article200454064.html,en,False,,28,Miami Herald,http://www.miamiherald.com/
1319936745,,NRA-backed South Florida lawmakers say gun control laws won’t prevent mass shootings,https://www.miamiherald.com/news/politics-government/article200395164.html,en,False,,28,Miami Herald,http://www.miamiherald.com/
1319937326,,What Andrew Gillum’s Midterm-Election Loss in Florida Signals for the Democratic Party,https://www.newyorker.com/news/daily-comment/what-andrew-gillums-midterms-loss-in-florida-signals-for-the-democratic-party?mbid=social_twitter,en,False,,1101,New Yorker,http://www.newyorker.com/
1319957014,,Trump's shifting stance on assault weapons,https://abcnews.go.com/US/president-trumps-shifting-stance-assault-weapons/story?id=53197912&cid=social_twitter_abcn,en,False,,39000,ABC News,http://abcnews.go.com/
1320006771,,Donald Trump stereotypes Jews in speech to Republican Jewish Coalition,https://www.miamiherald.com/news/politics-government/election/article47826975.html,en,False,,28,Miami Herald,http://www.miamiherald.com/
1320008628,,Suspect identified after 12 killed in shooting at California bar,https://abcnews.go.com/US/multiple-people-injured-reported-mass-shooting-california-bar/story?id=59050130&cid=social_twitter_abcn,en,False,,39000,ABC News,http://abcnews.go.com/
1320037023,,White House says Trump open to changes in background checks after Florida,https://abcnews.go.com/Politics/trump-supportive-efforts-update-background-check-system-florida/story?id=53197674&cid=social_twitter_abcn,en,False,,39000,ABC News,http://abcnews.go.com/
1320050038,,The Note: Republicans reach breaking point on tariffs,https://abcnews.go.com/Politics/note-republicans-reach-breaking-point-tariffs/story?id=53597366&cid=social_twitter_abcn,en,False,,39000,ABC News,http://abcnews.go.com/
1320546804,2019-06-24 12:10:03,San Jose quadruple homicide: Previous Bay Area mass shootings,https://www.mercurynews.com/2019/06/24/san-jose-quadruple-homicide-previous-bay-area-mass-shootings/,en,False,,35,San Jose Mercury News,http://www.mercurynews.com/
1320616177,2019-06-24 06:00:29,A grieving community changed Kirsten Gillibrand’s mind on guns. They are still waiting for her to deliver on her promises.,https://www.washingtonpost.com/national/a-grieving-community-changed-kirsten-gillibrands-mind-on-guns-but-it-didnt-change-much-else/2019/06/24/16694df0-f89b-41fa-b394-bc160ee27522_story.html,en,False,,2,Washington Post,http://washingtonpost.com
1320642963,2019-06-24 15:22:45,Pennsylvania Budget Cram Week Starts With Eye on Saving Cash,https://www.usnews.com/news/best-states/pennsylvania/articles/2019-06-24/pennsylvania-budget-cram-week-starts-with-eye-on-saving-cash,en,True,,1100,US News & World Report ,http://www.usnews.com/
1320664996,2019-06-24 16:35:55,Pennsylvania budget cram week starts with eye on saving cash,https://www.sfgate.com/news/article/Pennsylvania-budget-cram-week-starts-with-eye-on-14037034.php,en,True,,14,SF Chronicle,http://www.sfgate.com/
1320668084,2019-06-24 16:36:30,Pennsylvania budget cram week starts with eye on saving cash,https://www.ledger-enquirer.com/news/business/article231903058.html#storylink=rss,en,False,,82483,ledger-enquirer.com,http://www.ledger-enquirer.com/#spider
1320697128,2019-06-24 17:14:50,Richmond mayor wants to ban guns from city-owned buildings,https://www.sfgate.com/news/crime/article/Richmond-mayor-wants-to-ban-guns-from-city-owned-14036046.php,en,True,,14,SF Chronicle,http://www.sfgate.com/
1320727320,2019-06-24 17:14:50,Richmond Mayor Wants to Ban Guns From City-Owned Buildings,https://www.usnews.com/news/best-states/virginia/articles/2019-06-24/richmond-mayor-wants-to-ban-guns-from-city-owned-buildings,en,True,,1100,US News & World Report ,http://www.usnews.com/
1321061051,2019-06-25 05:00:00,One year after June 28: Failed background checks rarely result in perjury prosecutions,http://feeds.baltimoresun.com/~r/baltimoresun/business/careers/rss2/~3/tT5u11BCQlI/ac-cn-background-checks-20190625-story.html,en,False,,34,Baltimore Sun,http://www.baltimoresun.com/
1321365705,2019-06-25 05:00:00,"Aggression Detectors: The Unproven, Invasive Surveillance Technology Schools Are Using to Monitor Students",http://tracking.feedpress.it/link/9499/12203338,en,False,,20639,ProPublica,http://www.propublica.org
1321399529,2019-06-25 12:25:01,South Bend Fraternal Order of Police calls Pete Buttigieg&apos;s response to shooting &apos;divisive&apos;,http://rssfeeds.indystar.com/~/603527322/0/indystar/todaystopstories~South-Bend-Fraternal-Order-of-Police-calls-Pete-Buttigiegaposs-response-to-shooting-aposdivisiveapos/,en,False,,85390,blogs.indystar.com,http://blogs.indystar.com/#spider
1321403837,2019-06-25 12:41:21,Parkland shooting survivor David Hogg says he's been target of 7 assassination attempts,https://www.foxnews.com/us/david-hogg-parkland-shooting-survivor-assassination-attempts,en,False,,1092,Fox News,http://www.foxnews.com/
1321440760,2019-06-25 13:11:07,South Bend police organizations calls Pete Buttigieg&apos;s response to shooting &apos;divisive&apos;,http://rssfeeds.azcentral.com/~/603529680/0/phoenix/nation~South-Bend-police-organizations-calls-Pete-Buttigiegaposs-response-to-shooting-aposdivisiveapos/,en,False,,25128,AZCentral,http://www.azcentral.com
1321454774,2019-06-25 12:01:29,Police union rips Buttigieg: using shooting to score campaign points,https://hotair.com/archives/2019/06/25/police-union-rips-buttigieg-using-shooting-score-campaign-points/,en,False,,117,Hot Air  ,http://hotair.com
1321480699,2019-06-25 14:16:57,Virginia Beach considers independent shooting investigation,https://www.sfgate.com/news/crime/article/2-lawmakers-want-separate-probe-into-Virginia-14044465.php,en,True,,14,SF Chronicle,http://www.sfgate.com/
1321482357,2019-06-25 14:17:17,Virginia Beach considers independent shooting investigation,https://www.ledger-enquirer.com/news/nation-world/article231927543.html#storylink=rss,en,False,,82483,ledger-enquirer.com,http://www.ledger-enquirer.com/#spider
1321512996,2019-06-25 14:39:31,Virginia Beach considers independent shooting investigation,https://www.stripes.com/news/us/virginia-beach-considers-independent-shooting-investigation-1.587567,en,False,,21270,Stars and Stripes,http://www.stripes.com
1321612573,2019-06-25 16:22:26,Backers of a Federal Ban on 'Gun Silencers' Claim Only Murderers Use Them,http://feedproxy.google.com/~r/reason/HitandRun/~3/-lRdvNwyNCs/,en,False,,72523,Reason.com,http://reason.com/
1321640561,2019-06-25 16:55:37,David Hogg says he&#8217;s been the target of 7 assassination attempts,https://nypost.com/2019/06/25/david-hogg-says-hes-been-the-target-of-7-assassination-attempts/,en,False,,7,New York Post,http://www.nypost.com/
1321741685,2019-06-25 20:19:47,The Latest: Separate probe considered for Virginia shooting,https://www.ledger-enquirer.com/news/nation-world/article231958048.html#storylink=rss,en,False,,82483,ledger-enquirer.com,http://www.ledger-enquirer.com/#spider
1321745994,2019-06-25 20:19:47,The Latest: Separate probe considered for Virginia shooting,https://www.sacbee.com/news/nation-world/article231958048.html#storylink=rss,en,False,,26,Sac Bee,http://www.sacbee.com/
1321746788,2019-06-25 20:19:47,The Latest: Separate probe considered for Virginia shooting,https://www.miamiherald.com/news/nation-world/article231958048.html#storylink=rss,en,False,,28,Miami Herald,http://www.miamiherald.com/
1321771835,2019-06-25 19:36:25,Marine Raider who earned Silver Star for heroism during Mali hotel attack now on Capitol Hill,http://feedproxy.google.com/~r/marine-corps-times/news/your-marine-corps/~3/Oq0DP3-YRTs/,en,False,,79587,marinetimes.com,http://www.marinetimes.com/#spider
1321773719,2019-06-25 20:02:49,Trump Was Accused Of Assault Again. Half Of America Had No Idea.,https://www.huffpost.com/entry/e-jean-carroll-trump-sexual-assault-poll_n_5d12a515e4b0aa375f551aaf,en,False,,27502,HuffPost,http://www.huffingtonpost.com/#
1321791804,2019-06-25 20:02:49,Trump Was Accused Of Assault Again. Half Of America Had No Idea.,https://www.huffpost.com/entry/e-jean-carroll-trump-sexual-assault-poll_n_5d12a515e4b0aa375f551aaf,en,False,,623375,Huffington Post - United States,http://www.huffingtonpost.com/?country=US
1321796215,2019-06-25 20:02:49,Trump Was Accused Of Assault Again. Half Of America Had No Idea.,https://www.huffpost.com/entry/e-jean-carroll-trump-sexual-assault-poll_n_5d12a515e4b0aa375f551aaf,en,False,,96720,HuffPost Latino Voices,http://voces.huffingtonpost.com/#spider
1321865260,2019-06-25 19:36:25,Marine Raider who earned Silver Star for heroism during Mali hotel attack now on Capitol Hill,http://feedproxy.google.com/~r/marine-corps-times/news/your-marine-corps/~3/Oq0DP3-YRTs/,en,False,,67771,AirforceTimes,http://www.airforcetimes.com/#spider
1321865628,2019-06-25 19:36:25,Marine Raider who earned Silver Star for heroism during Mali hotel attack now on Capitol Hill,http://feedproxy.google.com/~r/marine-corps-times/news/your-marine-corps/~3/Oq0DP3-YRTs/,en,False,,70420,ArmyTimes,http://www.armytimes.com/#spider
1322285506,2019-06-26 09:08:18,David Hogg Claims He&#8217;s Faced 7 Assassination Attempts,https://dailycaller.com/2019/06/26/david-hogg-parkland-assassination-attempts/,en,False,,18775,Daily Caller,http://dailycaller.com
1322308095,2019-06-26 09:31:33,Broward County terminates two more officers for Parkland shooting response,http://rss.cnn.com/~r/rss/cnn_latest/~3/XK2yYOBJcpQ/index.html,en,False,,20088,CNN U.S. Edition,http://us.cnn.com
1322380074,2019-06-26 10:36:54,"Virginia Beach workers should be able to carry guns on the job, petition says",https://www.kansascity.com/news/nation-world/national/article231968687.html#storylink=rss,en,False,,30,Kansas City Star,http://www.kansascity.com/
1322402972,2019-06-26 06:00:22,Armed and Misogynist: How Toxic Masculinity Fuels Mass Shootings,https://www.motherjones.com/crime-justice/2019/06/domestic-violence-misogyny-incels-mass-shootings/,en,False,,1112,Mother Jones,http://www.motherjones.com/
1322402596,2019-06-26 06:55:00,Welcome to Democratic Debate Season!  ,https://www.theringer.com/2019/6/26/18759195/democratic-presidential-debate-primer-miami,en,False,,24901,Bleacher Report,http://bleacherreport.com
1322462390,2019-06-26 11:56:05,2 more deputies fired over Parkland school massacre response,https://nypost.com/2019/06/26/2-more-deputies-fired-over-parkland-school-massacre-response/,en,False,,7,New York Post,http://www.nypost.com/
1322463819,2019-06-26 11:34:27,People Are Offering ‘Thoughts And Prayers’ For NRA Spokesperson Dana Loesch After NRATV Shuts Down Production,http://feedproxy.google.com/~r/uproxx/features/~3/KDT1d90tqeE/,en,False,,68816,uproxx.com,http://www.uproxx.com/#spider
1322510082,2019-06-26 12:01:03,"AOC applauds worker walk-out, &#8220;solidarity&#8221; against kids sleeping in beds",https://hotair.com/archives/2019/06/26/aoc-applauds-worker-walk-solidarity-kids-sleeping-beds/,en,False,,117,Hot Air  ,http://hotair.com
1322586702,2019-06-26 14:20:13,Virginia Beach Employee Works To Abolish City&#8217;s Gun-Free Zone Policy,https://dailycaller.com/2019/06/26/virginia-beach-gun-free-zone/,en,False,,18775,Daily Caller,http://dailycaller.com
1322632460,2019-06-26 15:18:33,Two more deputies fired after Parkland probe,https://www.miamiherald.com/news/local/community/broward/article231984897.html#storylink=rss,en,False,,28,Miami Herald,http://www.miamiherald.com/
1322661769,2019-06-26 14:45:23,Two more deputies fired after Parkland school shooting: &apos;It was neglect of duty&apos;,http://rssfeeds.usatoday.com/~/603645344/0/usatodaycomnation-topstories~Two-more-deputies-fired-after-Parkland-school-shooting-aposIt-was-neglect-of-dutyapos/,en,False,,4,USA Today,http://www.usatoday.com
1322666319,2019-06-26 16:15:06,Madonna makes powerful statement against gun violence in 'God Control' video,http://rss.cnn.com/~r/rss/cnn_latest/~3/pDk98SF1ebk/index.html,en,False,,1095,CNN,http://www.cnn.com/
1322667528,2019-06-26 16:15:06,Madonna makes powerful statement against gun violence in 'God Control' video,http://rss.cnn.com/~r/rss/cnn_latest/~3/pDk98SF1ebk/index.html,en,False,,20088,CNN U.S. Edition,http://us.cnn.com
1322670912,2019-06-26 16:16:39,Madonna features shocking mass shooting scene in &#8216;God Control&#8217; music video,https://ew.com/music/2019/06/26/madonna-god-control-music-video-shooting-scene/,en,False,,72605,Entertainment Weekly,http://www.ew.com
1322710535,2019-06-26 17:14:00,Madonna Releases Graphic 'God Control' Music Video with Mass Shooting,https://www.tmz.com/2019/06/26/madonna-mass-shooter-music-video-god-control-pulse-nightclub/,en,False,,56051,TMZ,http://tmz.com/
1322711633,2019-06-26 17:19:37,2 More Broward Deputies Fired In Wake Of Marjory Stoneman Douglas Shooting,https://www.huffpost.com/entry/broward-deputies-fired-parkland-shooting_n_5d13bb17e4b09ad014f9e8ff,en,False,,623375,Huffington Post - United States,http://www.huffingtonpost.com/?country=US
1322721249,2019-06-26 18:03:00,Facebook Cites Mass Shooting Streamed Live on Facebook as Proof Platform Has 'Gotten Better',https://gizmodo.com/facebook-cites-mass-shooting-streamed-live-on-facebook-1835885104,en,False,,4469,Gizmodo,http://gizmodo.com
1322720868,2019-06-26 17:48:37,"Democrats focus more on victims and Republicans on perpetrators after mass shootings, study finds",https://www.washingtonpost.com/politics/democrats-focus-more-on-victims-and-republicans-on-perpetrators-after-mass-shootings-study-finds/2019/06/26/62a735e1-9bb1-42ed-b943-35defc381638_story.html,en,False,,2,Washington Post,http://washingtonpost.com
1322702533,2019-06-26 17:09:14,Madonna Protests Gun Violence in Disturbing &#8216;God Control&#8217; Video,https://www.rollingstone.com/music/music-news/madonna-god-control-video-852755/,en,False,,5521,Rolling Stone,http://www.rollingstone.com
1322722774,2019-06-26 17:19:37,2 More Broward Deputies Fired In Wake Of Marjory Stoneman Douglas Shooting,https://www.huffpost.com/entry/broward-deputies-fired-parkland-shooting_n_5d13bb17e4b09ad014f9e8ff,en,False,,96720,HuffPost Latino Voices,http://voces.huffingtonpost.com/#spider
1322733897,2019-06-26 17:02:34,Madonna calls for gun control in violent video that depicts nightclub shooting,https://www.theguardian.com/music/2019/jun/26/madonna-calls-for-gun-control-violent-video-nightclub-shooting-god-control,en,False,,623382,Guardian,http://www.theguardian.com/us
1322764571,2019-06-26 18:36:29,Virginia Beach city employee starts petition to allow firearms at work after mass shooting,https://www.foxnews.com/us/virginia-beach-city-employee-starts-petition-to-allow-employees-to-bring-firearms-to-work,en,False,,1092,Fox News,http://www.foxnews.com/
1322788855,2019-06-26 20:50:29,"Every 2020 Candidate's Gun Control Stance, In One Big List",https://www.bustle.com/p/every-2020-candidates-gun-control-stance-in-one-big-list-16796614,en,False,,98755,Bustle,http://www.bustle.com/#spider
1322727454,2019-06-26 05:46:48,Some Virginians say fighting gun violence requires more than new laws,https://www.washingtonpost.com/local/virginia-politics/some-virginians-say-fighting-gun-violence-requires-more-than-new-laws/2019/06/26/9d4b644c-9838-11e9-916d-9c61607d8190_story.html,en,False,,2,Washington Post,http://washingtonpost.com
1322879501,2019-06-26 22:54:19,Technical issues interrupt gun control question at Democratic debate,http://rssfeeds.usatoday.com/~/603671564/0/usatoday-newstopstories~Technical-issues-interrupt-gun-control-question-at-Democratic-debate/,en,False,,4,USA Today,http://www.usatoday.com
1322952132,2019-06-26 23:03:54,Democrat Debate – Elizabeth Warren: Gun Violence a ‘National Health Emergency’,http://feedproxy.google.com/~r/breitbart/~3/sVFnCq-HqnU/,en,False,,19334,Breitbart,http://www.breitbart.com
1323220727,2019-06-26 19:28:35,Ford asks Alabama car dealer to end shotgun giveaway after California shooting,http://rssfeeds.azcentral.com/~/603662854/0/phoenix/nation~Ford-asks-Alabama-car-dealer-to-end-shotgun-giveaway-after-California-shooting/,en,False,,25128,AZCentral,http://www.azcentral.com
1323258239,2019-06-27 08:21:37,The Health 202: Elizabeth Warren says she'd scrap private insurance to get Medicare-for-all,https://www.washingtonpost.com/news/powerpost/paloma/the-health-202/2019/06/27/the-health-202-elizabeth-warren-says-she-d-scrap-private-insurance-to-get-medicare-for-all/5d13e7a11ad2e552a21d5144/,en,True,,2,Washington Post,http://washingtonpost.com
1323288076,2019-06-27 06:05:36,"
        The Morning Briefing: Who Won Medals at the Woke Olympics Debate?
        ",https://pjmedia.com/trending/the-morning-briefing-who-won-medals-at-the-woke-olympics-debate/,en,False,,19082,PJ Media,http://pjmedia.com
1323396943,2019-06-23 19:00:36,Why do mass shooters choose the AR-15 style rifle?,https://www.cbsnews.com/news/ar-15-used-mass-shootings-weapon-of-choice-60-minutes-2019-06-23/,en,False,,1752,CBS News,http://www.cbsnews.com/
1323404939,2019-06-27 09:50:53,Madonna&apos;s bloody &apos;God Control&apos; music video draws mixed reactions,http://rssfeeds.usatoday.com/~/603706870/0/usatoday-lifetopstories~Madonnaaposs-bloody-aposGod-Controlapos-music-video-draws-mixed-reactions/,en,False,,4,USA Today,http://www.usatoday.com
1323660693,2019-06-27 14:30:09,"PARSONS: Americans Should Embrace Facial Data Collection By Google, Facebook And Others",https://dailycaller.com/2019/06/27/parsons-google-facebook-facial/,en,False,,18775,Daily Caller,http://dailycaller.com
1323793690,2019-06-27 19:19:00,"Va. Gov. Northam meets with federal lawmakers, no mention of blackface scandal",https://www.washingtonpost.com/local/virginia-politics/va-gov-northam-meets-with-federal-lawmakers-no-mention-of-blackface-scandal/2019/06/27/8b53b972-98e9-11e9-8d0a-5edd7e2025b1_story.html,en,False,,2,Washington Post,http://washingtonpost.com
1323825428,2019-06-27 20:18:14,"NRA to hold town hall in Virginia Beach, weeks after tragedy",https://www.ledger-enquirer.com/news/politics-government/national-politics/article232052987.html#storylink=rss,en,False,,82483,ledger-enquirer.com,http://www.ledger-enquirer.com/#spider
1323830407,2019-06-27 20:18:14,"NRA to hold town hall in Virginia Beach, weeks after tragedy",https://www.miamiherald.com/news/politics-government/national-politics/article232052987.html#storylink=rss,en,False,,28,Miami Herald,http://www.miamiherald.com/
1323831278,2019-06-27 20:17:39,"NRA to Hold Town Hall in Virginia Beach, Weeks After Tragedy",https://www.usnews.com/news/best-states/virginia/articles/2019-06-27/nra-to-hold-town-hall-in-virginia-beach-weeks-after-tragedy,en,True,,1100,US News & World Report ,http://www.usnews.com/
1324191794,2019-06-28 06:00:24,Rosario: The recent court victory against the Sandy Hook deniers has a Saintly City connection,https://www.twincities.com/2019/06/28/rosario-the-recent-court-victory-against-the-sandy-hook-deniers-has-a-saintly-city-connection/,en,False,,52,St.Paul Pioneer-Press ,http://www.twincities.com/
1324203417,2019-06-28 05:45:03,What Happens To Therapists Who Listen To Trauma All Day,https://www.huffpost.com/entry/therapists-vicarious-trauma_l_5d14d548e4b0d0a2c0ad55a5,en,False,,623375,Huffington Post - United States,http://www.huffingtonpost.com/?country=US
1324274532,2019-06-28 05:00:00,'Journalists Matter': Capital Gazette photographer and mass shooting survivor captures paper's humanity,http://feeds.baltimoresun.com/~r/baltimoresun/sports/motorracing/rss2/~3/ewbAfYWZRGQ/ac-cn-paul-photo-20190626-story.html,en,False,,34,Baltimore Sun,http://www.baltimoresun.com/
1324274529,2019-06-28 05:00:00,"Taking back control: A year later, Capital Gazette shooting survivors putting their lives, hearts back together",http://feeds.baltimoresun.com/~r/baltimoresun/sports/motorracing/rss2/~3/9cepWlTB-Z4/bs-md-shooting-anniversary-20190628-story.html,en,False,,34,Baltimore Sun,http://www.baltimoresun.com/
1324288277,2019-06-28 07:30:09,10 great places where LGBTQ history was made,http://rssfeeds.usatoday.com/~/603785546/0/usatoday-newstopstories~great-places-where-LGBTQ-history-was-made/,en,False,,4,USA Today,http://www.usatoday.com
1324591687,2019-06-28 13:50:00,"'Far richer for having known them': One year later, Capital Gazette shooting victims remembered with garden",http://feeds.baltimoresun.com/~r/baltimoresun/sports/motorracing/rss2/~3/pmeOjFFZFUk/bs-md-capital-gazette-anniversary-20190625-story.html,en,False,,34,Baltimore Sun,http://www.baltimoresun.com/
1324681798,2019-06-28 15:53:52,Capital Gazette shooting one year later: Survivors and loved ones gather to remember the victims,https://www.washingtonpost.com/local/md-politics/capital-gazette-shooting-one-year-later-survivors-and-loved-ones-gather-to-remember-the-victims/2019/06/28/2c94dd94-983f-11e9-916d-9c61607d8190_story.html,en,False,,2,Washington Post,http://washingtonpost.com
1324831961,2019-06-28 17:24:35,Pulse Shooting Survivor Calls Out Madonna over Gruesome 'God Control' Music Video,http://feedproxy.google.com/~r/breitbart/~3/HMWyryLMmHE/,en,False,,19334,Breitbart,http://www.breitbart.com
1325313815,2019-06-29 09:17:50,Trump Is the Perverse Personification of American Exceptionalism,https://truthout.org/articles/trump-is-the-perverse-personification-of-american-exceptionalism/,en,False,,22332,Truthout,http://www.truth-out.org
1325417206,2019-06-29 15:52:48,Their daughter died in Parkland. Now they’re suing the FBI for mishandling tips,https://www.miamiherald.com/news/local/community/broward/article232090417.html#storylink=rss,en,False,,28,Miami Herald,http://www.miamiherald.com/
1325980429,2019-06-30 00:52:57,"Brewers 3, Pirates 1: Brandon Woodruff becomes the first 10-game winner in National League",http://rssfeeds.jsonline.com/~/603853252/0/milwaukee/sports~Brewers-Pirates-Brandon-Woodruff-becomes-the-first-game-winner-in-National-League/,en,False,,36,Milwaukee Journal Sentinel ,http://www.jsonline.com/
1326014848,2019-06-30 14:01:04,Emma González Slams Madonna For 'God Control' Video Depicting Gun Violence,https://www.huffpost.com/entry/emma-gonzalez-madonna-god-control-guns_n_5d18c0d7e4b082e5536ad962,en,False,,623375,Huffington Post - United States,http://www.huffingtonpost.com/?country=US
1326023430,2019-06-30 05:10:12,"&#39;Sanctuary cities&#39; ban, texting while driving: These are new Florida laws that take effect July 1",https://www.google.com/url?rct=j&sa=t&url=http://www.tampabay.com/florida-politics/buzz/2019/06/28/sanctuary-cities-ban-texting-while-driving-these-are-new-florida-laws-that-take-effect-july-1/&ct=ga&cd=CAIyGjUwNWU3NGI2NWFiYWI5NjY6Y29tOmVuOlVT&usg=AFQjCNGqvU5xuixDRq-LArfsZqCq7LccRg,en,False,,22,Tampa Bay Times,http://www.tampabay.com/
1326040043,2019-06-30 13:13:18,Israeli DJ Killed in Mass Shooting During Mexican Tour,http://feedproxy.google.com/~r/breitbart/~3/xpujChU3dJc/,en,False,,19334,Breitbart,http://www.breitbart.com
1326216052,2019-06-12 16:14:17,Democrat presidential hopeful Beto O'Rourke outlines LGBTQ policy.,https://www.reuters.com/article/us-usa-election-orourke/democrat-presidential-hopeful-beto-orourke-outlines-lgbtq-policy-proposal-idUSKCN1TD16B,en,False,,4442,Reuters,http://www.reuters.com
1326311149,2019-06-17 00:00:00,"Mohamed Morsi, Egypt’s First Democratically Elected President, Dies - The New York Times",https://www.nytimes.com/2019/06/17/world/middleeast/mohamed-morsi-dead.html?module=inline,en,False,,1,New York Times,http://nytimes.com
1326444941,2019-06-15 20:00:00,"Emanuel AME church, shooting survivors form bonds with other traumatized houses of worship",https://www.postandcourier.com/church_shooting/emanuel-ame-church-shooting-survivors-form-bonds-with-other-traumatized/article_1ac7ee88-83b0-11e9-a3c8-4758aef2b687.html,en,False,,19590,Post and Courier,https://www.postandcourier.com/
1326990357,2019-06-24 12:10:56,Racial Tensions Flare at Mayor Pete Town Hall on Police Killing of Black Man,https://www.thedailybeast.com/racial-tensions-flare-at-pete-buttigieg-town-hall-on-south-bend-police-killing-of-eric-logan?ref=wrap,en,False,,1707,Daily Beast,http://www.thedailybeast.com/
1327884209,2019-06-02 00:00:00,2020 Democratic presidential candidates hope to strike gold in California,https://abcnews.go.com/Politics/2020-democratic-presidential-candidates-hope-strike-gold-california/story?id=63356699,en,False,,39000,ABC News,http://abcnews.go.com/
1330224949,2019-06-18 00:00:00,"As Trump’s defense pick withdraws, he addresses violent domestic incidents",https://www.washingtonpost.com/investigations/trumps-defense-nominee-addresses-violent-incident-between-ex-wife-son-amid-fbi-vetting-process/2019/06/18/e46009de-190b-11e9-a804-c35766b9f234_story.html?utm_term=.888007645d47,en,False,,2,Washington Post,http://washingtonpost.com
